city,company-name,date,description,employment-form,employment-schedule,experience,key_skills,max-experience,max-salary,min-experience,min-salary,name,requirements,responsibilities,days_from_publish,group
Екатеринбург,Производственное предприятие ВИЯ,2019-12-09T07:37:01+0300,"<strong>Обязанности:</strong> <ul> <li> <p>Доработка типовых конфигураций 1С КА 2.4., 1С УПП 1.3, ЗУП, БП 3.0;</p> </li> <li> <p>Поиск и исправление ошибок в существующем программном коде;</p> </li> <li> <p>Администрирование 1С;</p> </li> <li> <p>Написание отчетов и обработок, СКД;</p> </li> <li> <p>Конвертация данных;</p> </li> <li> <p>Поддержка пользователей</p> </li> </ul> <strong>Требования:</strong> <ul> <li> <p>Работа в должности программиста 1С не менее 2 лет;</p> </li> <li> <p>Хорошее знание механизмов платформы 1 С 8.3, умение быстро ориентироваться в чужом коде и вносить изменения;</p> </li> <li> <p>Опыт работы с конфигурацией 1С КА 2.4., 1С УПП 1.3, ЗУП;</p> </li> <li> <p>Владение языком запросов, СКД;</p> </li> </ul> <strong>Условия:</strong> <ul> <li>Официальное трудоустройство;</li> <li>График работы: пятидневка 9-00 до 18-00, возможно удаленно с присутствием на рабочем месте 2-3 раза в неделю;</li> <li>Заработная плата: от 100 000 рублей, проект на 3 месяца;</li> <li>Место работы: Вторчермет;</li> </ul>",Полная занятость,Полный день,От 3 до 6 лет,Без ключевых навыков,6.0,105552.08333333333,3.0,100000.0,разработчик 1с на проект,"Работа в должности программиста 1С не менее 2 лет. Хорошее знание механизмов платформы 1 С 8.3, умение быстро...","Доработка типовых конфигураций 1С КА 2.4., 1С УПП 1.3, ЗУП, БП 3.0. Поиск и исправление...",12,1с
Екатеринбург,ГК Березовский привоз,2019-12-13T08:33:51+0300,"<p>Если ты - талантливый гуру 1С, с легкостью работаешь с пользователями, устанавливаешь и настраиваешь учетные системы с закрытыми глазами! Дальше можешь не читать - просто нажми &quot;Откликнуться&quot;, т.к. мы ищем именно тебя!</p> <p>У тебя есть уникальная возможность построить карьеру и получить профессиональный рост в крупной стабильной компании.</p> <p>Группа компаний <strong>&quot;Березовский привоз&quot;</strong> - это крупнейший автомобильный комплекс, успешно работающий на автомобильном рынке УРФО более 20 лет. Мы оказываем комплексный спектр услуг для своих любимых клиентов: продажа, обмен, выкуп автомобилей и оказание сервисных услуг.</p> <p>Мы активно развиваемся, у нас грандиозные планы и нам нужны таланты, как бы банально это не звучало)</p> <p>В состав Группы компаний &quot;Берпривоз&quot; входит несколько дилерских автоцентров, сервисных центров, магазинов автозапчастей. И нам позарез нужен <strong>&quot;Программист 1С&quot;</strong>!</p> <p>Почувствовал вибрации в своей профессиональной душе? Скорее откликайся, нам нужен именно ты!</p> <p><strong>Мы предлагаем:</strong></p> <ul> <li>интересные профессиональные задачи;</li> <li>достойную заработную плату, рассматриваем пожелания соискателей;</li> <li>заработная плата всегда во время;</li> <li>официальное трудоустройство;</li> <li>график работы: 5/2 с 9:00 до 18:00;</li> <li>место работы: г.Березовский;</li> </ul> <p><strong>Обязанности:</strong></p> <ul> <li>Администрирование и сопровождение учетных систем на базе 1С</li> <li>Участие в работе по разработке новых бизнес-процессов</li> <li>Настройка и техническая поддержка процессов электронного документооборота</li> <li>Аудит работы БД 1С. Выявление ошибок в работе пользователей. Анализ соответствия бизнес процессов функционалу БД 1С</li> <li>Установка, настройка и обновление учетных систем, системы электронного документооборота, и сопутствующих программ</li> <li>Формализация требований и пожеланий заказчиков в технические задания на создание или доработку ПО в рамках информационной системы</li> <li>Определение возможности оптимизации элементов действующей системы и целесообразность доработки бизнес-процессов.</li> </ul> <strong>Требования:</strong> <ul> <li>высшее образование (желательно техническое);</li> <li>наличие дополнительного образования и сертификатов &quot;1С: Профессионал&quot;;</li> <li>опыт внедрения систем на платформе 1С 8.2; 8.3 от 3-х лет;</li> <li>умение работы с механизмами ролей в 1С;</li> <li>знание основ бухгалтерского учета;</li> <li>базовые навыки по работе с программным кодом 1С;</li> <li>опыт работы в техподдержке 1С;</li> <li>знание 1С ЗУП 3.1, 1С Бух 3.0, 1С:АА5 (будет плюсом), 1С Документооборот;</li> <li>опыт работы в автобизнесе и знакомство с программой Альфа-Авто будет вашим преимуществом;</li> <li>аналитический склад ума, стрессоустойчивость, исполнительность, желание и способность к саморазвитию и обучению.</li> <li>Преимуществом будут базовые знания: администрирования серверов 1С. AD. RDP</li> </ul> <p>Ждем вас с радостным нетерпением!</p> <p> </p> <ul> </ul>",Полная занятость,Полный день,От 3 до 6 лет,|1С: Бухгалтерия|1С: Зарплата и управление персоналом|Бухгалтерский учет,6.0,105552.08333333333,3.0,78008.84615384616,разработчик 1с,Высшее образование (желательно техническое). Наличие дополнительного образования и сертификатов &quot;1С: Профессионал&quot;. Опыт внедрения систем на платформе 1С 8...,Администрирование и сопровождение учетных систем на базе 1С. Участие в работе по разработке новых бизнес-процессов. Настройка и техническая...,8,1с
Екатеринбург,СтальТранс,2019-12-12T09:08:39+0300,"<p>Компания СТАЛЬТРАНС - это:</p> <p>Лучшая специализированная сбытовая сеть России 2019, 2018, 2017, 2016, 2014 года!<br />Лучшая металлобаза России 2015!<br />Наша Компания - это крупная Федеральная компания по дистрибуции метизной продукции. По итогам 1 полугодия 2019 года мы занимаем 4-е место в рейтинге ведущих поставщиков метизной продукции РФ.<br />Компания СТАЛЬТРАНС сегодня – это молодая и энергичная команда профессионалов, стабильно развивающаяся уже более 19 лет. Для нас продуктивный персонал - это залог успеха бизнеса!</p> <p>В связи с открытием вакансии <strong>Программист 1 С</strong>, ищем продуктивного и квалифицированного сотрудника!</p> <p><em>Вы нам подходите если у Вас есть опыт:</em></p> <ul> <li>разработки внедрения решений на платформе 1С 8.3 (Управление торговлей 10.2, Бухгалтерия предприятия 3.0, Зарплата и управление персоналом 3.1)</li> <li>самостоятельного ведения проектов, успешных внедрений продуктов на базе платформы 1С;</li> <li>работы с управляемыми формами;</li> <li>опыт работы в компаниях оптовой торговли (желательно)</li> </ul> <p><em>обладаете:</em></p> <ul> <li>навыками чтения и понимания чужого кода;</li> <li>знаниями приобретенными на профессиональных курсах (сертификаты 1С будут преимуществом);</li> <li>аналитическими навыками;</li> <li>высшим техническим образованием (желательно);</li> <li>общим пониманием бухгалтерского и управленческого учета (желательно).</li> <li>такими качествами, как ответственность, пунктуальность готовность к кропотливой работе &quot;с деталями&quot;</li> </ul> <p><em>К вашим обязанностям будет относится:</em></p> <ul> <li>Поддержание и сопровождение конфигурации 1С (Управление торговлей 10.2, Бухгалтерия предприятия 3.0, Зарплата и управление персоналом 3.1)</li> <li>Настраивать и дорабатывать конфигурации 1С: УТ, БП, ЗУП под задачи компании;</li> <li>Разработка и внедрение нового функционала, отчетов, интеграции, локализация и устранение ошибок в системах на платформе 1С 8.3 (УТ, БП, ЗУП) (как нетиповых, так и типовых решений);</li> <li>Выполнение типовых задач поддержки систем на базе 1С 8.3;</li> <li>Техническая поддержка пользователей по программным продуктам 1С: типовым конфигурациям и конфигурациям собственной разработки (консультации, помощь в решении проблем);</li> <li>Участие в проектах развития Компании;</li> <li>Автоматизация бизнес-процессов Компании на основе продуктов 1С;</li> <li>Освоение новых технологий и возможностей 1С;</li> <li>Составление инструкций для пользователей;</li> <li>Подготовка отчётности по реализованным работам, проектам, решениям;</li> <li>Установка<em> </em>обновлений программных продуктов 1С;</li> <li>Участие в тестировании и наладки программного обеспечения;</li> <li>Устранение аварийных ситуаций, связанных с повреждением программного обеспечения, баз данных;</li> <li>Обеспечение интеграции между 1С системами и другими системами;</li> </ul> <p><em>Условия сотрудничества с нашей стороны:</em></p> <ul> <li>Официальное оформление по ТК, демократичная обстановка, работа в крупной стабильной компании;</li> <li>Достойная заработная плата;</li> <li>График работы 5/2 с 8:00 до 17:00, сб и вс – выходные;</li> <li>Возможности для профессионального и карьерного роста;</li> <li>Обучение на условиях софинансирования;</li> <li>Современный комфортный офис, удобное рабочее место, (ДД «Филитць», Энгельса)</li> </ul> <p><em>P.S. есть возможность работы удаленно (обсуждается на собеседовании)</em></p> <p> </p>",Полная занятость,Полный день,От 1 года до 3 лет,|TDD|BDD|1 с программирование|Разработка ПО,3.0,105552.08333333333,1.0,85000.0,разработчик 1с,Навыками чтения и понимания чужого кода. Знаниями приобретенными на профессиональных курсах (сертификаты 1С будут преимуществом). Аналитическими навыками. ,"Разработки внедрения решений на платформе 1С 8.3 (Управление торговлей 10.2, Бухгалтерия предприятия 3.0, Зарплата и управление...",9,1с
Екатеринбург,Покровский Пассаж,2019-12-10T08:11:30+0300,"<p>В отдел Информационных Технологий требуется Программист 1С.</p> <p>Требования:</p> <ul> <li>Опыт программирования и работы с платформой 1С от года;</li> <li>1С Бухгалтерия, 1С Торговля.</li> </ul> <p>Обязанности:</p> <ul> <li>сопровождение программы 1С;</li> <li>оперативная поддержка пользователей;</li> <li>доработка инструментов 1С;</li> <li>внедрение решений 1С;</li> <li>поддержка серверов 1С.</li> </ul> <p>Условия:</p> <ul> <li>работа в крупной стабильной компании в центре города;</li> <li>пятидневная рабочая неделя, с 9-00 до 18-00;</li> <li>оклад 70 000 рублей.</li> </ul> <p> </p>",Полная занятость,Полный день,От 1 года до 3 лет,|опыт программирования|1С программирование|1С: Комплексная автоматизация|1С: Управление Производственным Предприятием|MS SQL Server|1С: Торговля и склад|Управленческий учет,3.0,105552.08333333333,1.0,70000.0,разработчик 1с,"Опыт программирования и работы с платформой 1С от года. 1С Бухгалтерия, 1С Торговля.",Сопровождение программы 1С. Оперативная поддержка пользователей. Доработка инструментов 1С. Внедрение решений 1С. Поддержка серверов 1С.,11,1с
Екатеринбург,Компания «Экосистема»,2019-11-27T12:12:23+0300,"<p>Транспортная компания &quot;Экосистема&quot;, приглашает на работу инженера-программиста 1С.</p> <p>Мы расширяем IT-отдел и ждем кандидатов</p> <p><strong>Обязанности</strong></p> <p>· Проектирование модулей в системе 1С Предприятие 8.3.</p> <p>· Решение задач по автоматизации бизнес-процессов компании на базе конфигураций 1С, поддержка и разработка типовых и нетиповых конфигураций.</p> <p>Сбор и анализ требований по доработке.</p> <p>· Настройка обмена и синхронизации с другими БД, ПО и web-сервисами;</p> <p>· Сопровождение конфигураций 1С БП 3.0, ЗУП 3.1.</p> <p><strong>Требования</strong></p> <p>· Программирование на платформе 1С от 3-х лет.</p> <p>· Высшее образование.</p> <p>· Наличие практического опыта доработки одной из конфигураций 1С: ERP, ред.2, УТ ред.11, КА ред.2</p> <p>· Понимание клиент-серверной архитектуры.</p> <p>· Опыт написания правил обмена данными между конфигурациями.</p> <p><strong>Условия:</strong></p> <p>· трудоустройство согласно ТК РФ, заработная плата &quot;белая&quot;</p> <p>· уровень заработной платы обсуждается с финальными кандидатами</p> <p>· насыщенная корпоративная жизнь.</p> <p>· современный и удобный офис на Эльмаше (Шефская 2А, корп 9)</p> <p><strong>Сегодня компания «Экосистема» - это динамично развивающееся предприятие, современный, надежный работодатель (входит в группу компаний &quot;ТрансСервис&quot;, штат сотрудников более 900 человек, 10 филиалов на территории России, высокие стандарты качества, современные и автоматизированные бизнес-процессы).</strong></p> <p><strong>Компания гарантирует своим сотрудникам:</strong></p> <ul> <li>Перспективы профессионального и карьерного роста;</li> <li>Обучение и развитие;</li> <li>Работу в целеустремленном и компетентном коллективе;</li> <li>Работу в атмосфере крепкого корпоративного духа и ценностей;</li> <li>Возможность вносить вклад в развитие компании;</li> <li>Достойную и своевременную оплату труда;</li> <li>Полное соблюдение норм Трудового кодекса.</li> </ul> <p>Добро пожаловать в нашу команду !</p>",Полная занятость,Полный день,От 1 года до 3 лет,Без ключевых навыков,3.0,105552.08333333333,1.0,80000.0,разработчик 1с,Программирование на платформе 1С от 3-х лет. Высшее образование. Наличие практического опыта доработки одной из конфигураций 1С...,Проектирование модулей в системе 1С Предприятие 8.3. Решение задач по автоматизации бизнес-процессов компании на базе конфигураций 1...,24,1с
Екатеринбург,Хорека Сервис,2019-11-24T09:14:58+0300,"<p><strong>Обязанности:</strong></p> <p>-Доработка и сопровождение конфигураций;<br />-Написание отчетов и обработок на платформе 1С 8.х (Управление торговлей 11, Бухгалтерия предприятия КОРП 2.0);<br />-Консультации пользователей;</p> <p><strong>Требования:</strong></p> <p>-Умение разбираться в чужом коде;<br />-Ответственный подход к работе;<br />-Опыт работы с конфигурациями “Управление торговлей”, “Бухгалтерия предприятия”;</p> <p><strong>Условия:</strong></p> <ul> <li>официальное трудоустройство с полным соц. пакетом + ДМС</li> <li>график работы с 09:00 до 18:00</li> <li>есть служебный транспорт из г. Березовский и г. Екатеринбург</li> <li>район работы : промзона Ново-Свердловская ТЭЦ</li> <li>работа на современном, многофункциональном, логистическом терминале</li> </ul>",Полная занятость,Полный день,От 1 года до 3 лет,|1С программирование|1С: Бухгалтерия|1С: Зарплата и управление персоналом|1С: Управление Торговлей,3.0,105552.08333333333,1.0,90000.0,ведущий разработчик 1с,"Умение разбираться в чужом коде. -Ответственный подход к работе. -Опыт работы с конфигурациями “Управление торговлей”, “Бухгалтерия предприятия”.","Доработка и сопровождение конфигураций. -Написание отчетов и обработок на платформе 1С 8.х (Управление торговлей 11, Бухгалтерия предприятия КОРП...",27,1с
