city,company-name,date,description,employment-form,employment-schedule,experience,key_skills,max-experience,max-salary,min-experience,min-salary,name,requirements,responsibilities,days_from_publish,group
Екатеринбург,Уралэнерготел,2019-11-20T06:38:26+0300,"<p>ООО &quot;Уралэнерготел&quot; в связи с расширением и развитием направлений работ производит внедрение у себя комплексных систем автоматизации производственной деятельности на базе продуктов 1С:Управление торговлей (УТ), 1С:Бухгалтерия КОРП (Бух), 1С:Зарплата и управление персоналом КОРП (ЗУП) и портала Битрикс24. Для поддержки эксплуатации этих систем мы ищем специалиста, не боящегося трудностей по сопровождению взаимосвязанного комплекса конфигураций 1С, участия в разработке/доработке новых модулей на платформах 1С и Битрикс24.</p> <p><strong>Обязанности:</strong></p> <ul> <li>Выполнение регламентных работ по обновлениям платформы и конфигураций</li> <li>Контроль и корректировка оперативной синхронизации между БД</li> <li>Оперативная поддержка пользователей комплекса 1С</li> <li>Работа с ошибками в программном комплексе 1С</li> <li>Регламентные работы по поддержанию среды разработки конфигураций 1С на предприятии: поддержка хранилища конфигураций, создание и поддержание копий БД для разработки и тестирования</li> <li>Участие в промежуточном тестировании разработок/доработок к конфигурациям (альфа- и бета-тестирование).</li> <li>Контроль документирования разработок/доработок комплекса внешними разработчиками</li> <li>Актуализация &quot;документальной истории&quot; комплекса информационных систем предприятия</li> </ul> <strong>Требования:</strong> <ul> <li>Высшее техническое или экономическое образование.</li> <li>Опыт сопровождения аналогичного взаимосвязанного комплекса ПО 1С – от 1 года.</li> <li>Хорошие коммуникационные навыки – умение общаться с людьми, задавать вопросы и слышать на них ответы, формулировать свои мысли.</li> <li>Хорошие аналитические способности – умение обрабатывать большой объем информации и выделять главное.</li> <li>Стрессоустойчивость.</li> <li>Опыт собственной разработки/доработки и тестирования конфигураций на платформе 1С.</li> <li>Понимание основ экономики и процессов производственного предприятия или инжиниринговой компании.</li> </ul> <strong>Условия:</strong> <ul> <li>Официальное трудоустройство;</li> <li>График работы с 08:00 до 17:00;</li> <li>Возможность карьерного роста;</li> <li>Корпоративное обучение сотрудников;</li> <li>Доброжелательный коллектив;</li> <li>З/п по результатам собеседования.</li> </ul>",Полная занятость,Полный день,От 1 года до 3 лет,|1С: Зарплата и управление персоналом|1С: Управление Торговлей|1С: Бухгалтерия|1С: Предприятие 8|1С: Управление персоналом|Обновление конфигурации 1С,3.0,105552.08333333333,1.0,78008.84615384616,специалист технической поддержки ис 1с,Высшее техническое или экономическое образование. Опыт сопровождения аналогичного взаимосвязанного комплекса ПО 1С – от 1 года. Хорошие коммуникационные навыки – умение...,Выполнение регламентных работ по обновлениям платформы и конфигураций. Контроль и корректировка оперативной синхронизации между БД. Оперативная поддержка пользователей комплекса 1...,31,1с
Екатеринбург,Группа Синара,2019-12-12T08:51:20+0300,"<p>В управляющую компанию финансово-промышленного холдинга Группа Синара требуется <strong>ведущий программист в отдел внедрения программного обеспечения 1С</strong></p> <p><strong>Обязанности:</strong></p> <ul> <li>Внедрение 1С:ERP Управление предприятием 2</li> <li>Интеграция 1С с внешними системами</li> <li>Сбор и анализ требований по доработке конфигураций 1С</li> <li>Проектирование в 1С:Предприятие 8.3</li> <li>Программирование в 1С:ERP Управление предприятием 2</li> <li>Разработка руководства пользователя.</li> </ul> <strong>Требования:</strong> <ul> <li>Высшее профильное образование</li> <li>Владение ПК: программа 1С: ERP или 1С: Бухгалтерия предприятия, 1С: ЗУП, 1С: Управление торговлей</li> <li>Опыт внедрения 1C. ERP или 1С: Бухгалтерия предприятия, 1С:УПП, 1С: ЗУП</li> <li>Приветствуются специальные знания и навыки: знание бухгалтерского, управленческого учёта, бюджетирования, учёта затрат</li> </ul> <strong>Условия:</strong> <ul> <li>Работа в крупной, стабильной холдинговой структуре</li> <li>Официальная заработная плата, расширенный социальный пакет (дотация на питание, оплата спорта, обучение и повышение квалификации )</li> <li>Возможности для профессионального и карьерного роста</li> </ul>",Полная занятость,Полный день,От 3 до 6 лет,|1C: Бухгалтерия|1C: Зарплата и кадры|1С: Предприятие 8|ERP|1С: Зарплата и управление персоналом|1С: Управление Производственным Предприятием,6.0,105552.08333333333,3.0,78008.84615384616,разработчик 1с:erp,"Высшее профильное образование. Владение ПК: программа 1С: ERP или 1С: Бухгалтерия предприятия, 1С: ЗУП, 1С: Управление...",Внедрение 1С:ERP Управление предприятием 2. Интеграция 1С с внешними системами. Сбор и анализ требований по доработке конфигураций...,9,1с
Екатеринбург,Газпромбанк,2019-11-24T00:56:07+0300,"<strong>Обязанности:</strong> <ul> <li>Участие в разработке и внедрении новой АС Банка на платформе 1С (новый web-сервис для клиентов Банка);</li> <li>Участие в разработке и сопровождении автоматизированной банковской системы на базе 1С:Документооборот;</li> <li>Планирование развития логики программы 1С с учетом потребностей Банка;</li> <li>Проектирование и реализация решений в части интеграции с другими АС Банка;</li> <li>Проведение первичного тестирования выполненных доработок автоматизированных систем перед передачей на приемку;</li> <li>Подготовка выполненных доработок (исправлений) автоматизированных систем для установки на тестовый или промышленный стенд;</li> <li>Мониторинг производительности разработанных программных продуктов, решение задач и принятие соответствующих мер в целях повышения производительности;</li> <li>Выполнение функций 3-линии поддержки при сопровождении разработанных и внедренных автоматизированных систем на 1С, обеспечение технической поддержки пользователей, сотрудников Банка по вопросам, связанных с эксплуатацией программных продуктов;</li> <li>Взаимодействие с различными структурными подразделениями Банка для решения задач.</li> </ul> <strong>Требования:</strong> <ul> <li>Высшее образование;</li> <li>Стаж работы по требуемому направлению от 3-х лет;</li> <li>Опыт программирования в 1С 8.3 не менее 3-х лет;</li> <li>Опыт анализа, оценки и оптимизации производительности системы;</li> <li>Опыт работы в проектах, требующих интеграции 1С с внешними системами;</li> <li>Опыт работы с JSON,XML, XSD;</li> <li>Желателен опыт работы разработки или применения HTTP-сервисов, понимание RESTful архитектуры;</li> <li>Желателен опыт разработки на Javascript; опыт работы с PostgreSQL;</li> <li>Умение разбираться в чужом коде;</li> <li>Способность работать в команде;</li> <li>Стрессоустойчивость;</li> <li>Способность к анализу, сертификации, систематизации;</li> <li>Инициативность.</li> </ul> <strong>Условия:</strong> <ul> <li>Работа в подразделении входящем в состав Головного офиса Банка;</li> <li>Работа в одном из крупнейших банков РФ (ТОП - 3);</li> <li>Оформление в соответствии с ТК РФ;</li> <li>Достойный уровень оплаты труда;</li> <li>Расширенный социальный пакет;</li> <li>Предоставление полиса ДМС.</li> </ul>",Полная занятость,Полный день,От 3 до 6 лет,|XML|JSON|Проведение тестирований|Cистемы управления базами данных|MS Visual Basic,6.0,105552.08333333333,3.0,78008.84615384616,разработчик 1с,Высшее образование. Стаж работы по требуемому направлению от 3-х лет. Опыт программирования в 1С 8.3 не менее...,Участие в разработке и внедрении новой АС Банка на платформе 1С (новый web-сервис для клиентов Банка). ,27,1с
Екатеринбург,Взлет-Тюмень,2019-12-12T14:08:16+0300,"<p>Немного о нас:</p> <p><strong>&quot;Взлет-Тюмень&quot; представительство АО &quot;ВЗЛЕТ&quot; (г. Санкт-Петербург) в УРФО.</strong></p> <p>Группа компаний «Взлет» — ведущее российское производственное предприятие, лидер в разработке и производстве приборов учета расхода жидкостей, газа и тепловой энергии.</p> <p>В г. Тюмень под <strong>собственным брендом «Нео-Терм»</strong>, разрабатываются и производятся изделия полной заводской готовности: автоматизированные тепловые пункты, насосные станции, шкафы электроуправления, готовые решения в блок-боксах.</p> <p>В связи с расширением штата мы рады пригласить к нам <strong>разработчика 1С</strong> с желанием работать и развиваться в нашей компании.</p> <p><strong>Обязанности:</strong></p> <ul> <li>Сопровождение, доработка, администрирование конфигураций на платформе 1С: Предприятие (КА, ДО).</li> <li>Разработка нового и изменение существующего функционала конфигураций.</li> <li>Интеграция 1С с 1С и с внешними системами.</li> <li>Консультирование пользователей при возникновении задач и рабочих вопросов.</li> </ul> <p><strong>Требования:</strong></p> <ul> <li>Знание языка запросов.</li> <li>Опыт разработки в клиент-серверном режиме, умение работать с обычными и управляемыми формами.</li> <li>Опыт работы с СКД.</li> <li>Опыт работы с типовыми конфигурациями 1:С.</li> <li>Знание механизмов интеграции 1С.</li> </ul> <p><strong>Условия:</strong></p> <ul> <li>корпоративная мобильная связь, оборудованное рабочее место, уютный светлый офис.</li> <li>интересные задачи;</li> <li>официальное трудоустройство в соответствии с ТК РФ;</li> <li>пятидневная рабочая неделя с 8:30 до 17:30;</li> <li><strong>Рабочее место находится по адресу ул. Московская.</strong></li> <li>работа в стабильно развивающейся компании в г. Екатеринбург.</li> </ul>",Полная занятость,Полный день,От 1 года до 3 лет,|1С: Предприятие 8|1С программирование|1С: Производство|1С: Розница|1С: Документооборот,3.0,105552.08333333333,1.0,75000.0,разработчик 1с,"Знание языка запросов. Опыт разработки в клиент-серверном режиме, умение работать с обычными и управляемыми формами. Опыт работы с СКД. ","Сопровождение, доработка, администрирование конфигураций на платформе 1С: Предприятие (КА, ДО). Разработка нового и изменение существующего функционала конфигураций. ",8,1с
Екатеринбург,ALP Group,2019-12-11T11:59:36+0300,"<p>Наша Компания осуществляет автоматизацию процессов учета, управления и планирования для крупных корпораций нефтяного сектора, химического, энергетического и других компаний (Газпром нефть, Роснефть, Уралкалий, Сибнефть и др.). Автоматизацию, которую мы проводим, является крупнейшей в стране, уникальной по своей архитектуре, с использованием передовых ИТ-технологий.</p> <p> </p> <p>Сейчас мы осуществляем развитие нескольких крупных проектов и запуск новых направлений. В связи с этим мы находимся в поисках специалистов по направлениям 1С: БП, ДО, УТ, ERP, УХ, которым интересны амбициозные и интересные задачи.</p> <p> </p> <p><strong>Чем предстоит заниматься:</strong></p> <p>• Приёмка Технического задания у аналитика-консультанта;</p> <p>• Доработка конфигураций 1С на основе Технического задания (разработка на основе БСП, «0» или типовой конфигурации);</p> <p>• Создание собственных решений и разработок;</p> <p>• Сложные обновления, переносы данных, переходы на новые конфигурации;</p> <p>• Согласование процедуры тестирования с аналитиком-консультантом;</p> <p>• Решение проблем‚ возникающих в ходе работы АС;</p> <p>• Подготовка программы и методики испытаний.</p> <p> </p> <p><strong>Мы ждём от кандидата:</strong></p> <p>• Опыт работы с платформой 1Сv8 не менее года (обязательно);</p> <p>• Опыт разработки на управляемых формах;</p> <p>• Опыт разработки SQL запросов (обязательно);</p> <p>• Опыт работы с СКД (обязательно);</p> <p>• Опыт групповой разработки на платформе 1С (желательно);</p> <p>• Опыт разработки регламентных и фоновых заданий (желательно);</p> <p>• Опыт работы с распределенными базами и обменами данными с внешними системами (желательно);</p> <p>• Наличие сертификатов 1С (желательно).</p> <p> </p> <p><strong>Мы предлагаем:</strong></p> <p>• Работу в крупной, стабильной компании, в комфортном офисе (без разъездов);</p> <p>• Достойный уровень заработанной платы (определяется по итогам собеседования), дополнительные годовые премии;</p> <p>• Соц.пакет: ДМС;</p> <p>• Оформление полностью по ТК (с первого рабочего дня);</p> <p>• Выстроенную модель развития сотрудников в компании;</p> <p>• Регулярное повышение квалификации за счет компании, оплату дополнительного обучения;</p> <p>• Колоссальные возможности для профессионального и карьерного роста, на крупнейших проектах в стране;</p> <p>• Отличный, профессиональный коллектив;</p> <p>• Корпоративные мероприятия;</p> <p>• Вкусный кофе, чай, сладости)).</p>",Полная занятость,Полный день,От 1 года до 3 лет,Без ключевых навыков,3.0,105552.08333333333,1.0,78008.84615384616,разработчик 1с,Опыт работы с платформой 1Сv8 не менее года (обязательно). Опыт разработки на управляемых формах. Опыт разработки SQL запросов...,"Приёмка Технического задания у аналитика-консультанта. Доработка конфигураций 1С на основе Технического задания (разработка на основе БСП, «0» или...",10,1с
