city,company-name,date,description,employment-form,employment-schedule,experience,key_skills,max-experience,max-salary,min-experience,min-salary,name,requirements,responsibilities,days_from_publish
Новосибирск,Wellink,2019-12-12T11:17:08+0300,"<p><strong>Веллинк – ведущий российский разработчик программного обеспечения.</strong></p> <p>Мы работаем с национальными операторами связи и крупнейшими государственными и коммерческими структурами. Наши партнеры - это ведущие мировые производители оборудования и программного обеспечения.</p> <p>В связи расширением открываем набор на позицию Java Developer и ищем талантливых, высоко мотивированных людей, чтобы продолжить нашу успешную историю вместе!</p> <p><strong>В круг ваших обязанностей будет входить:</strong></p> <ul> <li>Разработка новой функциональности.</li> <li>Поддержка работоспособности системы.</li> <li>Разработка unit тестов.</li> <li>Участие в обсуждении новой функциональности.</li> </ul> <p>Если вы фанат своего дела, умеете и любите работать в команде, готовы докопаться до сути любой проблемы и быстро осваивать новые подходы и технологии, то скорей всего вы нам подходите.</p> <p><strong>Требования</strong>:</p> <ul> <li>Знание J2SE (необходимо будет подтвердить на собеседовании).</li> <li>Хорошее знание J2EE платформы. В частности приветствуется опыт работы со следующими технологиями: Hibernate, Spring, Servlets, JSP.</li> <li>Уверенное знание SQL и опыт работы хотя бы с одной из перечисленных ниже СУБД (PostgreSQL, Oracle, MSSQL, MySQL или другой промышленной СУБД).</li> <li>Знание основ UML и объектно-ориентированного анализа и проектирования.</li> <li>Опыт работы с системами контроля версия (CVS, SVN).</li> <li>Опыт написания unit - тестов.</li> <li>Технический английский на уровне чтения документации.</li> <li>Опыт работы в качестве J2EE разработчика от 2х лет.</li> </ul> <p><strong>Приветствуется:</strong></p> <ul> <li>Опыт разработки мобильных приложений (Android / iOs / winmobile / другое).</li> <li>Знание:JBoss, Facelets, Ajax Web Frameworks (RichFaces / PrimeFaces / ICEFaces), JavaScript, TestNG / Junit.</li> <li>Практические навыки применения «гибких» методологий разработки программных продуктов (Agile, RUP, Scrum, XP, TDD, etc).</li> <li>Опыт работы в *nix операционных системах.</li> </ul> <p><strong>Мы предлагаем:</strong></p> <ul> <li>Постоянная работа в комфортном офисе в Новосибирском Академгородке (здание Технопарка), удаленная работа также возможна.</li> <li>Пятидневная рабочая неделя.</li> <li>Гибкий график.</li> <li>Официальное оформление с ежегодным оплачиваемым отпуском.</li> <li>Стабильные квартальные премии по результатам коммерческих проектов.</li> <li>Перспективы профессионального и карьерного роста.</li> </ul> <p>В подробном резюме укажите телефон для связи, e-mail, а также желаемую зарплату.</p>",Полная занятость,Удаленная работа,От 1 года до 3 лет,|Java|SQL|Java EE|Java SE,3.0,105160.0,1.0,106772.0,java разработчик java разработчик j2ee,Знание J2SE (необходимо будет подтвердить на собеседовании). Хорошее знание J2EE платформы. В частности приветствуется опыт работы...,Разработка новой функциональности. Поддержка работоспособности системы. Разработка unit тестов. Участие в обсуждении новой функциональности.,1
Новосибирск,Bacup IT,2019-11-27T07:28:11+0300,"<p>Компания «БЭКАП ИТ» ищет разработчиков в свой молодой и перспективный проект по разработке и поддержанию корпоративных приложений для западного рынка.</p> <p>Мы разрабатываем платформу для создания линейки продуктов: управление бизнес-процессами (BPMN), распределенные хранилище данных, управление и планирование работы компании.</p> <p>Стэк технологий и инструментов, с которым мы работаем:</p> <p>Back-end: Java SE, Java EE, Spring Framework, Spring Boot</p> <p>Front-end: Angular 7+, HTML 5, JavaScript, TypeScript, Scss, Less</p> <p>Database Management System: PostgreSQL, MySQL‚ MSSQL, MongoDB</p> <p>Application server: Wildfly, Tomcat</p> <p>Web server: Apache, Nginx</p> <p>Distributed version-control: Git, GitLab</p> <p>Tools: Docker, Kubernetes, Jira, Confluence</p> <p>Нашей команде требуются в первую очередь Java разработчики с опытом работы от 2 лет. Также у вас будет возможность расширить свои знания и получить опыт в области front-end технологий.</p> <p> </p> <p><strong>Мы предлагаем:</strong></p> <p>стабильную &quot;белую&quot; заработную плату и регулярный ее пересмотр, премии, уроки английского и немецкого за счет компании, гибкий график работы и возможность удалённой работы несколько дней в неделю.</p> <p>Став частью нашей команды, Вы сможете делать интересные продукты, решать сложные задачи и развиваться как специалист!</p> <p> </p> <p><strong>Обязанности:</strong></p> <p>· Участие в разработке проектов компании</p> <p>· Разработка сложных Web-приложений, расширений с использованием Java</p> <p> </p> <p><strong>Требования:</strong></p> <p>· Хорошее знание и опыт работы Java 8, Java EE 7</p> <p>· Понимание принципов ООП, знание шаблонов проектирования</p> <p>· Опыт разработки REST, SOAP сервисов</p> <p>· Опыт работы с системами контроля версий, предпочтительно Git</p> <p>· Linux на уровне пользователя</p> <p>· Знание основ и\или опыт работы JS/HTML5/CSS3</p> <p>· Желание учиться новым технологиям и использованию новых языков программирования.</p> <p> </p> <p><strong>Плюсом будет:</strong></p> <p>· Опыт работы на одном из современных JS фреймворков (Flux &amp; React, AngularJS, Ember), предпочтительно Angular 2+</p> <p>· Опыт работы с Spring Framework, Spring Boot</p> <p>· Опыт работы с GraphQL</p> <p>· Владение Unix shell и скриптовыми языками</p> <p>· Опыт работы c Wildfly/JBoss/ Tomcat</p> <p>· Наличие проектов, примеры работ на GitHub (https://github.com/)</p> <p> </p> <p><strong>Условия:</strong></p> <p>· Заработная плата по итогам собеседования</p> <p>· Трудоустройство по ТК РФ</p> <p>· Стабильная &quot;белая&quot; заработная плата</p> <p>· Перспектива профессионального развития и самореализации</p> <p>· Гибкий рабочий график</p> <p>· Современный офис в центральном районе‚ недалеко от станции метро Маршала Покрышкина</p> <p>· Молодой и дружный коллектив</p> <p>· Курсы английского и немецкого языка</p> <p>· Компенсация спортивных занятий</p>",Полная занятость,Полный день,От 1 года до 3 лет,|Atlassian Jira|Git|Java|ООП|Spring Framework|Spring Boot|GraphQL|REST|PostgreSQL|SQL,3.0,105160.0,1.0,106772.0,baсk end java разработчик,"Web server: Apache, Nginx. Distributed version-control: Git, GitLab. Хорошее знание и опыт работы Java 8, Java EE 7. ","Мы разрабатываем платформу для создания линейки продуктов: управление бизнес-процессами (BPMN), распределенные хранилище данных, управление и планирование работы компании. ",16
Новосибирск,ОТР,2019-11-23T16:11:29+0300,"<p><strong>Обязанности:</strong><br />проектирование и разработка системы финансового программного обеспечения<br /><br />Требования:<br />высшее образование, опыт разработки на Java от 3х лет;<br />знание Java 1.7+;<br />глубокие знания и практический опыт использования Java в нагруженных многопоточных приложениях, Hibernate, Spring; Maven3/Gradle; XML;<br />понимание основных принципов работы реляционных СУБД: транзакционность, индексы,<br />целостность данных; желательно PostgreSQL;<br />приветствуется опыт работы с современными архитектурами, Apache Ignite, Apache Kafka.</p> <strong>Условия:</strong> <ul> <li>Оформление по ТК РФ.</li> <li>Социальный пакет + расширенный социальный пакет через год работы: оплата фитнеса, курсов, отдыха, проезда и прочее.</li> <li>Заработная плата по результатам собеседования.</li> <li>Большой коллектив и интересные проекты.</li> <li>Перспективы профессионального и карьерного роста</li> </ul> <p> </p>",Полная занятость,Удаленная работа,От 3 до 6 лет,|Hibernate ORM|Spring Framework|PostgreSQL|Java|JUnit,6.0,105160.0,3.0,106772.0,java разработчик,"Высшее образование, опыт разработки на Java от 3х лет. Знание Java 1.7+. Глубокие знания и практический опыт...",Проектирование и разработка системы финансового программного обеспечения.,20
Новосибирск,Diamond Personnel R&C,2019-11-14T17:42:58+0300,"<p><strong>Программист для задач по сопровождению.</strong></p> <p><strong>Обязанности:</strong></p> <ul> <li>сопровождение и мониторинг ПО, анализ и предупреждение дефектов;</li> <li>доработка, отладка, интеграция;</li> <li>оптимизация существующих решений;</li> </ul> <p><strong>Требования:</strong></p> <ul> <li>опыт сопровождения ПО;</li> <li>знание и понимание принципов сервис-ориентированной архитектуры, микро сервисной архитектуры;</li> <li>практические навыки в проектах интеграции данных, интеграции приложений;</li> <li>взаимодействие с людьми и работа в команде</li> <li>знание JDK 8+, IDE (Eclipse/IntelliJ IDEA), Git, Maven, Tomcat, REST, Postgres, Linux, Docker.</li> <li>приветствуется знания: Javascript, Python, JIRA, Docker swarm, Camunda.</li> </ul> <p><strong>Условия:</strong></p> <ul> <li>Полный рабочий день, но по удобному графику.</li> <li>Достойная заработная плата (оклад + премии).</li> <li>Оформление по ТК РФ.</li> <li>Социальный пакет (ДМС, английский язык, спортзал).</li> <li>Возможность обучения и сертификации за счет компании.</li> <li>Программа льготного кредитования.</li> <li>Дисконт-программы от множества компаний партнеров.</li> </ul>",Полная занятость,Полный день,От 1 года до 3 лет,|Git|Linux|SQL|ООП|Java,3.0,105160.0,1.0,106772.0,java разработчик задач по сопровождению,"Опыт сопровождения ПО. Знание и понимание принципов сервис-ориентированной архитектуры, микро сервисной архитектуры. Практические навыки в проектах интеграции данных, интеграции...","Сопровождение и мониторинг ПО, анализ и предупреждение дефектов. Доработка, отладка, интеграция. Оптимизация существующих решений.",29
Новосибирск,АЙФЭЛЛ,2019-11-20T07:14:12+0300,"<strong>Обязанности:</strong> <ul> <li>Разработка критически важных компонентов;</li> <li>Подготовка в кодовой базе инфраструктуры для решения задач (заглушки);</li> <li>Подготовка в кодовой базе инфраструктуры для unit-тестирования;</li> <li>Описание предложений по техническому решению в задачах Jira;</li> <li>Проектирование решений по автоматизации тестирования;</li> <li>Помощь разработчикам в проектировании;</li> <li>Контроль качества кода (соглашения, ревью, checkstyle, sonar, и т.п.);</li> <li>Управление тех. долгом;</li> <li>Построение контуров CI/CD;</li> <li>Поддержка Dev(Sec)Ops в соответствии с методиками принятого производственного процесса Банка</li> <li>Подготовка инфраструктуры для автоматизации тестирования.</li> </ul> <strong>Требования:</strong> <ul> <li>Опыт разработки Web-приложений, понимание принципов клиент-серверного взаимодействия;</li> <li>Опыт работы с серверами приложений Apache Tomcat, IBM WebSphere, JBoss;</li> <li>Опыт работы с системами контроля версий: svn, git.</li> <li>Опыт профилирования приложений - поиск утечек памяти, поиск bottleneck приложений от 2 лет;</li> <li>Опыт работы с набором практик DevOps (Jenkins, Ansible, Groovy)</li> <li>Опыт разработки высоконагруженных и распределенных систем, систем финансового профиля;</li> <li>Уверенное понимание принципов многопоточного программирования;</li> <li>Понимание принципов OOП, методологий разработки, шаблонов проектирования;</li> <li>Уверенное знание Java SE;</li> <li>Уверенное знание технологий разработки Spring Framework, Hibernate ORM, JMS, JMX, Junit.</li> <li>Уверенные знания SQL, опыт работы с СУБД Oracle, опыт проектирования БД;</li> <li>Знание технологий разработки интерфейсной части - JavaScript, JQuery, React.</li> <li>Опыт работы с инструментами разработки Intellij IDEA, Jira, Confluence;</li> <li>Уверенные знания в SQL синтаксисе, опыт работы с БД Oracle;</li> <li>Понимание всего цикла производства ПО, от анализа первичных требований до обновления ПО на серверах и сопровождения пользователей;</li> <li>Знакомство с IMDG-платформами (будет преимуществом).</li> </ul> <strong>Условия:</strong> <ul> <li>конкурентная заработная плата;</li> <li>ДМС после испытательного срока;</li> <li>возможность участвовать в разработке крутых проектов;</li> <li>шанс присоединиться к уникальной команде молодых и талантливых единомышленников;</li> <li>возможность развиваться в личностном и профессиональном планах;</li> <li>корпоративное обучение на платформе Coursera;</li> <li>работа в современном/технологичном офисе.</li> </ul>",Полная занятость,Полный день,От 3 до 6 лет,|Java|Hibernate ORM|Spring Framework|Java EE|SVN|SQL|СУБД|ORACLE|JavaScript|jQuery,6.0,105160.0,3.0,106772.0,ведущий java разработчик,"Опыт разработки Web-приложений, понимание принципов клиент-серверного взаимодействия. Опыт работы с серверами приложений Apache Tomcat, IBM WebSphere, JBoss. ",Разработка критически важных компонентов. Подготовка в кодовой базе инфраструктуры для решения задач (заглушки). Подготовка в кодовой базе инфраструктуры для unit...,23
Новосибирск,Rocket Science (ООО Импрув),2019-11-25T08:20:23+0300,"<p>Привет, у нас открыта вакансия Java-разработчика, и это вам не rocket science. Хотя, постойте... Это именно <strong>Rocket Science</strong>!<br /><br />Время от времени в нашем космолёте открываются шлюзы, готовые принять новых рокетменов (или рокетвуменов) — сейчас тот самый момент.<br /><br /><strong>Rocket Science</strong> — команда опытных Java back-end разработчиков. Специализируемся на создании сложных программных продуктов (в основном для финансовой сферы, но не только). Если вы что-то слышали о компании Improve Group и ее back-end подразделении Improve Intelligence, то считайте, что вы нас знаете (летом 2019 команда Intelligence вышла из группы компаний Improve и переименовалась в Rocket Science). Сейчас нас 25 человек и костяк команды уже 4 года работает вместе.</p> <p><strong>Мы по-прежнему:</strong><br />— пишем бэк и немного фронт;<br />— ориентируемся на ценность для бизнеса клиента;<br />— хотим видеть ощутимую пользу своей работы;<br />— вовлечены в клиентские процессы, а не просто «фигачим по ТЗ».<br /><br /><strong>Наш основной стек:</strong><br />- Java 8+;<br />- Spring Boot;<br />- PostgreSQL;<br />- JUnit;<br />- Maven, Gradle;<br />- Git;<br />- Из фронтенда сейчас в основном Vue и Angular.<br />Ещё есть проекты на Kotlin, Spring WebFlux, React, можно поиграться с нейросетями, если хочется.</p> <p><strong>Кого мы ищем:</strong><br />Технически мы ищем Java-разработчиков middle+, тут всё понятно. Но в первую очередь ищем своего человека (рокетмена!), потому что именно люди делают компанию такой, какая она есть. Если в тебе это откликается, хватай свое полотенце и приходи знакомиться :) Было бы здорово, если бы вместе с откликом ты прислал нам ссылку на Git с примерами твоего кода, чтобы мы смогли подготовиться ко встрече.</p> <p><strong>Ещё пару слов про космолёт Rocket Science:</strong></p> <p>— пересматриваем зарплату в зависимости от твоих результатов;<br />— оформляем официально с первого дня работы;<br />— офис в Технопарке новосибирского Академгородка;<br />— после испытательного — ДМС со стоматологией и другие плюшки.</p> <p><strong>42</strong></p> <p>Нам можно писать сразу в телеграм: Андрей @Arpolog (PM), @picheva (Таня, HRD)</p>",Полная занятость,Гибкий график,От 1 года до 3 лет,|Java|Spring Framework|Git|REST|JavaScript|UI|Spting data|SQL,3.0,105160.0,1.0,106772.0,java разработчик,хотим видеть ощутимую пользу своей работы. - Java 8+. - JUnit. Ещё пару слов про космолёт Rocket Science:,"ориентируемся на ценность для бизнеса клиента. — вовлечены в клиентские процессы, а не просто «фигачим по ТЗ».",18
