city,company-name,date,description,employment-form,employment-schedule,experience,key_skills,max-experience,max-salary,min-experience,min-salary,name,requirements,responsibilities
Тюмень,"ХОСТ, Группа компаний",2019-09-20T08:05:22+0300,"<p>Группа Компаний ХОСТ – федеральный системный интегратор и разработчик программного обеспечения. Входит в ТОП-100 крупнейших IT-компаний России.</p> <p>Наша Команда ищет опытного Frontend-разработчика для работы над масштабными социально-значимыми проектами.</p> <p>Одним из таких проектов является платформа «МедВедь». Это комплекс информационных систем для автоматизации работы органов управления здравоохранением и предоставления электронных услуг населению.</p> <p><strong>Задачи:</strong></p> <ul> <li>разработка новых и развитие существующих веб-сервисов;</li> <li>переписать фронт-часть существующих систем (мы переходим на новый технологический стек).</li> </ul> <p><strong>Требования:</strong></p> <ul> <li>Опыт программирования от 1 года;</li> <li>Знание технологий программирования JavaScript, HTML, СSS (Sass/Scss, Less);</li> <li>Опыт работы с Angular framework v4+;</li> <li>Умение работать с системой контроля версий GIT.</li> </ul> <p><strong>Мы предлагаем:</strong></p> <ul> <li>Возможность удаленной работы, гибкие начало и окончание рабочего дня;</li> <li>Полноценную проектную команду: менеджер проектов, аналитик, разработчики, тестировщик, технический писатель;</li> <li>Внутреннее и внешнее обучение;</li> <li>Заботу компании о своих сотрудниках (ДМС, софинансирование спорта и изучения иностранных языков, дополнительно 7 дней социального отпуска);</li> <li>Уровень заработной платы обсуждается индивидуально и зависит от уровня компетенций.</li> </ul>",Полная занятость,Полный день,От 1 года до 3 лет,|JavaScript|HTML|CSS|Git|AngularJS|Less|Sass,3.0,,1.0,60000.0,web,"Опыт программирования от 1 года. Знание технологий программирования JavaScript, HTML, СSS (Sass/Scss, Less). Опыт работы с Angular framework v...",Разработка новых и развитие существующих веб-сервисов. Переписать фронт-часть существующих систем (мы переходим на новый технологический стек).
Тюмень,Международный институт дополнительного образования,2019-10-08T14:19:28+0300,"<p><strong>Международный институт дополнительного образования </strong>в связи с расширением отдела digital-маркетинга приглашает в свою команду <strong>программиста. </strong>Работа удаленно, но с обязательным посещением офиса 1 раз в неделю (обсуждение задач, оценка результатов).</p> <p><strong>Ключевые задачи:</strong></p> <ul> <li>разработка новых и поддержка существующих проектов на Bitrix,</li> <li>оптимизация сайтов под требования поисковых систем (скорость загрузки, структура и т.д.),</li> <li>верстка сайтов по макетам,</li> <li>участие в проектах по автоматизации бизнес-процессов компании (написание скриптов php),</li> </ul> <p><strong>Для участия в наших проектах Вам потребуется:</strong></p> <ul> <li>Уверенные знания PHP,</li> <li>Опыт написания сложных SQL-запросов,</li> <li>Хорошие знания HTML5, CSS3, JS,</li> <li>Умение работать с чужим кодом,</li> <li>Навыки подключения плагинов, программирования форм,</li> <li>Навыки оптимизации сайтов под требования поисковых систем (скорость загрузки, структура и т.д.),</li> <li>Опыт работы с 1С Bitrix.</li> </ul> <p><strong>Мы предлагаем:</strong></p> <ul> <li>работу по договору ГПХ,</li> <li>интересные задачи и всестороннюю поддержку развития вашего потенциала,</li> <li>уровень оплаты труда обсуждается по итогам личного собеседования (укажите, пожалуйста, желаемый уровень в резюме или сопроводительном письме).</li> </ul>",Полная занятость,Удаленная работа,От 3 до 6 лет,|PHP|SQL|HTML5|CSS3,6.0,,3.0,,web,"Уверенные знания PHP. Опыт написания сложных SQL-запросов. Хорошие знания HTML5, CSS3, JS. Умение работать с чужим кодом. ","Разработка новых и поддержка существующих проектов на Bitrix. Оптимизация сайтов под требования поисковых систем (скорость загрузки, структура и т.д.). "
Тюмень,Креатив,2019-10-01T15:13:39+0300,"<strong>Обязанности:</strong> <ul> <li>Программирование и поддержка сайтов (отдельно backend, отдельно frontend, либо full-stack).</li> </ul> <strong>Требования к стеку:</strong> <p> </p> <p>Backend:</p> <ul> <li>PHP 5 и 7, 1С Битрикс &quot;Управление сайтом&quot;, Yii, Laravel.</li> <li>SQL: реляционные базы данных, составление запросов, MySql (MariaDb, PerconaDb).</li> <li>Серверное окружение: LAMP, nginx + php-fpm + mysql.</li> <li>Html-верстка: html5, css3, кроссбраузерная верстка (webkit, gecko, ie =&gt; 10),</li> <li>Пользовательские скрипты: javascript (ECMAScript 6), jquery.</li> <li>Git-репозитории.</li> </ul> <p>Frontend:</p> <ul> <li>JavaScript,</li> <li>es6,</li> <li>Sass/Stylus,</li> <li>Pug,</li> <li>Gulp/Webpack,</li> <li>Git-репозитории,</li> <li>именования по БЕМу,</li> <li>Фреймворки Angular/React/Vue</li> <li>Хорошо если Node.js</li> </ul> <p>Плюсы к карме:</p> <ul> <li>Опыт коммерческой разработки;</li> <li>Опыт настройки и администрирования серверного ПО.</li> </ul> <strong>Условия:</strong> <ul> <li>Работа в офигенном офисе, иногда можно из дома;</li> <li>Масштабные и интересные проекты (90% МСК, Питер, зарубежье);</li> <li>Развитие за счет компании (английский прямо в офисе, пятничные лекции, посещение крупных конференций, внутреннее обучение и т.п.);</li> <li>Помощь команды;</li> <li>Проектная работа через систему Битрикс24;</li> <li>Оборудованное рабочее место, необходимая литература, кофе, чай, сахар, греча, крупы;</li> <li>Отсутствие дресс-кода, можно ходить в домашних тапочках, как многие и делают.</li> </ul>",Полная занятость,Полный день,От 1 года до 3 лет,|PHP|1С-Битрикс|Yii|Laravel|JavaScript|jQuery|HTML|CSS|SQL|ReactJS|AngularJS|VueJS|Git|ООП|Symfony,3.0,110000.0,1.0,40000.0,web,"PHP 5 и 7, 1С Битрикс &quot;Управление сайтом&quot;, Yii, Laravel. SQL: реляционные базы данных, составление запросов, MySql (MariaDb, PerconaDb). ","Программирование и поддержка сайтов (отдельно backend, отдельно frontend, либо full-stack)."
Тюмень,Минт Рокет,2019-09-12T11:58:57+0300,"<p><strong>Что нам нужно:</strong></p> <ul> <li>Опыт разработки от 1 года;</li> <li>Знание PHP;</li> <li>Опыт работы с фреймворком Laravel;</li> <li>Понимание клиент-серверной архитектуры;</li> <li>Взаимодействие с API различных сервисов;</li> <li>Разработка и поддержка собственного API (JSON/XML);</li> <li>Опыт работы с frontend - фреймворками Vue.js или React.js;</li> <li>Знание MySQL;</li> <li>Работа с системами контроля версий (Git);</li> <li>Основы работы с UNIX-системами;</li> </ul> <p><strong>Что нужно будет делать:</strong></p> <p>Участвовать в разработке API для мобильных платформ, веб-сервисов, чат-ботов, интеграции сложных систем.</p> <p><strong>Что мы предлагаем:</strong></p> <ul> <li>Вы сможете увидеть результаты своей работы практически сразу после выполнения задачи, почувствовать себя действительно важным участником проекта, от работы которого зависит успех всей компании;</li> <li>В зависимости от вашего опыта, возможностей и амбиций мы можем предложить, как простые, так и задачи архитектурного и инфраструктурного характеров.</li> </ul> <p><strong>Бонусы:</strong></p> <ul> <li>Коллеги, открытые к коммуникациям, которые помогут в работе и адаптации на новом месте;</li> <li>Пятидневная рабочая неделя: с 9:00 до 18:00 (по согласованию можно менять график);</li> <li>Изучение новых технологий на практике;</li> <li>Кофе, печеньки;</li> <li>Интересные и сложные задачи;</li> <li>Возможность роста и курирования IT проектов.</li> </ul>",Полная занятость,Удаленная работа,От 1 года до 3 лет,|Git|PostgreSQL|Linux|Nginx|PHP|Laravel|Yii2|MySQL,3.0,130000.0,1.0,,web,Опыт разработки от 1 года. Знание PHP. Опыт работы с фреймворком Laravel. Понимание клиент-серверной архитектуры. Опыт работы с frontend...,Взаимодействие с API различных сервисов. Разработка и поддержка собственного API (JSON/XML). Работа с системами контроля версий (Git). 
Тюмень,Ай Кью Онлайн,2019-10-09T12:39:33+0300,"<p><strong>IQ Online - </strong>это команда из 55+ маркетологов, специалистов по рекламе и SEO, аналитиков, дизайнеров, веб-разработчиков, копирайтеров, специалистов по работе с клиентами. Нашим клиентам мы полезны как вовлеченный партнер, увеличивающий количество входящих лидов и клиентов для отдела продаж.</p> <p><strong>Кому может быть интересно:</strong></p> <p>Начинающему, перспективному backend-разработчику с базовыми знаниями программирования, который действительно хочет развиваться в данном направлении и видит в нем свое профессиональное будущее.</p> <p><strong>Обязанности:</strong></p> <ul> <li>развитие своих профессиональных навыков</li> <li>доработка существующего функционала на разных CMS</li> <li>внедрение нового функционала на существующих сайтах</li> <li>написание собственных простых интерфейсов взаимодействия с пользователями (форм, галерей)</li> </ul> <p><strong>Требования:</strong></p> <ul> <li>высшее профильное образование (также рассматриваем талантливых студентов последнего курса)</li> <li>знания PHP, MySQL</li> <li>начальные знания HTML5‚ CSS3, jQuery, JavaScript</li> <li>внимательность</li> <li>желание обучаться новому</li> </ul> <p><strong>Большим плюсом будет:</strong></p> <ul> <li>умение разбираться в чужом коде</li> <li>опыт работы с API внешних сервисов</li> <li>понимание принципов ООП</li> <li>опыт работы с любой из CMS: 1С-Битрикс, WP, Joomla, Drupal, ModX, OpenCart</li> <li>опыт работы с Git</li> </ul> <p><strong>IQ Online в рейтингах:</strong></p> <ul> <li>Входим в Золотую Сотню российского Digital 2015, по версии Ruward</li> <li>Золотой партнер 1С-Битрикс</li> <li>Первое место в рейтинге лучших SEO-компаний Тюмени 201, Рейтинг Рунета</li> <li>ТОП 30 в рейтинге лучших SEO-компаний России 2018, Рейтинг Рунета</li> <li>ТОП 30 в рейтинге сертифицированных агентств Яндекс. Директ 2017</li> <li>ТОП 40 в едином рейтинге агентств контекстной рекламы 2017</li> </ul> <p><strong>Что тебя ждет у нас:</strong></p> <ul> <li>работа в ведущем, сертифицированном интернет-агентстве Тюменской области</li> <li>возможность обучаться у специалистов высокого уровня с реальным опытом разработки и поддержки проектов федерального масштаба</li> <li>обучение, помощь наставника при трудоустройстве и на начальных этапах работы</li> <li>много возможностей для самореализации, участие в разработке крупных и интересных проектов</li> <li>карьерный рост, профессиональное развитие (все зависит лишь от твоего упорства, сообразительности и ответственности)</li> <li>нормальный график работы (5/2 ,с 9-00 до 18-00 - можно корректировать по желанию)</li> <li>офис с панорамными окнами в бизнес-центре &quot;Нобель Парк&quot;</li> <li>здоровая атмосфера в коллективе и адекватное руководство, всегда готовое к конструктивному диалогу</li> </ul> <p><strong>P.S. </strong> Уровень заработной платы обсуждается индивидуально на собеседовании, зависит от начального уровня твоих знаний и умений.</p> <p>Мы готовы принять в команду талантливых студентов 5 курса (либо выпускников бакалавриата), имеющих опыт разработки, стремящихся развиваться и добиваться успеха в профессии веб-разработчика.</p> <p> </p> <p> </p> <p> </p> <p> </p> <p> </p> <p> </p> <p> </p>",Стажировка,Полный день,Нет опыта,|PHP|MySQL|HTML5|CSS3|jQuery|JavaScript,,,,,web,"Высшее профильное образование (также рассматриваем талантливых студентов последнего курса). Знания PHP, MySQL. Начальные знания HTML5‚ CSS3, jQuery, JavaScript. ",Развитие своих профессиональных навыков. Доработка существующего функционала на разных CMS. Внедрение нового функционала на существующих сайтах. Написание собственных простых интерфейсов...
Тюмень,Интерактивное агентство Aerokod,2019-10-04T19:09:54+0300,"<strong>Обязанности:</strong> <ul> <li>Разработка и поддержка web-проектов.</li> <li>Доработка существующих сайтов и разработка новых.</li> <li>Программирование и тестирование сайтов.</li> </ul> <strong>Требования:</strong> <ul> <li>Глубокие знания PHP, MySQL.</li> <li>Уверенные знания HTML5, CSS3, JavaScript, JQuery.</li> <li>Понимание принципов ООП.</li> <li>Опыт работы с API внешних сервисов.</li> <li>Умение разбираться в чужом коде.</li> <li>Умение писать простой и понятный код, следуя принятой методологии.</li> <li>Системное видение проектов и логическое мышление.</li> <li>Самостоятельность и самоорганизованность.</li> <li>Неважно, что вы знаете фреймворки Code Ignieter, Simfony 2, Yii 2, CMS Битрикс (Bitrix), Wordpress, мы постараемся оценить вас по достоинству.</li> </ul> <strong>Условия:</strong> <ul> <li>Команда, увлеченная проектами.</li> <li>Постоянные вызовы твоему профессионализму. У тебя будет масса возможностей проявить себя и множество точек роста.</li> <li>Адекватное руководство.</li> <li>Гибкий график по согласованию.</li> <li>Отличное рабочее место, круглосуточный доступ, уютный офис, натуральный кофе, чай.</li> </ul>",Полная занятость,Гибкий график,От 1 года до 3 лет,|Веб-программирование|HTML|JavaScript|CSS|MySQL|PHP5|jQuery|PHP|HTML5|1С-Битрикс|Bootstrap|Ajax|Yii|ООП|CSS3|CMS Wordpress|Кроссбраузерная верстка,3.0,50000.0,1.0,30000.0,web,"Глубокие знания PHP, MySQL. Уверенные знания HTML5, CSS3, JavaScript, JQuery. Понимание принципов ООП. Опыт работы с API внешних...",Разработка и поддержка web-проектов. Доработка существующих сайтов и разработка новых. Программирование и тестирование сайтов.
Тюмень,РУСОЙЛ,2019-09-23T08:50:55+0300,"<strong>Обязанности:</strong> <ul> <li>Разработка, внедрение, поддержка сайтов компании и корпоративного портала под управлением CMS 1С-Битрикс.</li> </ul> <strong>Требования:</strong> <ul> <li>Уверенные знания: PHP‚ MySQL; <ul> <li>Основные знания по разработке сайтов: HTML‚ CSS‚ JavaScript‚ Ajax‚ XML,;</li> <li>Опыт разработки и внедрения проектов под управлением CMS 1С-Битрикс;</li> <li>Приветствуется: уверенная работа в пакете графических программ, наличие выполненных проектов‚ знание CMS &quot;1С-Битрикс&quot;,WordPress и других систем управления сайтами‚ знание *nix приветствуется;</li> <li>Опыт интеграции продуктов 1С-Битрикс с конфигурациями «1С:Предприятие 8».</li> </ul> </li> </ul> <strong>Условия:</strong> <ul> <li>5-ти дневный график работы, 08.30 - 17.30;</li> <li>Официальное трудоустройство;</li> <li>Молодой и дружный коллектив;</li> </ul>",Полная занятость,Полный день,От 1 года до 3 лет,,3.0,,1.0,50000.0,web,"Уверенные знания: PHP‚ MySQL. Основные знания по разработке сайтов: HTML‚ CSS‚ JavaScript‚ Ajax‚ XML,. Опыт разработки и внедрения проектов под...","Разработка, внедрение, поддержка сайтов компании и корпоративного портала под управлением CMS 1С-Битрикс."
