city,company-name,date,description,employment-form,employment-schedule,experience,key_skills,max-experience,max-salary,min-experience,min-salary,name,requirements,responsibilities
Тюмень,Легаси,2019-09-23T08:07:30+0300,"<p><strong>Что нужно делать:</strong></p> <p>Нам нужен человек, который возьмет на себя часть задач разработчиков. Чаще всего необходимо разрабатывать интернет-магазины на 1С-Битрикс по конкретным ТЗ, написанными техническими специалистами. Иногда будут задачи по доработкам уже существующих проектов.</p> <p>В работе мы ждем от вас ответственности, самостоятельности, внимательности и аккуратности. Если столкнетесь с чем то сложным и решения не будет в наших внутренних документах не бойтесь обратиться к коллегам за помощью.</p> <p> </p> <p><strong>Какие требования:</strong></p> <ul> <li> <p>PHP 5, PHP 7, MySQL, HTML+CSS</p> </li> <li> <p>Опыт работы с Битрикс</p> </li> <li> <p>GIT/GIT-flow</p> </li> <li> <p>Хорошее понимание ООП, опыт его использования</p> </li> <li> <p>Отсутствие страха перед HTML, CSS, JS. Для верстки и сложного js-кодинга есть специальные люди, но базовые знания должны присутствовать и использоваться</p> </li> <li> <p>Развиваться профессионально и помогать развиваться коллегам</p> </li> </ul> <p><strong>Будет плюсом знание:</strong></p> <ul> <li> <p>Laravel</p> </li> <li> <p>Vue.js</p> </li> <li> <p>Bitrix API D7</p> </li> <li> <p>умение настройки серверов на UNIX</p> </li> </ul> <p> </p> <p><strong>Условия работы:</strong></p> <ul> <li> <p>Профессиональная команда. Будет у кого поучиться новым технологиям, практикам и инструментам</p> </li> <li> <p>Не надо продавать свои услуги. За вас это сделают специальные люди</p> </li> <li> <p>Если требуется, покупаем новые инструменты для повышения эффективности работы</p> </li> <li> <p>Опыт работы в реальных проектах федерального масштаба: интернет-магазины, маркетплейсы, B2B-порталы.</p> </li> <li> <p>Отличная рабочая атмосфера без дресс-кода и лишней бюрократии</p> </li> <li> <p>Рабочая станция с SSD-диском и двумя мониторами</p> </li> <li> <p>Работа в комфортном офисе рядом с перекрёстком ул. Мельникайте/50 лет Октября. До офиса удобно добираться на автобусе из любого района города, остановки рядом. Есть парковки для автомобилей</p> </li> <li> <p>В офисе отдельный кабинет формата переговорка/кухня: холодильник, кофемашина, микроволновка, чайник, печеньки. Чистая питьевая бутилированная вода. Большие окна, свежий воздух, тишина</p> </li> <li> <p>График работы обсуждаем: 5/2, 8-часовой рабочий день в период с 9-00 до 22-00</p> </li> <li> <p>Рядом: множество заведений общепита, тренажёрный зал, парикмахерская</p> </li> <li> <p>Официальное оформление по ТК РФ с записью в трудовой книжке</p> </li> <li> <p>Оплачиваемый испытательный срок 3 месяца. Обучаем в период испытательного срока</p> </li> </ul> <p> </p> <p><strong>Дополнительные инструкции</strong></p> <ul> <li>После отклика нужно будет заполнить небольшую анкету</li> </ul> <p> </p> <p><strong>9 преимуществ работы в компании Legacy:</strong></p> <ol> <li> <p>Вы устроитесь в нашу компанию и уже через 1 год получите компетенции для участия в крупных технологичных проектах.</p> </li> <li> <p>Разработаете минимум 12 проектов, получите квалификацию и опыт, которые пополнят портфолио.</p> </li> <li> <p>Работа в команде с другими людьми (аналитики, проектировщики, дизайнеры, специалисты по продвижению), которые подпитывают новыми знаниями.</p> </li> <li> <p>Сформированные рабочие процессы (проект разрабатывается плавно и прогнозируемо). Возможность влиять на процессы в компании (по окончанию каждого проекта работаем над ошибками).</p> </li> <li> <p>Составляем личный план развития + старший товарищ, который поможет.</p> </li> <li> <p>Современные инструменты для управления проектами. Вы научитесь работать с передовыми инструментами.</p> </li> <li> <p>Компания оплачивает учёбу и сертификацию.</p> </li> </ol>",Полная занятость,Полный день,Нет опыта,|Веб разработка|Backend development|PHP|1С-Битрикс|JavaScript|Git|PostgreSQL|ООП|MySQL|Веб-программирование|Bitrix|SQL|Ajax,,80000.0,,25000.0,web,"В работе мы ждем от вас ответственности, самостоятельности, внимательности и аккуратности. Если столкнетесь с чем то сложным и решения не...","Дополнительные инструкции. Работа в команде с другими людьми (аналитики, проектировщики, дизайнеры, специалисты по продвижению), которые подпитывают новыми знаниями. "
Тюмень,CDS Company,2019-10-11T14:15:54+0300,"<p>CDS Company - студия веб-разработок.<br />Мы специализируемся на разработке крупных проектов, регионального и федерального уровня.<br />Мы разрабатываем высоконагруженные интернет-магазины, CRM-системы для различных предприятий, профессиональные корпоративные порталы, модернизируем порталы СМИ и много других сложных, нетривиальных проектов. В разработке мы используем передовые технологии и крутые решения технического характера. В разработке используем нашу внутреннюю CRM систему для оптимизации внутренних бизнес-процессов.</p> <p>На сегодняшний день разработано и запущено свыше 50 проектов и находится более 100 сайтов на технической поддержке.</p> <p>На текущий момент набираем команду программистов для развития своих кодерских навыков и для разработки крутых проектов в связи с расширением штата и увеличением объема работ. Есть team-lead, наставник, который справится с любой задачей и любым вопросом.</p> <p><strong>Обязанности:</strong></p> <p>- Программирование сайтов с 0 на Битриксе через обучение;<br />- Разработка CRM систем на базе bitrix;<br />- Разработка модулей и классов на PHP7;<br />- Работа с Laravel + PostgreSQL (OctoberCMS) через обучение;<br />- Обслуживание сайтов на Битриксе, WP и других CMS;</p> <p><strong>Требования:</strong></p> <p>- Базовые знания web-разработки;<br />- Умение программировать на PHP (жестко и много, только хард-код);<br />- Опыт работы с большими проектами;<br />- Знание ООП;<br />- Знание JavaScript, JQuery;<br />- Опыт работы на Битриксе приветствуется. Но если не знаете, то научим.<br />- Пунктуальность;<br />- Ответственность;<br />- Не бояться учиться чему-то новому;<br />- Знание PHP7, MySQL, PostgreSQL</p> <p><strong>Условия:</strong></p> <p>- Работа в офисе в будни, график вы устанавливаете себе сами;<br />- Перерыв на обед - 1 час в любое время;<br />- Предоставляем рабочее место с хорошим компьютером (2 монитора, производительный компьютер);<br />- За Вами будет закреплен руководитель, который будет помогать решать технические вопросы и руководить процессом разработки;<br />- Обучение и повышение квалификации;<br />- Официальное трудоустройство после 1 месяца испытательного срока;<br />- Чай и печеньки за наш счет;<br />- Корпоративчики и пятничные посиделки;<br />- Офис в центре города;<br />- ВОЗМОЖНА УДАЛЕННАЯ РАБОТА;<br />- Соц.пакет: выплата больничных, выплата отпускных, выплата квартальных премий, мед. страховка;</p> <p>На текущем этапе развития компании гарантируем карьерный рост до руководителя отдела разработки и выше.</p>",Полная занятость,Полный день,От 1 года до 3 лет,|PHP|jQuery|CSS3|1С-Битрикс|CSS|ООП|MySQL|CMS Wordpress|HTML|HTML5|JavaScript|Ajax,3.0,100000.0,1.0,40000.0,web,"Базовые знания web-разработки. - Умение программировать на PHP (жестко и много, только хард-код). - Опыт работы с большими проектами. - ",Программирование сайтов с 0 на Битриксе через обучение. - Разработка CRM систем на базе bitrix. - Разработка модулей и классов на PHP...
Тюмень,Ключевой фактор,2019-10-03T10:58:55+0300,"<p><strong>Junior Backend Developer / </strong><strong>Веб</strong><strong>-</strong><strong>разработчик</strong><strong> (Backend)</strong></p> <p><strong>Чем предстоит заниматься:</strong></p> <ul> <li>Разрабатывать backend часть для веб и мобильных приложений</li> <li>Поддерживать серверную часть существующих приложений</li> <li>Конструктивно взаимодействовать в команде</li> </ul> <p><strong>Ты нам подходишь, если:</strong></p> <ul> <li>Знаешь хотя-бы один из серверных языков (NodeJS, Python, PHP, Ruby)</li> <li>Умеешь писать простой и понятный код, следуя принятой методологии</li> <li>Понимаешь принципы ООП</li> <li>Умеешь разбираться в чужом коде</li> </ul> <p><strong>Будет круто, если:</strong></p> <ul> <li>Имеешь какой-то опыт разработки backend систем</li> <li>Знаком с какой-то системой контроля версий</li> <li>Работал с API внешних сервисов</li> </ul> <p><strong>Условия:</strong></p> <ul> <li>Работа в скрам-команде</li> <li>гибкий график, полная занятость</li> <li>Офис в БЦ Альянс, центр города</li> </ul> <p><strong>Сайт компании: http://kfactor.ru/</strong></p>",Полная занятость,Полный день,От 1 года до 3 лет,|Node.js|Python|PHP|Ruby|Java|C#|Django Framework|C++|MS SQL Server|SQL|Управление проектами|ООП|Ruby On Rails,3.0,70000.0,1.0,35000.0,web,"Знаешь хотя-бы один из серверных языков (NodeJS, Python, PHP, Ruby). Умеешь писать простой и понятный код, следуя принятой методологии. ",Разрабатывать backend часть для веб и мобильных приложений. Поддерживать серверную часть существующих приложений. Конструктивно взаимодействовать в команде. Имеешь какой-то...
Тюмень,Диджитал Агентство,2019-09-13T09:20:32+0300,"<p>Компания DigitalSmart приглашает на вакансию «Младший Web-программист» всех желающих, выпускников ВУЗов, имеющих техническое образование и навыки программирования, а главное желающих профессионально развиваться в сфере Web-разработки и программирования.</p> <p><strong>Обязанности:</strong></p> <ul> <li>Участие в разработке и обновлении сайтов</li> <li>Верстка страниц по дизайн-макетам</li> <li>Верстка писем для рассылки</li> <li>Разработка функционала в рамках поставленных задач (CSS, HTML, JS, PHP, jQuery, 1C-Битрикс)</li> <li>E-mail рассылка</li> <li>Наполнение сайтов контентом</li> <li>Выполнение задач по seo-оптимизации</li> </ul> <p><strong>Требования:</strong></p> <ul> <li>Знание CSS, HTML, JS</li> <li>Желание вникать в бизнес-логику выполняемых задач</li> <li>Умение действовать самостоятельно</li> <li>Плюсом будет знание PHP, jQuery, 1C-Битрикс</li> <li>Приветствуется умение работать с git, composer</li> <li>Ответственность, коммуникабельность, желание обучаться и вникать в задачи</li> </ul> <p><strong>Мы предлагаем:</strong></p> <ul> <li>Стажировка 2 недели;</li> <li>Условия работы в рамках ТК РФ (28 дней оплачиваемого отпуска, больничные дни);</li> <li>Профессиональный рост в дружном, молодом коллективе;</li> <li>Работа с самыми масштабными проектами Тюмени;</li> <li>Офис в историческом центре города;</li> <li>Оборудованное, комфортное рабочее место;</li> <li>График работы 5/2, с 10:00 до 19:00</li> <li>На территории работодателя</li> <li>Работа над интересными проектами</li> <li>Возможность профессионального и карьерного роста</li> <li>Наставничество и обучение от профессиональных разработчиков</li> <li>Испытательный срок 2 месяца</li> </ul>",Полная занятость,Полный день,Нет опыта,|Веб-программирование,,,,20000.0,web,"Знание CSS, HTML, JS. Желание вникать в бизнес-логику выполняемых задач. Умение действовать самостоятельно. Плюсом будет знание PHP, jQuery, 1...",Участие в разработке и обновлении сайтов. Верстка страниц по дизайн-макетам. Верстка писем для рассылки. Разработка функционала в рамках поставленных...
Тюмень,Легаси,2019-09-23T08:46:16+0300,"<p><strong>Что нужно делать:</strong></p> <p>Нам нужен человек, который возьмет на себя часть задач разработчиков. Чаще всего необходимо разрабатывать интернет-магазины, маркетплейсы, B2B-порталы по конкретным ТЗ, написанными техническими специалистами. Иногда будут задачи по доработкам уже существующих проектов.</p> <p>В работе мы ждем от вас ответственности, самостоятельности, внимательности и аккуратности. Если столкнетесь с чем то сложным и решения не будет в наших внутренних документах не бойтесь обратиться к коллегам за помощью.</p> <p> </p> <p><strong>Какие требования:</strong></p> <ul> <li> <p>уверенные знания HTML, CSS, JavaScript</p> </li> <li> <p>использование препроцессоров SASS/SCSS</p> </li> <li> <p>Gulp/webpack</p> </li> <li> <p>опыт работы с Git/Git-flow</p> </li> <li> <p>хорошее понимание ООП, опыт его использования</p> </li> <li> <p>знание одного из фреймворков, желательно vue.js</p> </li> </ul> <p> </p> <p><strong>Условия работы:</strong></p> <ul> <li> <p>Профессиональная команда. Будет у кого поучиться новым технологиям, практикам и инструментам</p> </li> <li> <p>Если требуется, покупаем новые инструменты для повышения эффективности работы</p> </li> <li> <p>Опыт работы в реальных проектах федерального масштаба: интернет-магазины, маркетплейсы, B2B-порталы.</p> </li> <li> <p>Отличная рабочая атмосфера без дресс-кода и лишней бюрократии</p> </li> <li> <p>Рабочая станция с SSD-диском и двумя мониторами</p> </li> <li> <p>Работа в комфортном офисе рядом с перекрёстком ул. Мельникайте/50 лет Октября. До офиса удобно добираться на автобусе из любого района города, остановки рядом. Есть парковки для автомобилей</p> </li> <li> <p>В офисе отдельный кабинет формата переговорка/кухня: холодильник, кофемашина, микроволновка, чайник, печеньки. Чистая питьевая бутилированная вода. Большие окна, свежий воздух, тишина</p> </li> <li> <p>График работы обсуждаем: 5/2, 8-часовой рабочий день в период с 9-00 до 22-00</p> </li> <li> <p>Рядом: множество заведений общепита, тренажёрный зал, парикмахерская</p> </li> <li> <p>Официальное оформление по ТК РФ с записью в трудовой книжке</p> </li> <li> <p>Оплачиваемый испытательный срок 3 месяца. Обучаем в период испытательного срока</p> </li> </ul> <p> </p> <p><strong>Дополнительные инструкции</strong></p> <ul> <li>После отклика нужно будет заполнить небольшую анкету</li> </ul> <p> </p> <p> </p> <p><strong>9 преимуществ работы в компании Legacy:</strong></p> <ol> <li> <p>Вы устроитесь в нашу компанию и уже через 1 год получите компетенции для участия в крупных технологичных проектах.</p> </li> <li> <p>Разработаете минимум 12 проектов, получите квалификацию и опыт, которые пополнят портфолио.</p> </li> <li> <p>Работа в команде с другими людьми (аналитики, проектировщики, дизайнеры, специалисты по продвижению), которые подпитывают новыми знаниями.</p> </li> <li> <p>Сформированные рабочие процессы (проект разрабатывается плавно и прогнозируемо). Возможность влиять на процессы в компании (по окончанию каждого проекта работаем над ошибками).</p> </li> <li> <p>Составляем личный план развития + старший товарищ, который поможет.</p> </li> <li> <p>Современные инструменты для управления проектами. Вы научитесь работать с передовыми инструментами.</p> </li> <li> <p>Компания оплачивает учёбу и сертификацию.</p> </li> </ol>",Полная занятость,Полный день,От 1 года до 3 лет,|Веб разработка|Backend development|PHP|1С-Битрикс|JavaScript|Git|PostgreSQL|ООП|MySQL|Веб-программирование|Bitrix|SQL|Ajax,3.0,80000.0,1.0,25000.0,web,"В работе мы ждем от вас ответственности, самостоятельности, внимательности и аккуратности. Если столкнетесь с чем то сложным и решения не...","Дополнительные инструкции. Работа в команде с другими людьми (аналитики, проектировщики, дизайнеры, специалисты по продвижению), которые подпитывают новыми знаниями. "
