city,company-name,date,description,employment-form,employment-schedule,experience,key_skills,max-experience,max-salary,min-experience,min-salary,name,requirements,responsibilities
Тюмень,Ключевой фактор,2019-10-03T10:59:02+0300,"<p><strong>Junior Frontend Developer / </strong><strong>Веб</strong><strong>-</strong><strong>разработчик</strong><strong> (Frontend)</strong></p> <p> </p> <p><strong>Чем предстоит заниматься:</strong></p> <ul> <li>Разрабатывать frontend для веб и мобильных приложений</li> <li>Поддерживать frontend существующих приложений</li> <li>Конструктивно взаимодействовать в команде</li> </ul> <p> </p> <p><strong>Ты нам подходишь, если:</strong></p> <ul> <li>Имеешь базовые знания HTML, CSS, JS, JQuery, AJAX</li> <li>Знаешь на базовом уровне хотя-бы один из фреймворков: React / Angular / VueJS или др.</li> <li>Умеешь писать простой и понятный код, следуя принятой методологии</li> <li>Понимаешь принципы ООП</li> <li>Умеешь разбираться в чужом коде</li> </ul> <p> </p> <p><strong>Будет круто, если:</strong></p> <ul> <li>Имеешь какой-то опыт разработки frontend</li> <li>Владеешь каким-либо препроцессором: SASS / Stylus / PostCSS или др.</li> <li>Знаешь или что-то слышал о семантической разметке</li> </ul> <p>Условия работы:</p> <p>- офис в центре города</p> <p>- работа в скрам-команде</p> <p><strong>Сайт компании: http://kfactor.ru/</strong></p>",Полная занятость,Полный день,От 1 года до 3 лет,|HTML|CSS|Ext JS|jQuery|Ajax|AngularJS,3.0,70000.0,1.0,35000.0,web,"Имеешь базовые знания HTML, CSS, JS, JQuery, AJAX. Знаешь на базовом уровне хотя-бы один из фреймворков: React / Angular / VueJS...",Разрабатывать frontend для веб и мобильных приложений. Поддерживать frontend существующих приложений. Конструктивно взаимодействовать в команде.
Тюмень,CDS Company,2019-10-10T14:02:14+0300,"<p>CDS Company - студия веб-разработок.<br />Мы специализируемся на разработке крупных проектов, регионального и федерального уровня.<br />Мы разрабатываем высоконагруженные интернет-магазины, CRM-системы для различных предприятий, профессиональные корпоративные порталы, модернизируем порталы СМИ и много других сложных, нетривиальных проектов. В разработке мы используем передовые технологии и крутые решения технического характера. В разработке используем нашу внутреннюю CRM систему для оптимизации внутренних бизнес-процессов.</p> <p>На сегодняшний день разработано и запущено свыше 50 проектов и находится более 100 сайтов на технической поддержке.</p> <p>На текущий момент набираем команду программистов для развития своих кодерских навыков и для разработки крутых проектов в связи с расширением штата и увеличением объема работ. Есть team-lead, наставник, который справится с любой задачей и любым вопросом.</p> <p><strong>Обязанности:</strong></p> <p>- Верстка проектов с нуля по дизайн-макетам PSD;<br />- Доработки верстки существующих проектов;<br />- Адаптация макетов под мобильные устройства;<br />- Написание JS-скриптов на базе jQuery;<br />- Оптимизация работы HTML/CSS/JS для ускорения работы сайтов;</p> <p><strong>Требования:</strong></p> <p>- Базовые знания web-разработки;<br />- Знание JavaScript, JQuery;<br />- Знание HTML5;<br />- Знание CSS3.0;<br />- Знание SASS;<br />- Сборка на базе Node.js c таск-менеджером Gulp;<br />- Знание Pug/Jade;<br />- Базовые знания JavaScript, jQuery;<br />- Пунктуальность;<br />- Ответственность;<br />- Не бояться учиться чему-то новому;</p> <p><strong>Условия:</strong></p> <p>- Работа в офисе в будни, график вы устанавливаете себе сами;<br />- Перерыв на обед - 1 час в любое время;<br />- Предоставляем рабочее место с хорошим компьютером (2 монитора, производительный компьютер);<br />- За Вами будет закреплен руководитель, который будет помогать решать технические вопросы и руководить процессом разработки;<br />- Обучение и повышение квалификации;<br />- Официальное трудоустройство минимум после 2 месяцев испытательного срока;<br />- Чай и печеньки за наш счет;<br />- Корпоративчики и пятничные посиделки;<br />- Офис в центре города;<br />- Корпоративное жилье для иногородних;<br />- Соц.пакет: выплата больничных, выплата отпускных, выплата квартальных премий, мед. страховка;</p> <p>На текущем этапе развития компании гарантируем карьерный рост до руководителя отдела разработки и выше.</p>",Полная занятость,Полный день,От 1 года до 3 лет,|PHP|jQuery|CSS3|1С-Битрикс|CSS|ООП|MySQL|CMS Wordpress|HTML|HTML5|JavaScript|Ajax,3.0,100000.0,1.0,40000.0,web,"Базовые знания web-разработки. - Знание JavaScript, JQuery. - Знание HTML5. - Знание CSS3.0. - Знание SASS. - Знание Pug/Jade. - ",Верстка проектов с нуля по дизайн-макетам PSD. - Доработки верстки существующих проектов. - Адаптация макетов под мобильные устройства. - Написание JS-скриптов...
Тюмень,Компания Эхо,2019-09-19T08:38:12+0300,"<p><strong>Обязанности:</strong></p> <p>В нашу команду технарей требуется человек с чувством прекрасного, способный обернуть качественный код в достойную форму. Нам нужен человек, который знает что такое юзабилити и user experience design и использует эти знания в своих работах.</p> <p>Основные задачки: разработка фирменных стилей, интерфейсов, дизайнов сайтов и интернет-магазинов, разработка дизайнов мобильных приложений, прототипирование.</p> <p><strong>Требования:</strong></p> <ul> <li>Владение графической композицией и художественными навыками.</li> <li>Структурное, логическое мышление наряду с творческим, нестандартным.</li> <li>Владение Photoshop, Illustrator и пр.</li> <li>Самостоятельность и самоорганизованность.</li> <li>Умение рисовать от руки</li> <li>Наличие портфолио</li> </ul> <p><strong>Условия:</strong></p> <ul> <li>Официальное трудоустройство</li> <li>Достойная оплата в соответствии со знаниями, навыками и результатами</li> <li>Поощрение в реализации профессиональных амбиций</li> <li>Дружный коллектив специалистов, который обменивается опытом и развивается вместе, есть возможности для развития – внутреннее обучение, мастер-классы для сотрудников</li> <li> <p>Корпоративные мероприятия (по пятницам мы любим играть в «Мафию» и другие игры, устраиваем банкеты и празднуем Дни Рождения)</p> </li> <li> <p>Возможность поспать – гибкий график: не можешь встать в 7 утра? Приходи на работу позже, но у нас полный рабочий день.</p> </li> <li> <p>В офисе комфортные условия - мощные компьютеры, два монитора, кофе, чай, снэки.</p> </li> </ul>",Полная занятость,Полный день,От 1 года до 3 лет,|Adobe Photoshop|Adobe Illustrator|Web Design|Web-дизайн|Графический дизайн|Дизайн|Веб-дизайн|Креативность|Разработка фирменного стиля|Творческое мышление,3.0,50000.0,1.0,30000.0,web,"Владение графической композицией и художественными навыками. Структурное, логическое мышление наряду с творческим, нестандартным. Владение Photoshop, Illustrator и пр. ","Основные задачки: разработка фирменных стилей, интерфейсов, дизайнов сайтов и интернет-магазинов, разработка дизайнов мобильных приложений, прототипирование."
Тюмень,R-Style Softlab (Эр-Стайл Софтлаб),2019-10-02T17:11:29+0300,"<p><strong>R-Style SoftLab в поисках разработчиков Java middle и senior уровней!</strong></p> <p>Мы делаем банковские ИТ продукты, которые улучшают и облегчают жизнь миллионов людей.</p> <p>Наши системы интернет-банкинга и мобильные приложения успешно работают в крупнейших банках России и СНГ.<br /><br />Если вам давно хотелось сменить окружающий вас ландшафт на возможность работать в паре километров от пляжа, в более мягком морском климате, принимая участие в интересных проектах, то эта вакансия – шанс реализовать план!<br /><br /><strong>R-Style SoftLab запускает программу релокации</strong> в крымском направлении для Java-разработчиков России!</p> <p>Мы наращиваем портфель заказов и поэтому расширяем проектные команды в наших южных филиалах!</p> <p><strong>Чем предстоит заниматься:</strong></p> <ul> <li>Разрабатывать высоконагруженные системы в банковском и страховом секторе в роли fullstack Java разработчика</li> <li>Осуществлять интеграцию продукта с различными внешними системами;</li> <li>Разрабатывать пользовательские интерфейсы, бизнес-логику;</li> <li>Участвовать в проектировании баз данных и архитектуры продуктов;</li> </ul> <p><strong>Каких Джавистов мы особенно ждем:</strong></p> <ul> <li>Умеющих разрабатывать web-приложения на Java с опытом разработки от 1 года</li> <li>Уверенно владеющих Java SE (1.7, 1.8)</li> <li>Владеющих стеком - JavaScript, HTML, CSS</li> <li>Большим плюсом является знание Spring, Hibernate, HTML, JavaScript, WebServices (JAX-WS), REST Service, а в идеале - React JS, Tapestry (или JSF)</li> <li>Умеющих работать с системами контроля версий (SVN/GIT)</li> <li>Понимающих принципы создания многопоточных приложений, а в идеале - и принципы построения решений в микросервисной архитектуре</li> <li>Умеющих читать и понимать ER-диаграммы, UML</li> <li>Уверенно работающих с СУБД Oracle или PostgreSQL</li> <li>Навыки проектирования баз данных приветствуются</li> </ul> <p><br /><strong>Что может предложить R-Style Softlab:</strong></p> <ul> <li>Масштабные проекты, в которых можно проявить свои способности;</li> <li>Разработка и совершенствование проектов ведется в микросервисной архитектуре;</li> <li>Мы придерживаемся идеи использования современных технологий и подходов везде, где это возможно;</li> <li>Практикуем Agile подход, но не сторонники жесткого ограничения в нём. Понимаем, когда Agile нужен, а когда лучше воспользоваться другими методологиями;</li> <li>Мы обучаем наших сотрудников, проводим внутренние митапы;</li> <li>Работа в надежной стабильной компании (участника рейтинга работодателей России по рейтингу hh.ru) - лидере рынка банковской автоматизации;</li> <li>Оформление в соответствии с ТК РФ;</li> <li>Заработная плата официальная - оклад и достойные премии по результатам работы;</li> <li>График работы: 5/2, полный рабочий день, гибкое время начала рабочего дня (с 8 до 11).</li> <li>Добровольное медицинское страхование, хорошие клиники и программы;</li> <li>Корпоративное обучение и различные корпоративные мероприятия;</li> </ul> <p><strong>По программе релокации:</strong></p> <ul> <li>Компенсация билета*, чтобы приехать/прилететь к нам;</li> <li>Разовые подъёмные*, чтобы начать обосновываться;</li> <li>50% компенсации затрат на проживание* в городах присутствия R-Style SoftLab (Севастополь, Симферополь) после успешного прохождения испытательного срока (3 месяца в соответствии с ТК РФ);</li> <li>Море – всего в получасе пешей прогулки от севастопольского офиса или в часе езды от симферопольского!<br /><br />*Все суммы обговариваются с кандидатами, успешно прошедшими отбор на эту вакансию</li> </ul>",Полная занятость,Полный день,От 1 года до 3 лет,|Java|JSP|HTML|CSS|Spring Framework|JavaScript|PostgreSQL|SVN|Git|ORACLE,3.0,,1.0,,web,"Умеющих разрабатывать web-приложения на Java с опытом разработки от 1 года. Уверенно владеющих Java SE (1.7, 1.8). ",Разрабатывать высоконагруженные системы в банковском и страховом секторе в роли fullstack Java разработчика. Осуществлять интеграцию продукта с различными внешними системами. 
Тюмень,Креатив,2019-10-01T15:13:13+0300,"<p>Уникальный совместный проект <strong>Creative и РБК (РосБизнесКонсалтинг)</strong> - офис разработки продуктов для ведущего мультимедийного холдинга России в Тюмени.</p> <p>Мы создаем классные продукты федерального масштаба находясь в любимом городе.</p> <p>В связи с расширением команды нам нужны разработчики TypeScript/JavaScript.</p> <p><strong>О проекте:</strong></p> <p>Сбор и хранение в электронном виде русскоязычной периодики. Ежедневно в базу СМИ загружается более 100 тыс. новых документов. Перед нами стоит задача разработки новых продуктов и сервисов с использованием<br />технологий машинного обучения и обработки текстов, а также развития и модернизации системы хранения и поиска информации.</p> <p><strong>Технологический стек:</strong> TypeScript, React, Mobx или Redux.</p> <p><strong>Обязанности:</strong></p> <ul> <li>Разработка на TypeScript + Mobx или Redux.</li> <li>Обеспечение качества путем участия в code review и написания unit-тестов.</li> </ul> <strong>Требования:</strong> <ul> <li>опыт программирования на JavaScript или TypeScript;</li> <li>навыки написания юнит-тестов;</li> <li>умение работать с application state с использованием Mobx и/или Redux;</li> <li>навыки работы c git.</li> </ul> <strong>Условия:</strong> <ul> <li>опытная команда неравнодушных людей (в офисе сейчас более 50 человек);</li> <li>полностью оборудованное рабочее место;</li> <li>комфортный офис, такого вы еще не видели;</li> <li>демократичный стиль управления в компании (всегда можно обсудить и внедрить идеи, оптимизацию);</li> <li>оплата всегда стабильно и вовремя.</li> </ul>",Полная занятость,Полный день,От 1 года до 3 лет,|JavaScript|TypeScript|Mobx|Redux|Git,3.0,120000.0,1.0,50000.0,web,Опыт программирования на JavaScript или TypeScript. Навыки написания юнит-тестов. Умение работать с application state с использованием Mobx и/или...,Разработка на TypeScript + Mobx или Redux. Обеспечение качества путем участия в code review и написания unit-тестов.
