city,company-name,date,description,employment-form,employment-schedule,experience,key_skills,max-experience,max-salary,min-experience,min-salary,name,requirements,responsibilities,days_from_publish
Санкт-Петербург,Height Line,2019-12-13T16:33:06+0300,"<p>В Digital агентство <strong>Height Line</strong> требуется <strong>проект-менеджер!</strong></p> <p><strong>Среди наших клиентов: </strong>Российская сеть клиник по похудению &quot;Доктор Борменталь&quot;, Охранные системы &quot;Аркан&quot;, Российский департамент Motorola Solutions и так далее.</p> <p>У нас вы получите море опыта, связанного с маркетингом. Познакомитесь с крутыми профессионалами с которых знания можно собирать без остановки, сможете поучаствовать в крутых событиях от наших партнеров - Calltouch, AmoCRM, Bitrix, а также зарабатывать очень неплохие деньги.</p> <p><strong>По мимо понятных клиентов у нас:</strong></p> <ul> <li>Завтраки с 10 до 11 утра;</li> <li>Английский язык 2 раза в неделю;</li> <li>Футбольная команда;</li> <li>Команда по Интелкроссу;</li> <li>Настольный теннис;</li> <li>Кухня, кофе и печеньки.</li> <li>Комфортный график с 11 утра до 19 вечера.</li> </ul> <p><strong>Задачи:</strong></p> <ul> <li>Построение плана или стратегии развития клиента на месяц, квартал, год.</li> <li>Распределение задач по проекту между участниками рабочей группы.</li> <li>Получение обратной связи от клиента, контроль и оптимизация результатов.</li> <li>Работа с дебиторской задолженностью клиентов.</li> </ul> <p> </p> <p><strong>Требования:</strong></p> <ul> <li>Опыт работы с рекламными специалистами, дизайнерами и программистами.</li> <li>Знания интернет-маркетинга и всех основных каналов рекламы.</li> <li>Настойчивость, гибкость при ведении переговоров, умение достигать поставленных целей</li> <li>Активность, сообразительность, ответственность, стрессоустойчивость.</li> <li>Желание развиваться и повышать свой профессиональный уровень в области рекламы.</li> </ul> <p> </p> <p>* Умение создавать прототипы сайтов (Axure или другой инструмент) будет вашим преимуществом.</p> <p> </p> <p><strong>Условия:</strong></p> <ul> <li>Совокупный доход от 50 000 руб.: оклад + % от ведения клиента, реальная возможность зарабатывать 100 000р +.</li> <li>Прозрачная система подсчёта дохода‚ своевременная и стабильная оплата труда.</li> <li>Оформление по ТК РФ.</li> <li>Оплата мобильной связи‚ обучение за счёт компании‚ оборудованное рабочее место.</li> </ul> <p> </p> <p>Ждем Ваших Резюме!</p>",Полная занятость,Полный день,От 1 года до 3 лет,|Интернет-реклама|Контекстная реклама|Управление проектами|SEO|Internet Marketing|Управление продажами|Планирование рекламных кампаний|Ведение переговоров|Управление интернет-проектами|Маркетинговый анализ|Копирайтинг|Google Analytics|Google AdWords|Social Media Marketing|Яндекс.Директ|Яндекс.Метрика|Организаторские навыки|Бюджетирование|Оптимизация бизнес-процессов|Управление командой|Заключение договоров|Деловая переписка|Навыки презентации|Работа в команде|Управление персоналом|Деловое общение|Проведение презентаций,3.0,160000.0,1.0,50000.0,маркетолог,"Опыт работы с рекламными специалистами, дизайнерами и программистами. Знания интернет-маркетинга и всех основных каналов рекламы. Настойчивость, гибкость при ведении...","Построение плана или стратегии развития клиента на месяц, квартал, год. Распределение задач по проекту между участниками рабочей группы. ",0
Санкт-Петербург,"АртФактор, студия веб-дизайна",2019-12-13T14:54:17+0300,"<p><strong>Обязанности:</strong></p> <ul> <li>на первом этапе: выполнение стандартных задач по оптимизации сайтов под руководством SEO специалистов компании;</li> <li>в дальнейшем: самостоятельное ведение клиентских проектов;</li> <li>работа с контекстной рекламой (возможно обучение);</li> <li>координация занятых в проектах программистов, дизайнеров, копирайтеров и пр.;</li> <li>взаимодействие с клиентом для выявления потребностей;</li> </ul> <p><strong>Требования:</strong></p> <ul> <li>грамотность, правильная устная и письменная речь;</li> <li>знание основ интернет-маркетинга, SEO, технологий сайтостроения;</li> <li>организаторские способности, ответственность, внимательность к деталям;</li> <li>умение и желание общаться с людьми;</li> </ul> <p><strong>Условия:</strong></p> <ul> <li>моральная поддержка, дружный коллектив;</li> <li>обучение, условия для профессионального роста;</li> <li>работа недалеко от м. Кировский Завод;</li> <li>оформление по ТК РФ.</li> </ul>",Полная занятость,Полный день,От 1 года до 3 лет,,3.0,45000.0,1.0,20000.0,маркетолог,"Грамотность, правильная устная и письменная речь. Знание основ интернет-маркетинга, SEO, технологий сайтостроения. Организаторские способности, ответственность, внимательность к деталям. ",На первом этапе: выполнение стандартных задач по оптимизации сайтов под руководством SEO специалистов компании. В дальнейшем: самостоятельное ведение клиентских проектов. ,0
Санкт-Петербург,Onlime,2019-12-09T14:29:34+0300,"<strong>Обязанности:</strong> <p>Руководство отделом телемаркетинга:</p> <p>Распределение планов нагрузки на отдел телемаркетинга;</p> <p>Участие в подборе, адаптации, обучении персонала;</p> <p>Контроль выполнения планов по продажам и уровню сервиса;</p> <p>Мониторинг качества работы сотрудников;</p> <p>Реализация специальных акций и маркетинговых мероприятий, а также иных мероприятий, направленных на увеличение объемов продаж услуг;</p> <p>Предоставление отчетов по количественным и качественным показателям работы отдела в целом;</p> <strong>Требования:</strong> <p>Высшее образование.</p> <p>Опыт работы руководителем отдела телемаркетинга/продажах/ Call – центра от 3-х лет;</p> <p>Умение и опыт планирования работ, управления изменениями;</p> <p>Лидерские качества, навыки наставничества, системное мышление, умение выстраивать бизнес процессы;</p> <p>Умение находить компромиссы и решать задачи любой сложности;</p> <p>Обязательное знание показателей Call-центра</p> <p>Опыт руководства штатом от 50 человек.</p> <strong>Условия:</strong> <p>Работа в крупной стабильной компании;</p> <p>Молодой и дружный коллектив;</p> <p>Оформление по ТК РФ;</p> <p>Заработная плата: оклад + премия;</p> <p>График работы: 5/2 с 9:00- 18:00.</p> <p> </p>",Полная занятость,Полный день,От 3 до 6 лет,|Управление продажами|Управление персоналом|Руководство коллективом,6.0,,3.0,80000.0,маркетолог,"Высшее образование. Опыт работы руководителем отдела телемаркетинга/продажах/ Call – центра от 3-х лет. Умение и опыт планирования работ, управления...","Руководство отделом телемаркетинга: Распределение планов нагрузки на отдел телемаркетинга. Участие в подборе, адаптации, обучении персонала. Контроль выполнения планов по продажам...",4
Санкт-Петербург,Party Time,2019-11-20T22:27:09+0300,"<strong>Обязанности:</strong> <ul> <li>Настройка и ведение контекстной рекламы в системах Яндекс.Директ, Google.Ads</li> <li>Обеспечение целевого KPI по объему и стоимости целевых обращений с рекламных кампаний;</li> <li>Глубокий анализ данных по рекламе и сайту с помощью Google.Analytics, Яндекс Метрики, Calltouch. Оптимизация затрат на рекламу на основе полученной статистики;</li> <li>Формирование рекомендаций по улучшению посадочных страниц;</li> <li>Регулярная подготовка отчетов по итогам работы рекламных кампаний;</li> <li>Еженедельное медиапланирование по рекламным инструментам.</li> </ul> <strong>Требования:</strong> <ul> <li>Опыт работы с контекстной рекламой Яндекс.Директ, Google Ads;</li> <li>Опыт работы с системами аналитики Google.Analytics, Яндекс.Метрикой</li> <li>Хорошее знание Excel (формулы, фильтры, сводные таблицы и т.п.);</li> <li>Развитые аналитические способности, интерес к цифрам и статистике</li> <li>Грамотный русский язык, обучаемость, внимательность;</li> <li>Желание развиваться в сфере платного трафика.</li> </ul> <strong>Условия:</strong> <ul> <li>Достаточно свободный график. Не нужно каждое утро ездить в офис. Встречи 2-3 раза в неделю всей командой.</li> <li>Большая свобода действий и возможность экспериментировать</li> <li>5 бизнесов в холдинге с разными направлениями.</li> <li>Достойная заработная плата при выполнении KPI</li> </ul>",Полная занятость,Полный день,От 1 года до 3 лет,|Контекстная реклама|Лидогенерация|Яндекс.Метрика|Яндекс.Директ|Google AdWords|Google Analytics|Реклама|Работа с большим объемом информации|Google Docs,3.0,,1.0,,маркетолог,"Опыт работы с контекстной рекламой Яндекс.Директ, Google Ads. Опыт работы с системами аналитики Google.Analytics, Яндекс.Метрикой. Хорошее знание Excel (формулы, фильтры...","Настройка и ведение контекстной рекламы в системах Яндекс.Директ, Google.Ads. Обеспечение целевого KPI по объему и стоимости целевых обращений с рекламных...",23
Санкт-Петербург,Бюро переводов ЛингваКонтакт,2019-11-13T20:02:47+0300,"<p>Языковому центру «ЛингваКонтакт» (бюро переводов, языковой обучающий центр) на постоянную работу (в штат) требуется менеджер по интернет-рекламе и PR</p> <p><strong>Требования:</strong></p> <p>— Образование в сфере интернет-рекламы и/или PR.</p> <p>— Отличная техническая грамотность. Знание SEO.</p> <p>— Глубокое понимание принципов тартетинга и лидогенерации (директ, адвордс, соцсети).</p> <p>— SEO / SMM.</p> <p>— Знание графических пакетов, базовые навыки дизайна.</p> <p>— Умение оперативно искать и анализировать информацию.</p> <p>— Знание английского языка; интерес к языкам в целом.</p> <p>— Понимание технических и маркетинговых основ функционирования сайта. SEO.</p> <p>— Отличное знание литературного русского языка, начитанность, письменная и устная грамотность.</p> <p>— Желателен опыт в журналистике и PR, опыт написания грамотных и содержательных статей (портфолио).</p> <p>— Высокая лояльность компании.</p> <p> </p> <p><strong>Обязанности</strong>:</p> <p>— Работа с тремя сайтами по трём основным направлениям компании: http://linguacontact.com/, http://linguacontact.ru/, http://translator-school.com/ .</p> <p>— Разработка и реализация рекламной стратегии компании (бюро переводов и обучающего центра).<br />— Поиск эффективных рекламных партнеров онлайн и офлайн.<br />— Таргетинг, лидогенерация в яндекс-директ и гугл-адвордс.<br />— SMM/SEO.<br />— Полная аналитика эффективности маркетинга.<br />— Работа с полиграфией.</p> <p> </p> <p><strong>Условия:</strong></p> <p>— График: с 09:00 до 18:00, пятидневная рабочая неделя.</p> <p>— Офис у метро «Садовая».</p> <p>— З/п — по результатам тестирования/собеседования и наличия конкурентных предложений от соискателей.</p> <p>— Отличные возможности для профессионального, интеллектуального и личностного роста в дружном коллективе.</p> <p><strong>Адрес</strong></p> <p>Санкт-Петербург, Апраксин переулок</p>",Полная занятость,Полный день,От 3 до 6 лет,|Интернет-реклама|Письменный перевод|Adobe Photoshop|Копирайтинг|Adobe Illustrator|Английский язык|SEO|Internet Marketing|SEO оптимизация|Email маркетинг|SMM|SMS маркетинг|WEB аналитика|Яндекс.Директ|Графический дизайн|Лидогенерация|Составление семантического ядра|Управление бюджетом|Интернет маркетинг|Разработка маркетинговой стратегии|Маркетинговый анализ|Контекстная реклама|SMO,6.0,60000.0,3.0,40000.0,маркетолог,Образование в сфере интернет-рекламы и/или PR. — Отличная техническая грамотность. Знание SEO. — Глубокое понимание принципов тартетинга и лидогенерации (директ...,Разработка и реализация рекламной стратегии компании (бюро переводов и обучающего центра). — Поиск эффективных рекламных партнеров онлайн и офлайн. — ,30
Санкт-Петербург,АРЕС,2019-12-02T10:55:15+0300,"<p>Крупный торговый комплекс на Юго-Западе СПб приглашает <strong>Менеджера по рекламе и маркетингу</strong></p> <p><strong>Задачи:</strong></p> <p>· Участие в разработке и реализации контент-стратегий компании в соц. сетях</p> <p>· Создание качественного контента + управление аккаунтами ВК, Инстаграмм, каналом Ютуб</p> <p>· Продвижение</p> <p>· Ответы на вопросы подписчиков, отработка негативных реакций</p> <p>· Генерирование идей, совместно с командой отдела, для продвижения объекта</p> <p>· Участи в различных проектах отдела рекламы и маркетинга - event, общение с арендаторами, редизайн сайта и т.д.</p> <p><strong>Мы предлагаем:</strong></p> <p>· Официальное оформление и белую з/п, оплата отпуска, больничного</p> <p>· Возможности для профессионального развития в сфере маркетинга и рекламы</p> <p>· Возможность получить управленческий опыт</p> <p>· Участие в интересных проектах</p> <p>· Коллектив профессионалов и просто хороших людей)</p> <p>· Оборудованное рабочее место + комплексный обед за счет компании</p> <p>· График работы – пятидневка</p> <p>· Зарплата белая - от 50000 рублей после налогообложения</p> <p>· Место работы – современный офис на территории Ярмарки ЮНОНА, улица Маршала Казакова</p> <p><strong>Пожелания к кандидатам:</strong></p> <p>· Знание русского языка, грамотная письменная речь, «живой» текст</p> <p>· Знание и практический опыт использования инструментов SMM</p> <p>· Знание современных тенденций Digital Marketing</p> <p>· Знание основ вирусного и антикризисного маркетинга</p> <p> </p> <p> </p>",Полная занятость,Полный день,От 3 до 6 лет,|SMM|Ведение групп в социальных сетях|Social Media Marketing|Adobe Photoshop|Internet Marketing,6.0,,3.0,50000.0,маркетолог,"Знание русского языка, грамотная письменная речь, «живой» текст. Знание и практический опыт использования инструментов SMM. Знание современных тенденций Digital Marketing. ","Участие в разработке и реализации контент-стратегий компании в соц. сетях. Создание качественного контента + управление аккаунтами ВК, Инстаграмм, каналом...",11
