city,company-name,date,description,employment-form,employment-schedule,experience,key_skills,max-experience,max-salary,min-experience,min-salary,name,requirements,responsibilities,days_from_publish
Москва,"Кунцево, Технический центр",2019-11-25T13:01:42+0300,"<strong>Обязанности:</strong> <ul> <li>Работа над выполнением KPI компании по интернет-трафику и трафику звонков/лидов.</li> <li>Оценка конверсии и юзабилити посадочных страниц и сайтов компании.</li> <li>регулярный мониторинг и анализ эффективности рекламных компаний</li> <li>оценка инструментов аналитики по направлению SEO и контекстной рекламе</li> <li>участие в разработке стратегии продвижения бренда: определение целевой аудитории, изучение ее интересов, поведения, потребностей. Поиск площадок с высокой концентрацией целевой аудитории, интеграция SMM-активности в общую маркетинговую стратегию компании</li> <li>разработка стратегии работы с e-mail рассылками: сегментация базы, подбор и реализация e-mail-рассылок</li> <li>Работа с подрядчиками: контроль выполнения поставленных задач, ответственность за результат работы.</li> </ul> <strong>Требования:</strong> <ul> <li>Высшее образование, желательно экономическое либо по направлению маркетинга</li> <li>Опыт работы в аналогичной должности от 3 лет (как на стороне агентства, так и на стороне прямого заказчика)</li> <li>Опыт настройки компаний в инструментах Яндекс,Google, углубленные знания механизмов и инструментов контекстной рекламы</li> <li>Знание принципов и опыт построения систем web аналитик.</li> <li>Понимание факторов, влияющих на конверсию.</li> <li>Опыт продвижения в SMM</li> <li>Опыт создания сайтов , микро-сайтов, посадочных страниц.</li> <li>Опыт работы с аналитическими данными, знание различных аналитических показателей, умение подобрать верные показатели для анализа.</li> </ul> <strong>Условия:</strong> <ul> <li>Работа в стабильной, развивающейся компании (Технический Центр «Кунцево» является официальным дилером 14 автомобильных брендов);</li> <li>Оформление по ТК РФ, оплачиваемые больничные, отпуска</li> <li>График работы 5/2, с 09:00 до 18:00.</li> <li>Скидки сотрудникам на приобретение автомобилей (дополнительное оборудование, запасные части и аксессуары) и сервисное обслуживание</li> <li>Бесплатная парковка на территории</li> <li>Место работы<strong> м. Молодежная</strong></li> </ul> <p><strong>Уважаемые кандидаты, на текущий момент мы рассматриваем кандидатов для работы в офисе в режиме 5/2. Удаленный режим работы не предусмотрен.</strong></p>",Полная занятость,Полный день,От 3 до 6 лет,|Контекстная реклама|SMM|Повышение конверсии|Лидогенерация|Email маркетинг|WEB аналитика|Аудит SMM|Информационные рассылки|SEO,6.0,100000.0,3.0,90000.0,маркетолог,"Высшее образование, желательно экономическое либо по направлению маркетинга. Опыт работы в аналогичной должности от 3 лет (как на стороне агентства...",Работа над выполнением KPI компании по интернет-трафику и трафику звонков/лидов. Оценка конверсии и юзабилити посадочных страниц и сайтов...,18
Москва,BingoBoom,2019-12-13T10:38:39+0300,"<p>Группа компаний<strong> BingoBoom </strong>создаёт один из самых удобных и технологичных букмекерских продуктов на российском рынке. По всей России открыты более 400 наших клубов, а сайт BingoBoom является одним из лидеров по трафику среди букмекерских компаний. Мы спонсируем футбольные клубы, лиги и национальные сборные, а также уделяем внимание благотворительным проектам.</p> <p><strong>Обязанности:</strong></p> <ul> <li> <p>Планирование и реализация медийных рекламных кампаний в интернете (баннеры на спортивных сайтах, видео);</p> </li> <li> <p>Создание и управление контекстными рекламными кампаниями (Яндекс РСЯ, ремаркетинг) и таргетированными рекламными кампаниями (Facebook, VKontakte, MyTarget) самостоятельно или через партнеров;</p> </li> <li> <p>Анализ и оптимизация рекламных источников в соответствии с поставленными KPI;</p> </li> <li> <p>Участие в разработке рекламных материалов – видео, баннеры, лэндинги и т.д. совместно с отделом дизайна;</p> </li> <li> <p>Формирование отчетности для контроля и анализа размещений;</p> </li> <li> <p>Анализ воронки, проведение экспериментов и a/b тестов с целью повышения конверсий;</p> </li> <li> <p>Поиск и тестирование новых форматов и технологий;</p> </li> <li> <p>Анализ рекламных активностей конкурентов.</p> </li> </ul> <p><strong>Требования:</strong></p> <p>- Опыт работы от 1 года на аналогичной должности (специалист по контекстной/медийной рекламе, трафик-менеджер) на стороне агентства или клиента;</p> <p>- Знание инструментов веб-аналитики: Google Analytics, Я.Метрика;</p> <p>- Навыки работы с Я.Директ, Google.ads, Facebook ads, My target;</p> <p>- Навыки подготовки брифа на разработку креативов (баннеры, ролики, лендинги);</p> <p>- Грамотная устная и письменная речь;</p> <p>- Ответственность и стремление к развитию.</p> <p><strong>Мы предлагаем:</strong></p> <p>- Оформление по ТК;</p> <p>- Гибкий график работы, пятница сокращенный день;</p> <p>- ДМС со стоматологией после испытательного срока;</p> <p>- Возможности для карьерного и профессионального развития.</p> <p><strong>Приятные бонусы:</strong></p> <p>- Бесплатные завтраки, обеды, ужины и кофе;</p> <p>- Компенсация фитнеса (100%);</p> <p>- Корпоративный футбол, волейбол и хоккей 2 раза в неделю: 100% оплата компанией;</p> <p>- Настольные игры и книги в офисе.</p>",Полная занятость,Полный день,От 1 года до 3 лет,|Google Analytics|Яндекс.Директ|Яндекс.Метрика|Google AdWords|Adobe Photoshop|Веб-аналитика|Управление интернет-проектами|Баннерная реклама,3.0,,1.0,,маркетолог,"Опыт работы от 1 года на аналогичной должности (специалист по контекстной/медийной рекламе, трафик-менеджер) на стороне агентства или клиента. - ","Планирование и реализация медийных рекламных кампаний в интернете (баннеры на спортивных сайтах, видео). Создание и управление контекстными рекламными кампаниями (Яндекс...",0
Москва,НОВАКОЛОРРФ,2019-12-10T23:11:56+0300,"<p><strong>Обязанности:</strong></p> <ul> <li>Администрирование двух сайтов</li> <li>Разработка и внедрение комплекса мероприятий по продвижению в Интернет</li> <li>SEO продвижение сайта</li> <li>Работа с соц. сетями (SMO,SMM - продвижение)</li> <li>Размещение контекстной и баннерной рекламы</li> <li>Создание контента и информационных поводов - описания для продукции, пресс-релизы, статьи, новости компании</li> <li>Корректировка текстового и графического контента на сайте компании</li> <li>Поиск эффективных рекламных площадок, взаимодействие с ними</li> <li>Анализ деятельности конкурентов в сети Интернет</li> <li>WEB-аналитика</li> </ul> <p> </p> <p><strong>Требования:</strong></p> <ul> <li>Знание инструментов интернет-маркетинга</li> <li>Приветствуется опыт в создании и развитии сайтов</li> <li>Навыки написания рекламных сообщений, постов, статей</li> <li>Приветствуется опыт работы по созданию и ведению рекламных кампаний в Интернет</li> <li>Высокая работоспособность, многозадачность, креативность, умение работать «на результат»</li> <li>Грамотная устная и письменная речь</li> </ul> <p> </p> <p><strong>Условия:</strong></p> <ul> <li>Оформление по ТК РФ</li> <li>Заработная плата обсуждается при собеседовании</li> <li>Молодой коллектив, хорошие условия работы</li> </ul> <p> </p>",Полная занятость,Полный день,От 1 года до 3 лет,,3.0,,1.0,,маркетолог,"Знание инструментов интернет-маркетинга. Приветствуется опыт в создании и развитии сайтов. Навыки написания рекламных сообщений, постов, статей. Приветствуется опыт работы...",Администрирование двух сайтов. Разработка и внедрение комплекса мероприятий по продвижению в Интернет. SEO продвижение сайта. Работа с соц. ,3
Москва,Магазин Poood.ru,2019-11-18T19:29:11+0300,"<strong>Обязанности:</strong> <ul> <li>Умение определять целевую аудиторию по каждому продукту;</li> <li>Формирование нового трафика на продукты;</li> <li>Создание, планирование и запуск рекламных кампаний;</li> <li>Делегирование задач на исполнителей;</li> <li>Расчет и планирование бюджета рекламных кампаний по каналам;</li> <li>Анализ экономической эффективности работы рекламных каналов;</li> <li>Продвижение в Google.Adwords, Яндекс.Директ, и других рекламных площадках;</li> <li>SEO.</li> </ul> <strong>Требования:</strong> <ul> <li>Знание инструментария основных каналов продвижения в интернете;</li> <li>Знание основ SEO, SMM, построения Таргентинговых объявлений;</li> <li>Опыт работы со сквозной аналитикой, с сервисами Google.Analytics, Яндекс.Метрика;</li> <li>Умение структурировать и анализировать информацию, расставлять приоритеты;</li> <li>Готовность к высокому темпу работы в условиях многозадачности;</li> <li>Выполнение задач в соответствии со сроками;</li> <li>Умение писать понятные и продающие тексты;</li> </ul> <strong>Условия:</strong> <ul> <li>Испытательный срок 1-2 месяца.</li> <li>Выдача заработной платы два раза в месяц, без опозданий. Оформление по ТК.</li> <li>Скидки на товары компании для сотрудников.</li> <li>Комфортный офис рядом с метро Шипиловская (2 минуты пешком). Работа на технике Apple.</li> </ul>",Полная занятость,Полный день,От 1 года до 3 лет,|ATL|BTL|Маркетинговые исследования|Маркетинговые коммуникации|Медиапланирование,3.0,,1.0,60000.0,маркетолог,"Знание инструментария основных каналов продвижения в интернете. Знание основ SEO, SMM, построения Таргентинговых объявлений. Опыт работы со сквозной аналитикой, с...","Умение определять целевую аудиторию по каждому продукту. Формирование нового трафика на продукты. Создание, планирование и запуск рекламных кампаний. ",25
Москва,Акселератор,2019-11-28T15:12:52+0300,"<p>Кто мы?</p> <p>Акселератор онлайн-школ – самый крупный онлайн проект в России по созданию онлайн школ.</p> <p>Основатели компании Дмитрий Юрченко и Сергей Капустин - достаточно известные личности, на это указывает совместный проект с Ксенией Собчак, Ириной Хакамадой и другими публичными людьми.</p> <p>Акселератор онлайн-школ был признан лучшим проектом в номинации «Лучший образовательный проект» ежегодной премии Business Awards</p> <p>Кого мы ищем?</p> <p>Мы расширяемся и открываем набор в Департамент Маркетинга на позицию <strong>Интернет-маркетолог</strong></p> <p>Ищем профессионала своего дела, который готов покорять новые горизонты Маркетинга. Даем все инструменты для реализации крутых проектов.</p> <p>Какие задачи предстоит выполнять:</p> <ul> <li> <p>Разрабатывать и вести интернет-проекты от постановки цели по прибыли до результата</p> </li> <li> <p>Вести аналитику результатов продаж - выводы, конверсии, просчитывать воронку, оптимизировать воронку</p> </li> <li> <p>Составлять план мероприятий по привлечению внешнего трафика</p> </li> <li> <p>Внедрять новые маркетинговые фишки</p> </li> <li> <p>Участвовать и составлять план реализации мероприятий по увеличению продаж</p> </li> <li> <p>Проводить процессы через тесты, онлайн</p> </li> <li> <p>Увеличивать конверсии, приводить новых лидов</p> </li> <li> <p>Создание офферов и УТП</p> </li> </ul> <p>Что мы ждем от тебя:</p> <ul> <li> <p>Опыт работы в инфобизнесе или образовательном онлайн-проекте будут плюсом</p> </li> <li> <p>Опыт управление проектами</p> </li> <li> <p>Создание автоворонок, лендингов</p> </li> <li> <p>Опыт проработки продающих воронок по продаже обучающих продуктов</p> </li> <li> <p>Умение профессионально создавать продающий копирайтинг (заголовки, текст лендингов, текст рекламных объявлений)</p> </li> <li> <p>Умение упаковывать новый продукт</p> </li> </ul> <p>Требования:</p> <ul> <li> <p>Аналитический склад ума</p> </li> <li> <p>Внимание к деталям</p> </li> <li> <p>Аккуратность и последовательность в действиях</p> </li> <li> <p>Умение доводить начатое до конца</p> </li> <li> <p>Знание основ юзабилити сайтов</p> </li> <li> <p>Умение качественно передавать мысли с помощью текста</p> </li> </ul> <p>Что мы предлагаем:</p> <ul> <li> <p>полностью удалённая работа</p> </li> <li> <p>Зп: от 35 т.р. до 50 т.р. Мы платим за результат, а не за количество работы.</p> </li> <li> <p>Ежегодный оплачиваемый отпуск</p> </li> </ul> <p>Если Ты:</p> <p>- Активный, позитивный</p> <p>- Погружаешься в процесс полностью и не успокоишься, пока задача не будет закрыта.</p> <p>- А также, не пасуешь перед трудностями и хочешь, чтобы компания, благодаря твоей помощи, вышла на новый самый верхний уровень</p> <p>- Твои главные убеждения - &quot;Нет Ничего Невозможного!&quot; и оптимистичная жизненная позиция</p> <p>- Хочешь стать частью известной и надежной компании и твоя цель - качественно выполненная работа, то тебе точно к нам!</p> <p> </p> <p>Если ты уверен в своих силах и все, что написано выше про тебя - скорее отправляй нам свое резюме! У нас есть тестовое задание, будь готов к выполнению.</p>",Полная занятость,Удаленная работа,От 1 года до 3 лет,|Копирайтинг|Лидогенерация|Internet Marketing|Планирование маркетинговых кампаний|Маркетинговые коммуникации,3.0,50000.0,1.0,35000.0,маркетолог,"Опыт работы в инфобизнесе или образовательном онлайн-проекте будут плюсом. Опыт управление проектами. Создание автоворонок, лендингов. Опыт проработки продающих воронок...","Разрабатывать и вести интернет-проекты от постановки цели по прибыли до результата. Вести аналитику результатов продаж - выводы, конверсии, просчитывать воронку...",15
