city,company-name,date,description,employment-form,employment-schedule,experience,key_skills,max-experience,max-salary,min-experience,min-salary,name,requirements,responsibilities,days_from_publish
Екатеринбург,ЭР-Телеком,2019-12-13T07:13:01+0300,"<strong>Обязанности:</strong> <ul> <li>осуществление монтажных работ по подключению клиента (интернет, ЦТВ и КТВ, городская связь)</li> <li>работы с электроинструментом и специализированным инструментом для подключения</li> <li>ведение отчётности.</li> </ul> <strong>Требования:</strong> <ul> <li>желателен навык подключения услуг доступа в интернет и телевидения;</li> <li>приветствуется опыт работы с СКС, СКУД, ОПС;</li> <li>возможно без опыта работы - мы всему научим!</li> </ul> <strong>Условия:</strong>​​​​​​​ <ul> <li>официальное трудоустройство в соответствии с ТК РФ</li> <li>&quot;белая&quot; своевременная оплата труда (сдельно-премиальная)</li> <li>перспективы профессионального роста</li> <li>бесплатное корпоративное обучение</li> <li>разъездной характер работы</li> <li>Ждем Вас в нашу команду профессионалов!</li> </ul>",Полная занятость,Сменный график,Нет опыта,Без ключевых навыков,,71666.66666666667,,40000.0,монтажник услуг связи,"Желателен навык подключения услуг доступа в интернет и телевидения. Приветствуется опыт работы с СКС, СКУД, ОПС. Возможно без опыта работы...","Осуществление монтажных работ по подключению клиента (интернет, ЦТВ и КТВ, городская связь). Работы с электроинструментом и специализированным инструментом для подключения. ",0
Екатеринбург,"МОТИВ, телекоммуникационная группа",2019-12-04T10:35:37+0300,"<p><strong>Обязанности:</strong></p> <p>• Подготовка, монтаж оборудования базовых станций (БС);</p> <p>• Регламентное техническое обслуживание (ТО) позиций;</p> <p>• Ведение технической документации по эксплуатации и ТО позиций;</p> <p>• Устранение аварийных ситуаций на БС (круглосуточно);</p> <p>• Учет движения ТМЦ.</p> <p> </p> <p><strong>Требования:</strong></p> <p>• Образование оконченное высшее техническое/специалист в области радиосвязи;</p> <p>• Уверенный пользователь ПК;</p> <p>• Знание принципов построения и организации сетей связи;</p> <p>• Навыки в монтаже базовых станций стандарта GSM и LTE приветствуются;</p> <p>• Умение работать слесарным и электроинструментом;</p> <p>• Знание технического английского языка (минимум со словарем);</p> <p>• Опыт работы в области строительства или обслуживания базовых станций (приветствуется).</p> <p> </p> <p><strong>Условия:</strong></p> <p>• Официальное трудоустройство по ТК РФ;</p> <p>• Стабильная заработная плата;</p> <p>• Корпоративные скидки и скидки от партнеров Компании;</p> <p>• Привлекательные акции для сотрудников Компании;</p> <p>• Компенсация сотовой связи для Вас и Ваших близких;</p> <p>• График работы - 5/2;</p> <p>• Разъездной характер работы;</p> <p>• Место работы: ул. Ветеринарная.</p>",Полная занятость,Полный день,От 1 года до 3 лет,Без ключевых навыков,3.0,71666.66666666667,1.0,43666.666666666664,монтажник оборудования связи,Образование оконченное высшее техническое/специалист в области радиосвязи. Уверенный пользователь ПК. Знание принципов построения и организации сетей связи. ,"Подготовка, монтаж оборудования базовых станций (БС). Регламентное техническое обслуживание (ТО) позиций. Ведение технической документации по эксплуатации и ТО позиций. ",9
Екатеринбург,"МОТИВ, телекоммуникационная группа",2019-12-09T14:30:15+0300,"<p><strong>Обязанности:</strong></p> <p>• Подготовка, монтаж оборудования базовых станций (БС);</p> <p>• Регламентное техническое обслуживание (ТО) позиций;</p> <p>• Ведение технической документации по эксплуатации и ТО позиций;</p> <p>• Устранение аварийных ситуаций на БС (круглосуточно);</p> <p>• Учет движения ТМЦ.</p> <p> </p> <p><strong>Требования:</strong></p> <p>• Образование оконченное высшее техническое/специалист в области радиосвязи;</p> <p>• Уверенный пользователь ПК;</p> <p>• Знание принципов построения и организации сетей связи;</p> <p>• Навыки в монтаже базовых станций стандарта GSM и LTE приветствуются;</p> <p>• Умение работать слесарным и электроинструментом;</p> <p>• Знание технического английского языка (минимум со словарем);</p> <p>• Опыт работы в области строительства или обслуживания базовых станций (приветствуется).</p> <p> </p> <p><strong>Условия:</strong></p> <p>• Официальное трудоустройство по ТК РФ;</p> <p>• Стабильная заработная плата;</p> <p>• Корпоративные скидки и скидки от партнеров Компании;</p> <p>• Привлекательные акции для сотрудников Компании;</p> <p>• Компенсация сотовой связи для Вас и Ваших близких;</p> <p>• График работы - 5/2;</p> <p>• Разъездной характер работы;</p> <p>• Место работы: ул. Ветеринарная.</p>",Полная занятость,Полный день,От 1 года до 3 лет,Без ключевых навыков,3.0,71666.66666666667,1.0,43666.666666666664,монтажник связи,Образование оконченное высшее техническое/специалист в области радиосвязи. Уверенный пользователь ПК. Знание принципов построения и организации сетей связи. ,"Подготовка, монтаж оборудования базовых станций (БС). Регламентное техническое обслуживание (ТО) позиций. Ведение технической документации по эксплуатации и ТО позиций. ",4
Екатеринбург,"Принтград, ГК",2019-12-13T11:14:46+0300,"<p><strong>Обязанности:</strong></p> <ul> <li> <p>Протяжка СКС на торговом объекте</p> </li> <li> <p>ПНР (Пуско-наладочные работы) торгового оборудования (кассы, ТСД, мобильные принтеры и т.д.)</p> </li> <li> <p>ППР (Планово-Предупредительные Работы (проверка на работоспособность и устранение неполадок оборудования. ПК, принтера, провода и т.д.)</p> </li> </ul> <p><strong>Требования:</strong></p> <ul> <li> <p>Опыт монтажа ЛВС</p> </li> <li> <p>Опыт настройки торгового оборудования и видеонаблюдения будет преимуществом;</p> </li> <li> <p>Желание обучаться и развиваться</p> </li> <li> <p>Умение работать в команде</p> </li> <li> <p>Мобильность</p> </li> <li> <p>Пунктуальность</p> </li> <li> <p>Желание расти и развиваться</p> </li> </ul> <p><strong>Условия:</strong></p> <ul> <li> <p>Работа в крупной развивающейся Компании</p> </li> <li> <p>Трудоустройство по ТК РФ</p> </li> <li> <p>Белая заработная плата (оклад + премия)</p> </li> <li> <p>Оклад 20 000 + сделка от 15 000 (неограниченна, все в Ваших руках)</p> </li> <li> <p>Обучение в процессе работы</p> </li> <li> <p>Характер работы, разъездной</p> </li> <li> <p>Корпоративная сотовая связь</p> </li> <li> <p>График работы 5/2 с 9.00 до 18.00</p> </li> <li> <p>Карьерный и профессиональный рост</p> </li> </ul> <p> </p> <p> </p>",Полная занятость,Полный день,От 1 года до 3 лет,|Монтаж локально-вычислительной сети|Настройка ПО|Настройка сетевых подключений|Техническое обслуживание|Локальные сети|Работа с локальными сетями|Настройка серверов|слаботочные системы,3.0,71666.66666666667,1.0,35000.0,монтажник скс,Опыт монтажа ЛВС. Опыт настройки торгового оборудования и видеонаблюдения будет преимуществом. Желание обучаться и развиваться. Умение работать в команде. Мобильность. ,"Протяжка СКС на торговом объекте. ПНР (Пуско-наладочные работы) торгового оборудования (кассы, ТСД, мобильные принтеры и т.д.). ",0
Екатеринбург,Вертикаль,2019-12-06T08:12:10+0300,"<p>Компании &quot;Вертикаль&quot; требуется <strong>Монтажники ВОЛС</strong></p> <p>Регионы производства работ: Екатеринбург и Свердловская область.</p> <p><strong>ПРОСИМ ОБРАТИТЬ ВНИМАНИЕ, ДАННАЯ РАБОТА ИМЕЕТ РАЗЪЕЗДНОЙ ХАРАКТЕР И СВЯЗАНА С ЧАСТЫМИ КОМАНДИРОВКАМИ</strong></p> <p><strong>Обращаем Ваше внимание, собеседование проводиться в г. Екатеринбурге</strong></p> <p>Требования:</p> <ul> <li>навыки монтажа и наладки оборудования связи</li> <li>опыт прокладки ВОЛС</li> <li>умение работать инструментом</li> </ul> <p>Обязанности:</p> <ul> <li>Монтаж оборудования связи:</li> <li>линии ВОЛС (воздушные и в грунте)</li> <li>Работа с технической документации</li> </ul> <p>Условия работы:</p> <ul> <li><strong>разъездной характер работы,</strong></li> <li><strong>командировки,</strong></li> <li>высотные работы</li> <li>трудоустройство согласно ТК РФ</li> <li>достойная заработная плата (рассмотрим ожидания кандидатов)</li> <li>премии по завершению проекта</li> <li>полный соцпакет.</li> </ul> <p> </p>",Полная занятость,Полный день,От 1 года до 3 лет,Без ключевых навыков,3.0,71666.66666666667,1.0,43666.666666666664,монтажник волс,Навыки монтажа и наладки оборудования связи. Опыт прокладки ВОЛС. Умение работать инструментом.,Монтаж оборудования связи: Линии ВОЛС (воздушные и в грунте). Работа с технической документации.,7
Екатеринбург,ЧАЗ Новый Консалтинговый Центр,2019-12-03T10:00:20+0300,<strong>Обязанности:</strong> <ul> <li>строительства комплекса АКМ</li> </ul> <strong>Требования:</strong> <ul> <li>опыт работы от 1-го года</li> </ul> <strong>Условия:</strong> <ul> <li>работа в Пермском крае</li> <li>вахта 60/30 или 45/15 на выбор</li> <li>жилье и спец.одежду предоставляем бесплатно</li> <li>медосмотр за счет организации</li> <li>выплата суточных 1500 руб- еженедельно ( в з/п не входят)</li> <li>выплата з/п стабильно</li> <li>трудоустройство по ТК РФ</li> </ul>,Полная занятость,Вахтовый метод,От 1 года до 3 лет,|Пользователь ПК|Управление временем,3.0,71666.66666666667,1.0,70000.0,монтажник жбк,Опыт работы от 1-го года.,Строительства комплекса АКМ.,10
Екатеринбург,Вертикаль,2019-12-06T08:12:10+0300,"<p>Компании &quot;Вертикаль&quot; требуется Монтажники объектов связи , АФУ, линий ВОЛС и т.д.,</p> <p>Регионы производства работ: УРФО В Т.Ч. ЕКБ, Челябинск, Сургут, Ноябрьск, Новый Уренгой, Тюмень, Курган, ХМАО, ЯНАО.</p> <p><strong>ПРОСИМ ОБРАТИТЬ ВНИМАНИЕ, ДАННАЯ РАБОТА ИМЕЕТ РАЗЪЕЗДНОЙ ХАРАКТЕР И СВЯЗАНА С ЧАСТЫМИ И ДЛИТЕЛЬНЫМИ КОМАНДИРОВКАМИ</strong></p> <p><strong>Обращаем Ваше внимание, собеседование проводиться в г. Екатеринбурге</strong></p> <p>Требования:</p> <ul> <li>знания в области телекоммуникаций,</li> <li>навыки монтажа и наладки оборудования связи</li> <li>возможно без опыта, обучение в процессе производства работ</li> <li>умение работать инструментом</li> </ul> <p>Обязанности:</p> <ul> <li>Монтаж оборудования связи:</li> <li>оборудование транспортной сети (радиорелейное оборудование, pmp),</li> <li>оборудование базовых станций сотовой связи (АФУ, базовые стойки),</li> <li>сетевое оборудование (коммутационное оборудование, сети передачи данных),</li> <li>линии ВОЛС (воздушные и в грунте)</li> <li>электрооборудование (стойки питания, распределительные щиты).</li> <li>Пуско-наладка и эксплуатационная поддержка телекоммуникационного оборудования</li> <li>Работа с технической документации</li> </ul> <p> </p> <p>Условия работы:</p> <ul> <li><strong>разъездной характер работы,</strong></li> <li><strong>командировки,</strong></li> <li>высотные работы</li> <li>трудоустройство согласно ТК РФ</li> <li>достойная заработная плата (рассмотрим ожидания кандидатов)</li> <li>премии по завершению проекта</li> <li>полный соцпакет.</li> </ul> <p> </p>",Полная занятость,Полный день,Нет опыта,Без ключевых навыков,,71666.66666666667,,43666.666666666664,монтажник объектов связи,"Знания в области телекоммуникаций. Навыки монтажа и наладки оборудования связи. Возможно без опыта, обучение в процессе производства работ. ","Монтаж оборудования связи: Оборудование транспортной сети (радиорелейное оборудование, pmp). Оборудование базовых станций сотовой связи (АФУ, базовые стойки). Сетевое оборудование (коммутационное...",7
Екатеринбург,TelecomBOX,2019-12-10T12:00:01+0300,"<p><strong>Основные задачи:</strong></p> <p>Выполнение работ по монтажу слаботочных систем (монтаж кабеля от шкафа оператора до квартиры клиента, настройка оборудования) и вспомогательных электрических систем</p> <p>Предоставление качественного клиентского сервиса</p> <p> </p> <p><strong>Нам важно:</strong></p> <p>Знание слаботочных систем</p> <p>Развитые навыки ручного труда и практический опыт работы в обслуживании, монтаже и пуско-наладке слаботочных и электрических систем</p> <p>Активность‚ желание работать и зарабатывать</p> <p> </p> <p><strong>Мы предлагаем: </strong></p> <p>Мотивация: оплата сдельная, возможность заработка без ограничения верхнего уровня, выплачивается без задержек 2 раза в месяц.</p> <p>Возможность профессионального развития в современной компании в области IT и Телеком</p> <p>Полная занятость, разъездной характер работы, возможность работы рядом с домом</p> <p>Выдаем фирменную спецодежду и предоставляем инструмент</p> <p>Дружный коллектив</p> <p> </p>",Полная занятость,Полный день,От 1 года до 3 лет,|Системы видеонаблюдения|Монтаж инженерных систем|Монтаж оборудования|Электрические системы и слаботочные системы|Настройка сетевых подключений,3.0,80000.0,1.0,40000.0,монтажник оборудования связи,"Знание слаботочных систем. Развитые навыки ручного труда и практический опыт работы в обслуживании, монтаже и пуско-наладке слаботочных и электрических...","Выполнение работ по монтажу слаботочных систем (монтаж кабеля от шкафа оператора до квартиры клиента, настройка оборудования) и вспомогательных электрических систем. ",3
Екатеринбург,TelecomBOX,2019-12-10T12:00:01+0300,"<p><strong>Чем заниматься:</strong></p> <ul> <li>Установка и настройка активного оборудования</li> <li>Монтаж СКС (прокладка кабелей типа «витая пара», монтажных лотков по зданиям и сооружениям)</li> <li>Монтаж распределительных боксов и «разделка» кабелей связи</li> <li>Участие в работах по монтажу узлов связи</li> <li>Монтаж слаботочных розеток, коробов, телекоммуникационных шкафов</li> <li>Монтаж систем видеонаблюдения</li> <li>Работа с технической/проектной документацией</li> </ul> <p><strong>От вас:</strong></p> <ul> <li>Образование средне-специальное (техническое)</li> <li>Умение работать с монтажным и измерительным инструментом</li> <li>Ответственность, трудолюбие, обучаемость</li> <li>Опыт работы от 1 года обязателен</li> </ul> <p><strong>От нас:</strong></p> <ul> <li>Работа с федеральными провайдерами и крупными сетевыми интеграторами</li> <li>Официальная заработная плата (оклад + сдельная оплата труда) на руки 40000 - 80000 руб/мес;</li> <li>Обеспечение необходимым для работы инструментом и спецодеждой;</li> <li>Возможность профессионального и карьерного роста, корпоративное обучение</li> <li>Ротация внутри компании</li> <li>Обучение за счет компании</li> <li>Профессиональный коллектив</li> <li>Яркие корпоративные мероприятия</li> </ul>",Полная занятость,Полный день,От 1 года до 3 лет,|Пользователь ПК|Прокладка кабелей|Монтаж инженерных систем|Windows 7,3.0,80000.0,1.0,40000.0,монтажник связи лвс скс видеонаблюдения скуд,"Образование средне-специальное (техническое). Умение работать с монтажным и измерительным инструментом. Ответственность, трудолюбие, обучаемость. Опыт работы от 1 года обязателен.","Установка и настройка активного оборудования. Монтаж СКС (прокладка кабелей типа «витая пара», монтажных лотков по зданиям и сооружениям). ",3
