city,company-name,date,description,employment-form,employment-schedule,experience,key_skills,max-experience,max-salary,min-experience,min-salary,name,requirements,responsibilities,days_from_publish
Санкт-Петербург,Балашова Анастасия Сергеевна,2019-12-03T14:57:36+0300,"<p><strong>Обязанности:</strong></p> <p>Обязанности:<br />- Прокладка оптического кабеля от оборудования (Расположение на лестничной площадке, ни каких подвалов и чердаков) в квартиру абонента.<br />- Установка и настройка абонентского оборудования<br />- Демонстрация услуг.<br />- Подписание договора об оказании услуг с абонентом.</p> <strong>Требования:</strong> <p>- Знание операционных систем( Windows, MacOS и т.д.)</p> <p>- Базовые знания ЛВС (Локальная вычислительная сеть)</p> <p>- Опыт работы монтажником приветствуется.</p> <p>- Специальные знания / навыки: умение работать с электроинструментом, навыки общения с клиентами.</p> <p>- Пунктуальность, аккуратность, вежливость, исполнительность.</p> <p><strong>Условия:</strong></p> <p>- Стоимость 1-й заявки от 900 рублей ( 1 услуга).<br />- Возможность дополнительного заработка.<br />- Обучение.<br />- Работа разъездного характера<br />- Инструмент предоставляет компания.<br />- Работа в районе проживания .<br />- Приезжать в офис каждый день не нужно.</p> <p>- Выдаётся инструмент и расходный материал, возможно увеличение выплат при использовании в работе своего инструмента и расходных материалов</p> <p>- Индивидуальный график.</p> <p> </p> <p> </p>",Полная занятость,Гибкий график,Нет опыта,|Ответственность|Производство строительно-монтажных работ|Монтаж инженерных систем|Производство пусконаладочных работ,,62142.857142857145,,85000.0,монтажник связи,"Знание операционных систем( Windows, MacOS и т.д.). - Базовые знания ЛВС (Локальная вычислительная сеть). - Опыт работы монтажником приветствуется. - ","Прокладка оптического кабеля от оборудования (Расположение на лестничной площадке, ни каких подвалов и чердаков) в квартиру абонента. - Установка и настройка...",10
Санкт-Петербург,ГиперТехнолоджи,2019-11-15T09:13:57+0300,"<p> </p> <p><strong><em>В нашу команду профессионалов ищем активного, целеустремленного сотрудника с золотыми руками, готового учиться и развивать свои знания и навыки. Молодой и дружный коллектив,понятные и прозрачные критерии оценки квалификации и соответственно заработной платы. Стабильный доход и интересные задачи! Только длительное сотрудничество.</em></strong></p> <p><strong>Обязанности:</strong></p> <ul> <li>Монтаж кабельных трасс, всех типов лотков, кабельных коробов;</li> <li>Прокладка кабельных трасс по лоткам короба, трубам;</li> <li>Монтаж щитов автоматики;</li> <li>Монтаж и подключение полевого оборудования (датчики, видеокамеры, извещатели, динамики, телевизоры и т. д.);</li> <li>Монтаж и расключение коммутационных коробок;</li> <li>Монтаж шлагбаумов, турникетов;</li> <li>Участие в ПНР.</li> </ul> <strong>Требования:</strong> <ul> <li> <p>Средне специальное образование;</p> </li> <li> <p>Опыт работы по монтажу, наладке, по слаботочным системам: АПС, СОуЭ, Речевое оповещение, СКС, ОС и КД, Дымоудаление, Видеонаблюдение, АСТУЭ, автоматика ОВК;</p> </li> <li> <p>Элементарные знания принципов работы вышеперечисленных систем;</p> </li> <li> <p>Умение читать схемы;</p> </li> <li> <p>Соблюдение жестких требований охраны труда;</p> </li> <li> <p>Опыт работы и управления электрогидроподъёмником, наличие удостоверения на право работы и управления такой техникой приветствуется;</p> </li> <li> <p>Навыки работы с электроинструментом, мультиметром;</p> </li> <li> <p>Опыт сварки оптоволокна будет преимуществом;</p> </li> <li> <p>Навыки пусконаладочных работ будут преимуществом;</p> </li> <li> <p>Наличие действующего удостоверения по ЭБ крайне приветствуется;</p> </li> </ul> <strong>Условия:</strong> <ul> <li>Постоянная, полный день, работа на территории работодателя;</li> <li>Оформление, отпуск, больничный и пр. по ТК;</li> <li>Корпоративное обучение и тренинги;</li> <li>Возможность профессионального и карьерного роста;</li> <li>Своевременные выплаты заработной платы;</li> <li>Двойная оплата в праздничные и выходные дни;</li> <li>удобная современная спецодежда;</li> <li><strong>Заработная плата от 255 руб/час;</strong></li> <li><strong>Работа на крупных действующих предприятиях Санкт-Петербурга и Лен. области;</strong></li> <li><strong>Не частые и не продолжительные командировки по европейской части РФ.</strong></li> </ul>",Полная занятость,Полный день,От 1 года до 3 лет,|слаботочные системы|Пуско-наладочные работы,3.0,60000.0,1.0,45000.0,монтажник слаботочных систем,"Средне специальное образование. Опыт работы по монтажу, наладке, по слаботочным системам: АПС, СОуЭ, Речевое оповещение, СКС, ОС и КД, Дымоудаление...","Монтаж кабельных трасс, всех типов лотков, кабельных коробов. Прокладка кабельных трасс по лоткам короба, трубам. Монтаж щитов автоматики. ",28
Санкт-Петербург,Жоржолиани Георгий Давидович,2019-11-21T13:44:42+0300,"<p>Описание работодателя: работа в одном районе . Монтаж домофонов, строительство слаботочных систем, видео наблюдения и др.</p> <p>Требования: умение работать с перфоратором и другими инструментами.</p> <p>Обязанности: протяжка кабеля, установка домофона , монтаж точки доступа, камер видеонаблюдения и другие работы в этой сфере.</p> <p>Условия: удобный график работы, зп. высокая сдельная.</p> <p>Более подробная информация по телефону</p> <p>Пока объявление висит оно актуально!</p>",Полная занятость,Полный день,От 1 года до 3 лет,|Электрические системы и слаботочные системы|Пожарная сигнализация|Системы видеонаблюдения|Монтаж инженерных систем|слаботочные системы|Работа в команде,3.0,80000.0,1.0,50000.0,монтажник слаботочных систем,Без требований,"Описание работодателя: работа в одном районе . Монтаж домофонов, строительство слаботочных систем, видео наблюдения и др. Требования: умение работать с перфоратором...",22
Санкт-Петербург,AirNet,2019-11-28T18:44:18+0300,"<p><em><strong>Обязанности:</strong></em></p> <p>• Сварка, монтаж, прокладка и измерение волоконно-оптических кабелей (кровля, столбы);</p> <p>• Установка антивандальных ящиков, кабель-каналов, трубостоек, слаботочных каналов;</p> <p>• Подключение электрики.</p> <p> </p> <p><em><strong>Требования:</strong></em></p> <p>• Образование: среднее, среднее специальное;</p> <p>• Навыки работы со строительным инструментом, знания по ВОЛС;</p> <p>• Умение аккуратно и в больших объемах разваривать кроссы и муфты;</p> <p>• Способность быстро и самостоятельно обучаться;</p> <p>• Внимательность и аккуратность в работе, ответственность;</p> <p> </p> <p><em><strong>Условия:</strong></em></p> <p>• Предоставление льгот на услуги компании;</p> <p>• Красивая форма;</p> <p>• Чай, кофе за счет компании;</p> <p>• Абонемент в спортивный зал;</p> <p>• Финансовое поощрение некурящих;</p> <p>• Возможности карьерного роста;</p> <p>• Дружный молодой коллектив;</p> <p>• Испытательный срок 2 мес;</p> <p>• Работа в Калининском и Выборгском, Приморском районах СПБ.</p>",Полная занятость,Полный день,От 1 года до 3 лет,Без ключевых навыков,3.0,65000.0,1.0,50000.0,монтажник волс,"Образование: среднее, среднее специальное. Навыки работы со строительным инструментом, знания по ВОЛС. Умение аккуратно и в больших объемах разваривать кроссы...","Сварка, монтаж, прокладка и измерение волоконно-оптических кабелей (кровля, столбы). Установка антивандальных ящиков, кабель-каналов, трубостоек, слаботочных каналов. Подключение электрики.",15
Санкт-Петербург,Охранная фирма Титан,2019-11-29T15:31:33+0300,"<p><strong>Обязанности:</strong></p> <p>Монтаж и пусконаладочные работы ОТС, АПС, СКУД, СОТ (работы &quot;под ключ&quot;).</p> <p>Чтение технической и исполнительной документаций.</p> <p>Своевременное предоставление отчетности по выполненным работам.</p> <p><strong>Требования:</strong></p> <p>- Преимуществом будет знание Bolid, Си-Норд, Ритм, Trassir, Gate.</p> <p>- Знание основного используемого оборудование на рынке охранных услуг, НПБ, СП по пожарной сигнализации.</p> <p>- Системность. Желание работать и развиваться вместе с компанией.</p> <strong>Условия:</strong> <p>Работа в крупной компании, занимающей одно из лидирующих мест на рынке Северо-Запада в сфере охранных услуг и высокотехнологичных предложений в сфере безопасности.</p> <p>Официальное оформление по ТК РФ.</p> <p>График работы: 5-дн. рабочая неделя.</p> <p>Своевременные выплаты заработной платы (2 раза в месяц).</p>",Полная занятость,Полный день,От 3 до 6 лет,Без ключевых навыков,6.0,62142.857142857145,3.0,50000.0,монтажник слаботочных систем,"Преимуществом будет знание Bolid, Си-Норд, Ритм, Trassir, Gate. - Знание основного используемого оборудование на рынке охранных услуг, НПБ, СП по...","Монтаж и пусконаладочные работы ОТС, АПС, СКУД, СОТ (работы &quot;под ключ&quot;). Чтение технической и исполнительной документаций. Своевременное предоставление отчетности по...",14
Санкт-Петербург,Ловител,2019-12-02T15:19:25+0300,"<p>Требуется бригада монтажников с бригадиром. ( <strong>ИП</strong>)<br />Наличие собственного инструмента.<br />Оплата по договору на основании единичных расценок.</p> <p>Строительство сетей связи и КТВ на объекте (строящийся жилой комплекс):<br />- штробление стен;<br />- прокладка кабелей связи (utp, коаксиальный)<br />- прокладка кабелей электропитания;<br />- расшивка многопарных кабелей связи;<br />- установка телекоммуникационных шкафов и оборудования;<br />- организация электропитания для оборудования;<br />- прокладка волоконно-оптических кабелей, сварка волокон и снятие рефлектограмм;<br />- ПНР системы КТВ;<br />- подготовка исполнительной документации.</p> <p> </p>",Полная занятость,Полный день,Нет опыта,|Пользователь ПК|Настройка сетевых подключений|Производство строительно-монтажных работ|Прокладка кабелей,,62142.857142857145,,50588.23529411765,бригада монтажников с бригадиром по строительству слаботочных систем,Наличие собственного инструмента.,Оплата по договору на основании единичных расценок. Строительство сетей связи и КТВ на объекте (строящийся жилой комплекс): - штробление стен. - ,11
Санкт-Петербург,Ю Онлайн,2019-11-14T15:26:52+0300,"<strong>Обязанности:</strong> <ul> <li>Подключение новых абонентов к услугам компании (Интернет, Цифровое тв);</li> <li>Монтаж кабелей связи (медных и волоконно-оптических, монтаж оборудования);</li> <li>Обслуживание клиентов по сервисным заявкам – Сервисное обслуживание;</li> <li>Устранение аварий на сети;</li> </ul> <p><strong>Требования (ЖЕЛАТЕЛЬНО):</strong></p> <ul> <li>Среднее (полное) общее образование;</li> <li>Знание операционных систем (Windows, MacOS и т.д.);</li> <li>Умение работать с электроинструментом;</li> <li>Навыки общения с клиентами;</li> <li>Опыт работы со слаботочными сетями;</li> </ul> <p><strong>Условия:</strong></p> <ul> <li>Работа в провайдере цифровых услуг и решений;</li> <li>График работы 5/2, с 10.00 до 19.00;</li> <li>Характер работы - разъездной;</li> <li>Автoмобиль;</li> <li>Спецодежда, инструмент;</li> <li>Обучение;</li> </ul>",Полная занятость,Полный день,Нет опыта,Без ключевых навыков,,65000.0,,45000.0,монтажник слаботочных систем,"Среднее (полное) общее образование. Знание операционных систем (Windows, MacOS и т.д.). Умение работать с электроинструментом. Навыки общения с клиентами. ","Подключение новых абонентов к услугам компании (Интернет, Цифровое тв). Монтаж кабелей связи (медных и волоконно-оптических, монтаж оборудования). ",29
Санкт-Петербург,Нью Лайн Телеком,2019-11-22T14:29:21+0300,"<strong>Обязанности:</strong> <ul> <li>Прокладка волоконно-оптического кабеля (подвес, внутрянка);</li> <li>Прокладка медножильных проводов и кабелей (ТПП, UTP, ПВ3);</li> <li>Монтаж систем видеонаблюдения.</li> </ul> <strong>Требования:</strong> <ul> <li>Знание принципов построения сетей передачи данных (PON, ШПД, СКС, ЛВС);</li> <li>Понимание технологий строительства объектов связи;</li> <li>Ответственность за достижение результата;</li> <li>Дисциплинированность;</li> <li>Готовность к разъездному характеру работы (СПб и Ленинградская область).</li> </ul> <strong>Условия:</strong> <ul> <li>Работа на объектах (г.СПб и Ленинградской области);</li> <li>Стабильная заработная плата;</li> <li>Возможность профессионального и карьерного роста;</li> <li>Оплачиваемый отпуск;</li> <li>Тип занятости: Полная занятость, полный день, 5/2.</li> </ul>",Полная занятость,Полный день,От 1 года до 3 лет,Без ключевых навыков,3.0,50000.0,1.0,50588.23529411765,монтажник слаботочных сетей,"Знание принципов построения сетей передачи данных (PON, ШПД, СКС, ЛВС). Понимание технологий строительства объектов связи. Ответственность за достижение результата. Дисциплинированность. ","Прокладка волоконно-оптического кабеля (подвес, внутрянка). Прокладка медножильных проводов и кабелей (ТПП, UTP, ПВ3). Монтаж систем видеонаблюдения.",21
Екатеринбург,НВБС,2019-12-10T15:55:08+0300,"<p><strong>АО «НВБС» – одна из крупнейших сервисных компаний России в области ИТ и Телеком – ищет кандидатов на должность монтажников. Мы помогаем войти в мир Интернета и качественного телевидения. Вакансия для тех, кто хочет и может хорошо работать и зарабатывать!</strong></p> <p><strong>Обязанности:</strong></p> <ul> <li>Предоставление качественного клиентского сервиса;</li> <li>Подключение абонентов к домашнему интернету (монтаж кабеля от шкафа оператора до квартиры клиента, настройка оборудования WiFi и приставок IPTV);</li> <li>Выполнение абонентских заявок (восстановление сервиса, настройка компьютера);</li> <li>Устранение аварий и выполнение плановых работ.</li> </ul> <p><strong>Требования:</strong></p> <ul> <li>Образование от среднего;</li> <li>Опыт работы – не имеет значения;</li> <li>Желательно знание принципов настройки клиентского оборудования (роутер, WiFi);</li> <li>Приветствуется опыт работы в монтаже слаботочных систем.</li> </ul> <p><strong>Условия:</strong></p> <ul> <li>Мотивация: сдельная, возможность дополнительного заработка;</li> <li>Официальное трудоустройство;</li> <li>Стабильная выплата заработной платы на карту (полностью белая) :</li> <li>График работы: 5/2, скользящие выходные дни;</li> <li>Полная занятость, разъездной характер работы, работа рядом с домом;</li> <li>Возможность профессионального развития в крупнейшей сервисной компании России в области IT и Телеком;</li> <li>Оплата мобильной связи;</li> <li>Фирменная спецодежда и предоставление инструмента;</li> <li>Дружный коллектив.</li> </ul>",Полная занятость,Полный день,Нет опыта,Без ключевых навыков,,71666.66666666667,,45000.0,монтажник,"Образование от среднего. Опыт работы – не имеет значения. Желательно знание принципов настройки клиентского оборудования (роутер, WiFi). Приветствуется опыт работы в...","Предоставление качественного клиентского сервиса. Подключение абонентов к домашнему интернету (монтаж кабеля от шкафа оператора до квартиры клиента, настройка оборудования WiFi...",3
