city,company-name,date,description,employment-form,employment-schedule,experience,key_skills,max-experience,max-salary,min-experience,min-salary,name,requirements,responsibilities,days_from_publish,min-salary-group,max-salary-group,city: Екатеринбург,city: Казань,city: Москва,city: Новосибирск,city: Санкт-Петербург,experience: Более 6 лет,experience: Нет опыта,experience: От 1 года до 3 лет,experience: От 3 до 6 лет,employment-form: Полная занятость,employment-form: Проектная работа,employment-form: Стажировка,employment-form: Частичная занятость,employment-schedule: Вахтовый метод,employment-schedule: Гибкий график,employment-schedule: Полный день,employment-schedule: Сменный график,employment-schedule: Удаленная работа,ios,objective-c,swift,git,ооп,английский язык,ios sdk,xcode,mac os,atlassian jira,other
Новосибирск,ФЦ Знание,2019-12-11T14:26:16+0300," Мы являемся инновационной компанией, которая продвигает экосистему интеллектуальных решений для глобального фармацевтического бизнеса.    Наша миссия    Улучшить качество жизни людей во всем мире. Мы делаем медицинские товары более доступными, помогая участникам фармацевтического рынка снизить затраты и повысить эффективность цепочки поставок, а также предоставляем легкий доступ на мировой рынок для инновационных фармацевтических компаний.   В связи с расширением IT-отдела нам требуется гениальный IOS-разработчик!   Итак, если ты станешь частью нашей звездной команды,    Чем тебе предстоит заняться:      Необходимо разрабатывать и поддерживать клиентскую часть приложения (в последствии приложений)      Требования:      Понимание принципов ООП и шаблонов проектирования;   знание Swift​, iOS SDK, понимание iOS Human Interface Guidelines, Design Patterns;   Опыт проектирования пользовательского интерфейса;​   Знание протокола HTTP, опыт работы с JSON;   Наличие своих или написанных в составе команды приложений в App Store.      Условия:      Официальное трудоустройство, полностью &quot;белая&quot; заработная плата (обсуждается);   На полный рабочий день в офис или удаленно;   Мы предоставим все условия, которые Вам нужны для реализации своего творческого потенциала!   Корпоративное изучение английского языка;   Возможность внести свой вклад в развитие компании и расти профессионально и мотивационно вместе с нами!   Молодой и дружный коллектив.     Ждем Ваших откликов!     ",Полная занятость,Удаленная работа,От 1 года до 3 лет,|iOS|Английский язык|ios приложения,3.0,142045.45454545456,1.0,98041.17647058824,ios разработчик,"Понимание принципов ООП и шаблонов проектирования. Знание Swift​, iOS SDK, понимание iOS Human Interface Guidelines, Design Patterns. Опыт проектирования пользовательского...",Необходимо разрабатывать и поддерживать клиентскую часть приложения (в последствии приложений).,0.06666666666666667,1,2,0,0,0,1,0,0,0,1,0,1,0,0,0,0,0,0,0,1,1,0,0,0,0,1,0,0,0,0,1
Новосибирск,SOFTOMATE,2019-12-03T13:57:16+0300," Хочешь работать с крупнейшими мировыми лидерами на рынке IT индустрии и внести свой вклад в области Cashback, которыми пользуются более 7000 компаний? Знаешь Swift, iOS SDK? Умеешь писать качественный код? Тогда у нас есть для тебя предложение!    Требования:      Мы ищем разработчика, который хочет развиваться и реализовываться в своем направлении, в команду с уютной атмосферой   Ты тот, кого мы искали, если знаешь Dependency Injection, умеешь писать Unit/UI тесты и понимаешь принципы работы клиент-серверных приложений   Приветствуется опыт работы с iOS Human Interface Guidelines, Cocoapods и (или) Carthage   Английский язык на разговорном уровне (не обязателен, но будет плюсом)   Знаешь Git и опыт разработки от 1 года? Тогда нам точно надо встретиться!      Мы предлагаем:      Эффективная система мотивации, ты сам решаешь как быстро хочешь расти и развиваться;   Место работы в 10 минутах от метро Площадь Ленина;   Зарплата в USD;   Киккер, тенис и другие игровые приставки помогут расслабиться и с новыми идеями вернуться к работе;   Любишь лыжи, сноуборд или просто хорошую компанию? Тогда тебе точно к нам! Каждый год мы всем коллективом отправляемся в Геш;   Обучаем английскому с носителями языка за счет компании;   Даем людям самореализоваться и сделать первый шаг в IT;   Хочешь побывать в Европе и Америке?      Тогда звони, пиши или приходи знакомится!    P.S. Уровень позиции будет определяться на интервью. ",Полная занятость,Гибкий график,От 1 года до 3 лет,|iOS|Git|Swift|ООП|JSON API|REST|Objective-C|iOS SDK|Unit Testing|UI|Английский язык,3.0,150000.0,1.0,100000.0,ios разработчик,"Приветствуется опыт работы с iOS Human Interface Guidelines, Cocoapods и (или) Carthage. Английский язык на разговорном уровне (не обязателен, но...",Без обязанностей,0.3333333333333333,1,2,0,0,0,1,0,0,0,1,0,1,0,0,0,0,1,0,0,0,1,1,1,1,1,1,1,0,0,0,1
Новосибирск,Kama Flow,2019-12-13T11:34:42+0300,"Компания-разработчик решений в сфере финансовых технологий и сервисов ищет специалистов. Обязанности: разработка и поддержка электронных кошельков, мобильных банков и других приложений, требующих соответствующий уровень надежности и безопасности.  Требования:  - Отличное знание и опыт разработки на Swift / Objective-C от 2-х лет - Понимание принципов ООП, SOLID, паттернов проектирования - Опыт проектирования архитектуры приложений - Опыт разработки клиент-серверных приложений (REST + WebSockets) - Знание протокола HTTP - Опыт работы с JSON - Опыт работы с push-нотификациями - Умение работать в команде, Git flow, code review и т.д. - Знание технического английского  Плюсами будут:  - Примеры разработанных вами приложений или наличие их кода в открытых репозиториях - Опыт разработки финансовых приложений - Понимание что такое криптография, что и как хранить и шифровать на клиенте, как безопасно взаимодействовать с сервером - Опыт создания unit- и acceptance- тестов - Понимание лучших практик в проектировании клиент-серверного API - Знание современных тенденций в UX и UI  Условия:  - Стабильная заработная плата, полный день, пятидневная рабочая неделя - Scrum, Agile и CI - Комфортный офис со всеми удобствами в центре г. Новосибирска - Работа в международной команде",Полная занятость,Полный день,От 1 года до 3 лет,|ООП|WebSockets|REST|Git|Objective-C|Swift|HTTP|JSON|SOLID|iOS,3.0,150000.0,1.0,80000.0,middle ios разработчик,"Отличное знание и опыт разработки на Swift / Objective-C от 2-х лет. - Понимание принципов ООП, SOLID, паттернов проектирования. - ",Без обязанностей,0.0,1,2,0,0,0,1,0,0,0,1,0,1,0,0,0,0,0,1,0,0,1,1,1,1,1,0,0,0,0,0,1
Новосибирск,Movavi,2019-11-30T15:03:26+0300," Новосибирская  IT-компания Movavi  создает и продает программы для любительской обработки мультимедиа.   Movavi Video Editor, Photo Editor, Video Converter, Screen Capture, мобильный видеоредактор Clips - одни из самых популярных продуктов в мире, ими пользуются в 200 странах. Наши программы помогают миллионам людей легко обрабатывать фото и видео, не требуя специальных знаний и навыков.    Мы счастливы представлять Новосибирск на мировой IT-карте! Приглашаем тебя присоединиться к нашей команде и вместе с нами создавать одно из самый популярных приложений!     Мы ищем разработчика на новый проект - мобильный PDF-редактор!     Чем предстоит заниматься:      разрабатывать мобильный PDF-редактор/сканер;   изучать и внедрять новые, современные технологии;   делиться знаниями с коллегами и повышать свой профессионализм;   проводить code review;   взаимодействовать с отделами тестирования и дизайна.      Для успешного выполнения задач тебе потребуется:      опыт разработки под iOS от 2-х лет;   опыт работы с Git;   Objective-C/Swift;   знание и опыт работы с iOS SDK, Xcode;   многопоточное программирование;   стремление постоянно улучшать свои знания и навыки.      Будет круто, если у тебя есть:      знание шаблонов и принципов проектирования;   умение работать с CocoaPods;   опыт применения Unit-тестирования, SOLID, CI;   опыт работы в командах, желательно Scrum/Agile/Lean.      Работа в Movavi - это:        команда профессионалов, готовых делиться знаниями и опытом;       индивидуальный подход к профессиональному росту и развитию внутри компании;       официальное трудоустройство с первого рабочего дня;       белая заработная плата + компенсация питания и спорта;       удобный график работы как для &quot;жаворонков&quot;, так и для &quot;сов&quot;;       занятия йогой и английским языком, не выходя из офиса;       здоровье с ДМС;       обучение детей в IT-школе Movavi;       приятная рабочая атмосфера, общение на &quot;ты&quot;;       бодрящие корпоративы: горы и ели, море и пальмы, и никакого алкоголя.        Хочешь 70K?  Это не розыгрыш. Мы готовы тебе их дать!    Порекомендуй нашу вакансию своему другу или знакомому, пришли его резюме на почту (см.контактную информацию) с пометкой &quot;Внешняя рекомендация на позицию Senior iOS Developer&quot; и получи бонус :     70 000р. за Senior-разработчика, после прохождения им испытательного срока.  * Друг должен знать, что его рекомендуют.   Если ты не получил ответ на отклик в течение 3-х рабочих дней: 1. Проверь папку &quot;Спам&quot; в электронной почте. Возможно, письмо с ответом оказалось там. 2. Позвони или напиши нам. ",Полная занятость,Удаленная работа,От 1 года до 3 лет,|iOS|Git|Objective-C|Разработка ПО|Swift,3.0,142045.45454545456,1.0,130000.0,senior ios разработчик,Опыт разработки под iOS от 2-х лет. Опыт работы с Git. Objective-C/Swift. Знание и опыт работы с...,"Разрабатывать мобильный PDF-редактор/сканер. Изучать и внедрять новые, современные технологии. Делиться знаниями с коллегами и повышать свой профессионализм. ",0.43333333333333335,2,2,0,0,0,1,0,0,0,1,0,1,0,0,0,0,0,0,0,1,1,1,1,1,0,0,0,0,0,0,1
Новосибирск,True Engineering,2019-12-10T09:47:29+0300,"  True Engineering  – лаборатория технологических инноваций. Стратегические партнеры по цифровой трансформации бизнеса S7 Airlines, Leroy Merlin, «ВСК», «Ингосстрах», «АльфаСтрахование», ГК «ЭФКО», Imperial Tobacco и других.   Проектируем и строим цифровые высокодоступные  Business Critical платформы . Автоматизируем Core бизнес, создаем клиентские сервисы и сервисы для партнерских сетей.    Наши герои - это люди.  Именно они творят настоящую история о настоящих профессионалах, настоящих инженерах, настоящих нас. Мы собрали отличную команду в 150 инженеров и продолжаем расти. Ценим профессионализм, простоту, душевность и юмор. С азартом беремся за работу, играем в долгую, принимаем решения и делаем осознанный выбор. Выбор быть настоящими.   Зовем приложить руку к разработке по-настоящему  полезных и красивых решений . Увидеть на практике Continuous Integration, Continuous Delivery, Continuous Deployment.    Что мы ждем от настоящего инженера:      отличное знание Objective-C/Swift, iOS SDK;   Опыт работы от 3 лет   опыт работы с git;   знание ООП, умение писать понятный и поддерживаемый код;   знание Human Interface Guidelines, чувство прекрасного;   опыт разработки клиент-серверных приложений;   стремление изучать новые технологии и подходы;   английский язык на уровне чтения технической документации.      Во   многих     наших     проектах     используются     технологи  и  ,     опыт     работы     с     которыми     будет     плюсом  :      carthage   fastlane   CoreData   MVVM + ReactiveCocoa/ReactiveSwift      Продукт:    Большое функциональное клиентское приложение для страхования. Уникальные клиентские сервисы, тысячи пользователей. Оформление, продление всех видов страхования через приложение, урегулирование убытков, видео-осмотры объектов страхования, распознавание документов.   Максимум услуг в онлайне. Настоящий сервис.    True Employer:    От нас  сильная   команда  дизайна и разработки, поддержка PM, профессиональное окружение, современный технологический стек. Умные, честные, открытые коллеги. Простор для инженерной мысли и уютная рабочая среда.    C&amp;B      Трудоустройство по ТК РФ   Белая заработная плата   Бесплатный спорт, бассейн   Гибкий рабочий график   Красивый офис   Легендарные корпоративы   Спортивные команды, турник в офисе   Корпоративная библиотека   Плюшки   Закрытая парковка      True Engineering - кто мы?    Проектируем возможности, работаем на результат,  делаем на перспективу . К нам приходят с бизнес-задачей, а мы переводим ее в плоскость информационных технологий и решаем. Инженерный подход позволяет закладывать в решение возможность его развития и глубокой модернизации.  Создавать новые  конкурентные преимущества для бизнеса.   Мы инженеры ИТ-отрасли. Смотрим в будущее, мысленно мы всегда на шаг впереди. Делаем сегодня то, что приведет нас в завтра. Осознанно и рачительно относимся к ресурсам. Ловим  технологические тренды , исследуем, применяем инструменты на практике. Умеем и любим учиться, создаем технологические компетенции внутри себя, растим отраслевую бизнес-экспертизу.    Создание ценности - наша главная цель.  Придумать работающее решение, создать его и добиться бизнес-результата. Знать, что в нем есть кусочек тебя лично, и ты можешь увидеть его в реальных цифрах, графиках, бизнес-показателях использования информационных систем.   Наши технологические компетенции – Engineering, Data Mining &amp; Machine Learning, DevOps, Design &amp; Digital.   Cтек технологий – Java, .Net, Angular, Vue, iOS, Android.   Наш офис находится в новосибирском Академгородке. Мы помогаем с переездом из других городов. Если ты хочешь  присоединиться к настоящим инженерам , напиши нам ",Полная занятость,Полный день,От 3 до 6 лет,|iOS|Objective-C|Swift,6.0,142045.45454545456,3.0,98041.17647058824,настоящий senior ios разработчик,"Отличное знание Objective-C/Swift, iOS SDK. Опыт работы от 3 лет. Опыт работы с git. Знание ООП, умение писать...","Продукт: Большое функциональное клиентское приложение для страхования. Уникальные клиентские сервисы, тысячи пользователей. Оформление, продление всех видов страхования через приложение, урегулирование...",0.1,1,2,0,0,0,1,0,0,0,0,1,1,0,0,0,0,0,1,0,0,1,1,1,0,0,0,0,0,0,0,1
