city,company-name,date,description,employment-form,employment-schedule,experience,key_skills,max-experience,max-salary,min-experience,min-salary,name,requirements,responsibilities,days_from_publish,min-salary-group,max-salary-group,city: Екатеринбург,city: Казань,city: Москва,city: Новосибирск,city: Санкт-Петербург,experience: Более 6 лет,experience: Нет опыта,experience: От 1 года до 3 лет,experience: От 3 до 6 лет,employment-form: Полная занятость,employment-form: Проектная работа,employment-form: Стажировка,employment-form: Частичная занятость,employment-schedule: Вахтовый метод,employment-schedule: Гибкий график,employment-schedule: Полный день,employment-schedule: Сменный график,employment-schedule: Удаленная работа,ios,objective-c,swift,git,ооп,английский язык,ios sdk,xcode,mac os,atlassian jira,other
Санкт-Петербург,Почта России,2019-12-12T17:07:12+0300," Мы разрабатываем официальное мобильное приложение Почты России – приложение, которое помогает миллионам клиентов Почты России отслеживать посылки, получать уведомления о передвижении, заказывать доставку, вызывать курьера, сдавать без очереди и получать письма и посылки.   В своей работе мы используем гибкие методологии, и подход JTBD, чтобы сделать наше приложение максимально удобным.   Сейчас мы расширяем команду мобильной разработки в Почтовых Технологиях, чтобы поддержать стратегию развития Почты до 2023 года и ищем разработчиков, которые готовы принимать активное участие в создании одного из лучших продуктов в индустрии. Если у вас горят глаза от новых фич, анонсируемых на конференциях разработчиков WWDC или Google I/O, есть желание постоянно развиваться, умение работать в распределенной команде и портфолио реализованных проектов, то, возможно, мы ищем именно вас.    Обеспечим интересными задачами:      Участие в полном цикле разработки приложений;   Взаимодействие с внутренними заказчиками;   Обучение и консультация junior разработчиков.      Ожидаем от вас следующие знания и компетенции:      Опыт программирования под iOS от трех лет;   Отличное знание Swift, Objective-C, iOS SDK, Application Lifecycle, распространенных фреймворков   Опыт проектирования приложений с нуля;   Понимание принципов работы HTTP, REST;   Представления о методах обеспечения безопасности в мобильном приложении;   Знакомство с принятыми и распространенными паттернами проектирования;   Знания iOS Human Interface Guidelines;   Опыт работы в команде;   Умение учиться и обучать;   Активные ссылки на приложения в AppStore.      Взамен рады предложить:      Работа в стабильной и успешной компании;   Интересные задачи, дружный коллектив, перспективы профессионального и карьерного роста;   Полное соблюдение ТК РФ;   Достойный уровень вознаграждения по итогам собеседования;   Офис с видом на Исаакиевский собор в пешей доступности от ст. м. «Адмиралтейская», «Садовая», «Спасская»;   График работы: 5/2, начало рабочего дня обсуждается индивидуально;   Расширенный ДМС после испытательного срока;   Льготное кредитование в «Почта Банке», скидки у компаний-партнеров.      Вакансия открыта на конкурсной основе.  ",Полная занятость,Полный день,От 1 года до 3 лет,,3.0,250000.0,1.0,154000.0,ios разработчик,"Опыт программирования под iOS от трех лет. Отличное знание Swift, Objective-C, iOS SDK, Application Lifecycle, распространенных фреймворков. ",Участие в полном цикле разработки приложений. Взаимодействие с внутренними заказчиками. Обучение и консультация junior разработчиков.,0.03333333333333333,3,3,0,0,0,0,1,0,0,1,0,1,0,0,0,0,0,1,0,0,0,0,0,0,0,0,0,0,0,0,0
Санкт-Петербург,Tango Me,2019-12-12T09:39:46+0300," Наша компания - ведущий разработчик мобильной платформы для прямых трансляций с аудиторией более 400 миллионов пользователей по всему миру. Благодаря нашему сервису тысячи талантливых людей по всему миру находят своих поклонников, зарабатывая при этом деньги. Мы собрали команду высококвалифицированных профессионалов и продолжаем расширяться. Присоединяйтесь к нашей команде профессионалов!   Мы ищем опытного iOS разработчика для усиления команды, способного самостоятельно решать как поставленные задачи в срок и «под ключ», так и работать в команде когда это необходимо.    Требования:      Опыт коммерческой разработки под iOS от 3-х лет;   Уверенное знание Objective-C;   Знание принципов ООП и шаблонов проектирования;   Реализовывать нестандартные элементы UI;   Уметь верстать iOS интерфейсы и создавать интерфейсные анимации;   Умение пользоваться инструментами профилирования кода, заниматься поиском и исправлением узких мест;   Знание английского языка не ниже pre-intermediate   Умение и желание работать самостоятельно;      Обязанности:      Улучшение и поддержка мобильного приложения под iOS на Objective-C;   Внедрение новых функций;   Контроль качества реализации и качества кода;      Мы предлагаем:      Высокую белую зарплату (привязана к курсу доллара)   Опционы на акции компании для сотрудников   ДМС для сотрудников (и 75% оплата для супругов и детей)   Бесплатные обеды   Комфортный офис в историческом центре города с оборудованной кухней, разнообразными снеками, чаем, кофе, кикером   ",Полная занятость,Полный день,От 3 до 6 лет,|Objective-C|iOS|ООП|Английский язык,6.0,350000.0,3.0,300000.0,senior ios разработчик,Опыт коммерческой разработки под iOS от 3-х лет. Уверенное знание Objective-C. Знание принципов ООП и шаблонов проектирования. ,Улучшение и поддержка мобильного приложения под iOS на Objective-C. Внедрение новых функций. Контроль качества реализации и качества кода.,0.03333333333333333,5,5,0,0,0,0,1,0,0,0,1,1,0,0,0,0,0,1,0,0,1,1,0,0,1,1,0,0,0,0,1
Санкт-Петербург,KUPIBILET.RU,2019-11-20T10:40:08+0300,"  KUPIBILET.RU  — улётный онлайн-сервис для поиска авиабилетов по всему миру. В 2016 году нас выбрали 5 000 000 путешественников. Мы стремительно растем и ищем в нашу команду IOS-разработчика. Нам необходимо быстро двигаться вперед, улучшать текущую функциональность и реализовывать новые фичи. Чтобы добиться еще больших успехов,возможно, нам нужны именно вы.     Задачи:      Разработка и поддержка нашего iOS приложения          Что для нас важно:      Опыт разработки под iOS от 3-х лет;   Хорошее знание Objective-C и Swift;   Знание iOS SDK, Xcode, Instruments;   Опыт разработки клиент-серверных приложений;   Опыт разработки кастомных UI компонентов;   Владение английским языком на уровне, достаточном для чтения технической документации;   Хотя бы одно запущенное в App store приложение;   Высокая производительность, хорошая обучаемость;   Желание создавать качественный продукт, которым можно гордиться.       Мы предлагаем:      Офис в 5-х шагах от метро, в уютном, светлом и просторном офисе в бизнес-центре A класса;   Полностью &quot;белая&quot; ЗП;   Корпоративный полис ДМС;   Современное железо для рабочего места;   Рабочие столы с подъемными механизмами;   Отличная команда профессионалов, готовая всегда прийти на помощь;   Зерновой кофе, фрукты, печеньки;   Своя атмосфера - это уютные посиделки, вкусняшки и, конечно, традиционная для нас «пятничная» пицца.   ",Полная занятость,Полный день,От 3 до 6 лет,|IOS SDK|Swift|Objective-C|iOS,6.0,250000.0,3.0,154000.0,ios разработчик,"Опыт разработки под iOS от 3-х лет. Хорошее знание Objective-C и Swift. Знание iOS SDK, Xcode, Instruments. ",Разработка и поддержка нашего iOS приложения.,0.7666666666666667,3,3,0,0,0,0,1,0,0,0,1,1,0,0,0,0,0,1,0,0,1,1,1,0,0,0,1,0,0,0,1
Санкт-Петербург,First Line Software,2019-11-26T12:34:46+0300," Мы работаем над проектом по дальнейшему развитию мобильного приложения для крупнейшего логистического оператора РФ. На текущий момент мы расширяем команду и с радостью примем еще одного iOS разработчика. Главной нашей задачей является разработка удобных и понятных интерфейсов для пользователя, имплементация инновационных бизнес-фич, позволяющих эффективно работать с сервисами заказчика.   Официальное приложение делает общение с компанией заказчика удобным и эффективным: возможность отслеживания отправлений, поиск отделений, вызов курьера, получение обратной связи, а также многое другое.   Работаем по SCRUM-у (предполагается общение с представителями заказчика и другими командами).    Что нужно будет делать:      Анализ требований и оценка трудоемкости;   Разработка нативных приложений под iOS;   Создание клиентских и клиент-серверных приложений;   Согласование серверного API;   Участие в отладке и тестировании приложений.      Что мы ждем от кандидата:      Опыт написания клиент-серверных приложений;   Использование принципов ООП;   Знание на базовом уровне XML, JSON, HTTP;   Хорошее знание архитектуры и принципов разработки приложений под iOS (бизнес логика, разработка UI);   Хорошее знание Objective-C, Swift, iOS SDK;   Опыт разработки под iOS от одного года;   Опыт работы с системой контроля версий (GIT);   Технический английский.      Мы предлагаем:      Участие в разработке высокотехнологичных продуктов, которые используются на всех континентах, кроме Антарктиды   Большую команду профессиональных и творческих инженеров, которые готовы делиться своим опытом и знаниями   Курсы английского языка с носителями и русскоязычными преподавателями в офисе (большое количество наших заказчиков находится за рубежом, мы всегда за то, чтобы вы прокачивали свои скиллы владения английским)   Официальная зарплата и оформление по ТК РФ   Полис ДМС, в том числе стоматология, гибкий график, удобные рабочие места, офис в историческом центре в 10 минутах от ст.м. Петроградская   Cкидки на питание в кафе нашего бизнес-центра, а на каждом этаже офиса есть уютные кухни с плюшками, вкусным кофе и какао   Участие в футбольной команде, турнирах по кикеру, теннису и еще много корпоративных движух :)   ",Полная занятость,Полный день,От 1 года до 3 лет,|Swift|Objective-C|iOS,3.0,250000.0,1.0,154000.0,разработчик мобильных приложений для ios,"Опыт написания клиент-серверных приложений. Использование принципов ООП. Знание на базовом уровне XML, JSON, HTTP. Хорошее знание архитектуры и принципов...",Анализ требований и оценка трудоемкости. Разработка нативных приложений под iOS. Создание клиентских и клиент-серверных приложений. Согласование серверного API. ,0.5666666666666667,3,3,0,0,0,0,1,0,0,1,0,1,0,0,0,0,0,1,0,0,1,1,1,0,0,0,0,0,0,0,1
Санкт-Петербург,Сити лайф,2019-12-12T15:08:45+0300,"  CITYLIFE  — крупная международная компания, разработчик IT-продуктов.   Мы развиваем кэшбэк-сервис, который дает возможность получать баллы за покупки в интернет-магазинах. Этими баллами можно оплачивать такси, сотовую связь, общественный транспорт или просто выводить на карту в рублях.   Наш второй продукт — платформа для бизнеса. Помогаем торговым точкам внедрять программы лояльности для привлечения и удержания клиентов. Создаем инструменты для аналитики и статистики.    Мы ищем в нашу команду специалиста, который поможет нам улучшить качество нашего продукта     Что мы хотим, в целом:        Разработка модулей для мобильных приложений компании на iOS       Участие в формировании спецификации и документации по продукту        Более детально:        Опыт разработки мобильных приложений от 3 лет       Знание языка Swift (работа с RxSwift была бы плюсом)       Знание Objective-C (будет плюсом)       Знание принципов ООП, структур данных и паттернов проектирования       Умение работать с Coredata       Умение писать Unit-тесты       Понимание работы распределенных систем контроля версий (Git)        Будет плюсом, если вы      Знаете, что такое webSocket и работали с ними   Умеете писать на React Native      Что предлагаем :        Работа в офисе, плавающий график       Офисы в шаговой доступности от метро       Оформление по ТК РФ       Действительно дружный коллектив.       Все офисные плюшки (фитнес, английский, еда на кухне и пр)       Динамика и возможность расти горизонтально и вертикально.       Компания занимается исследовательской деятельностью в Сколково, в качестве партнера.        У нас есть офисы:        в Сколково в МСК;       в СПБ на Ладожской;       в СПБ на Озерках         ",Полная занятость,Гибкий график,От 3 до 6 лет,|Git|Coredata|RxSwift|Multithreading|Objective-C|swift,6.0,250000.0,3.0,154000.0,senior ios разработчик,Опыт разработки мобильных приложений от 3 лет. Знание языка Swift (работа с RxSwift была бы плюсом). Знание Objective-C (будет...,Разработка модулей для мобильных приложений компании на iOS. Участие в формировании спецификации и документации по продукту.,0.03333333333333333,3,3,0,0,0,0,1,0,0,0,1,1,0,0,0,0,1,0,0,0,0,1,1,1,0,0,0,0,0,0,1
