city,company-name,date,description,employment-form,employment-schedule,experience,key_skills,max-experience,max-salary,min-experience,min-salary,name,requirements,responsibilities,days_from_publish,min-salary-group,max-salary-group,city: Екатеринбург,city: Казань,city: Москва,city: Новосибирск,city: Санкт-Петербург,experience: Более 6 лет,experience: Нет опыта,experience: От 1 года до 3 лет,experience: От 3 до 6 лет,employment-form: Полная занятость,employment-form: Проектная работа,employment-form: Стажировка,employment-form: Частичная занятость,employment-schedule: Вахтовый метод,employment-schedule: Гибкий график,employment-schedule: Полный день,employment-schedule: Сменный график,employment-schedule: Удаленная работа,java,spring framework,git,sql,javascript,postgresql,hibernate orm,java se,java ee,junit,other
Новосибирск,Креатик Софт,2019-12-13T07:31:11+0300," Tradeshift - это платформа, которая автоматизирует процессы корпоративных закупок и поставок от создания заявки до оплаты. Она состоит из нескольких глобальных модулей, за каждый из которых отвечает своя команда. Платформа используется крупными корпорациями, средним бизнесом и государственным сектором Европы, Америки и Китая.   Мы ищем человека в команду Product Engine, которая занимается разработкой компонента, обеспечивающего создание, хранение и процессинг товаров в продуктовом каталоге, и предоставляет механизмы взаимодействия продавцов и покупателей, объединенных в глобальное сообщество Tradeshift Network.   У нас высокие требования к производительности, нулевой простой при деплойменте/откате. Мы предпочитаем автотесты ручному прогону регресса (и не только регресса), у нас автоматизированы все шаги деплоймента. Все изменения в коде, когда это необходимо, влекут соответствующие обновления процедур CI/CD. Платформа построена на принципах микросервисной архитектуры, сейчас в продакшне находятся более 80 различных компонентов.       Наша команда технически зрелая и обладает богатым опытом в сложной предметной области, мы успешно справляемся с вызовами по поддержке и развитию важного компонента в глобальной платформе. Мы гордимся тем, что именно нам доверено самостоятельно принимать технические решения в рамках Product Engine, включая архитектурные.    Вот в эту команду мы и ищем опытного Java разработчика, который хочет прокачаться в архитекторы в действительно крупном международном проекте.     Почему именно к нам?   Проект Tradeshift имеет партнерство с крупнейшими компаниями на рынке электронной коммерции.   Наша команда:       участвует в реализации технологии и стандартов корпоративных закупок на уровне запросов лидеров индустрии;       вовлечена в масштабную продуктовую разработку,       является частью международной команды. Общаясь с коллегами из разных офисов, мы вместе выстраиваем архитектуру платформы;       ежедневно повышает уровень английского языка на практике, в постоянном рабочем общении с коллегами;       ездит в командировки в другие центры разработки Tradeshift (Дания, Румыния, Китай, США).       не боится пробовать и использовать новые технологии, когда это оправдано.       В отличии от компаний, в которых инженерам не дают самостоятельно работать, отвлекая их на миллион активностей и на ходу меняя вектора движения, мы планируем и согласовываем с бизнесом функционал на квартал, и внутри него скоуп задач меняется крайне редко.   Наш технологический стек:   Бэкенд — на Java. Фронтенд — на AngularJS, Node.js, React. Данные храним в PostgreSQL. Облака — AWS, Kubernetes, Docker. ",Полная занятость,Полный день,От 3 до 6 лет,|Java|PostgreSQL|Spring Framework|AWS|Git,6.0,150000.0,3.0,110000.0,senior java разработчик в команду produсt engine платформы tradeshift,Без требований,Участвует в реализации технологии и стандартов корпоративных закупок на уровне запросов лидеров индустрии. Вовлечена в масштабную продуктовую разработку. ,0.0,2,2,0,0,0,1,0,0,0,0,1,1,0,0,0,0,0,1,0,0,1,1,1,1,0,1,0,0,0,0,1
Новосибирск,Кадровое агентство Алексея Сухорукова,2019-11-18T21:45:47+0300," Международная группа студий по разработке игр, контента и медиа-платформ расширяет свою команду и примет разработчика игровых платформ с опытом от 3 лет.   Офисы компании находятся в Лондоне, Токио, Лос-Анджелесе, Эстонии, на Мальте, Тайвани и Кюрасао. Сейчас вы можете присоединиться к разработчикам в Таллине. Вам предстоит создавать и обслуживать микросервисы для собственной игровой платформы.    Ваши задачи:        Внедрение микросервисов на Java       Реализация игрового функционала, потоков и связи с сервером       Внедрение новых функций и компонентов в существующий кластер микросервисов       Разработка моделей баз данных для микросервисов (NoSQL и SQL)        От вас потребуется:        Опыт программирования от 3 лет       Знание Java на уровне Middle+ или выше       Опыт разработки backend-компонентов и микросервисов       Опыт отладки сложных приложений на Java       Опыт работы с базами данных (NoSQL, SQL)       Английский язык на уровне С1 и выше        Вам предложат:        Конкурентную заработную плату (оклад + бонусы по итогам месяца и года)       Помощь с релокацией       Быстрорастущую компанию       Профессиональное развитие       Активную команду единомышленников       Бесплатные пиццу и напитки по пятницам     ",Полная занятость,Полный день,От 3 до 6 лет,|Java|SQL|NoSQL,6.0,105160.0,3.0,106772.0,java разработчик,Опыт программирования от 3 лет. Знание Java на уровне Middle+ или выше. Опыт разработки backend-компонентов и микросервисов. ,"Внедрение микросервисов на Java. Реализация игрового функционала, потоков и связи с сервером. Внедрение новых функций и компонентов в существующий кластер...",0.8333333333333334,2,1,0,0,0,1,0,0,0,0,1,1,0,0,0,0,0,1,0,0,1,0,0,1,0,0,0,0,0,0,1
Новосибирск,Кадровое агентство Алексея Сухорукова,2019-12-03T10:31:28+0300," Компания, предоставляющая услуги IT-консалтинга, разработки и внедрения программных решений, ищет Java-разработчика со знанием Kotlin.   Вы будете частью команды, создающей эффективные решения для клиентов в Германии, Австрии и Швейцарии.   Рабочее место находится в самом центре Северной Германии — Гамбурге. За его каналы и мосты его называют Венецией Германии. А если вы захотите прогуляться, то к вашим услугам множество парков, занимающих целых 14% города.    От вас потребуется:         Знание Java и/или Kotlin на уровне Senior       Опыт программирования от 5 лет       Хорошее знание современных веб-технологий (JavaScript, CSS, HTML) и фреймворков       Профильное высшее образование       Развитые коммуникативные навыки       Готовность к непосредственному контакту с клиентом на английском языке для анализа его потребностей        Будет плюсом:         Опыт работы с фреймворками (Spring, Angular или другие)       Работа в Docker, Jenkins, Git и Maven        Что вас ждет:         Проект с чистым кодом и разработка, основанная на тестировании       Интересные проекты с использованием современных технологий       Работа по Agile и отсутствие сверхурочных       Парное программирование       Свобода выбора ОС (MacOs, Linux или Windows)       Молодая и мотивированная команда разработчиков        Компания предоставит:         Заработную плату до 5800 евро (гросс)       Гибкий график       30 дней отпуска       Пособие на проезд в общественном транспорте       Бесплатные напитки в офисе       Регулярный teambuilding (от вечеринок на Рождество с семьями до митапов с коллегами)     ",Полная занятость,Гибкий график,От 3 до 6 лет,|Java|Kotlin|JavaScript|HTML,6.0,5800.0,3.0,4100.0,java kotlin разработчик,"Знание Java и/или Kotlin на уровне Senior. Опыт программирования от 5 лет. Хорошее знание современных веб-технологий (JavaScript, CSS...","Проект с чистым кодом и разработка, основанная на тестировании. Интересные проекты с использованием современных технологий. Работа по Agile и отсутствие...",0.3333333333333333,0,0,0,0,0,1,0,0,0,0,1,1,0,0,0,0,1,0,0,0,1,0,0,0,1,0,0,0,0,0,1
Новосибирск,ScaleApps,2019-12-10T07:59:40+0300," Компания предлагает участие в нескольких проектах с зарубежным заказчиком, разработка и поддержка e-commerce систем для спортивных событий.    Обязанности:      Разработка нового кода, поддержка существующего кода          Требования:      Высшее или незаконченное высшее техническое образование   Хорошее знание Core Java   Знание SQL   Базовые знания web-технологий: html, css, Javascript          Желательно:      Опыт работы с Spring Framework, Hibernate, MySQL   Опыт работы с Angular JS   Владение Maven, Git, SVN, Jenkins       Условия:      Конкурентная заработная плата   Обучение   Гибкий график работы   ",Полная занятость,Полный день,Нет опыта,|Java|Spring Framework|Hibernate ORM|HTML|CSS,,40000.0,,30000.0,junior java разработчик,"Высшее или незаконченное высшее техническое образование. Хорошее знание Core Java. Знание SQL. Базовые знания web-технологий: html, css, Javascript. ","Разработка нового кода, поддержка существующего кода.",0.1,0,0,0,0,0,1,0,0,1,0,0,1,0,0,0,0,0,1,0,0,1,1,0,0,0,0,1,0,0,0,1
Новосибирск,Agiloft,2019-11-16T00:27:55+0300,"      Позиция только для тех кто владеет основами J2EE/EJB!     Why Join Agiloft?    Are you an experienced Senior Java Developer who is successful, motivated, smart, energetic, and looking for a rewarding position in a growing, profitable and dynamic company?   Agiloft is looking for software engineers that thrive working in a fast growing organization with unique business challenges requiring smart solutions.     Agiloft is a leader in Contract Lifecyle Management, one of the fasting growing areas of enterprise sales, with a TAM projected to climb from $2B to $7B in the next 5 years.   The Agiloft Contract and Commerce Lifecycle Platform has won over a dozen awards, including the Editor&#39;s Choice award from PC Mag, for the past four years in a row.   Agiloft has a highly differentiated value proposition which is uniquely appealing to enterprise: pre-built applications with a with a deeply configurable, no-code platform for integrated BPM throughout an organization.   Agiloft is pioneering the applied use of Artificial Intelligence to enable next-generation business commerce at organizations ranging from small enterprises to U.S. government agencies and Fortune 100 companies.   We guarantee our customer’s success,  and you too will be successful with Agiloft .     As the leader in the CCLM market, Agiloft is winning many Enterprise deals and looking to hire the best talent to meet this demand with a competitive compensation plan that rewards over achievement.    Job Description  - This is a remote-only position. You must be comfortable with setting your own schedule and proactively collaborating in a globally dispersed team using a variety of communication channels.  We are seeking an Enterprise JavaBeans Developer who will join our fast-growing engineering team, working on mission-critical applications. Your duties will include developing scalable Java applications while providing expertise in the full software development lifecycle, from concept and design to testing.    Responsibilities:      Design and develop high-volume, low-latency applications that enhance the Agiloft core platform   Create well designed, testable, efficient code   Participate in all phases of the development lifecycle   Assist in preparation and production of releases   Ensure designs meet specifications   Investigate alternatives and technologies and present them for architectural review, in order to support continuous improvement     Requirements:     Experience with J2EE, Tomcat, JBoss and relational databases such as MySQL, MSSQL, Oracle   Computer Science degree or equivalent   Experience working on large software projects   At least one year of post-graduate experience in Java development with J2EE   Deep understanding of OO programming principals and commitment to clean, efficient, well documented code.     Agiloft Overview  Agiloft is a profitable and fast-growing cloud software company that develops and markets agile business automation software. We are stable, debt-free and have a strong and deeply referenceable customer base. Our suite of products includes Contract Management, Customer Support, ITIL, RMA and Asset Management.   Our headquarters offices are in Redwood City, near San Francisco but the entire engineering team works from the comfort of their home offices all around the world. We do not expect staff to work crazy hours - we believe that in the long term, it is optimum for everyone if employees maintain a healthy work/life balance. ",Полная занятость,Удаленная работа,От 3 до 6 лет,|ORACLE|ООП|SQL|MySQL|Java|MS SQL|Java EE|EJB|JBoss|Apache Tomcat,6.0,105160.0,3.0,106772.0,java разработчик,"Experience with J2EE, Tomcat, JBoss and relational databases such as MySQL, MSSQL, Oracle. Computer Science degree or equivalent. ","Design and develop high-volume, low-latency applications that enhance the Agiloft core platform. Create well designed, testable, efficient code. ",0.9333333333333333,2,1,0,0,0,1,0,0,0,0,1,1,0,0,0,0,0,0,0,1,1,0,0,1,0,0,0,0,1,0,1
