city,company-name,date,description,employment-form,employment-schedule,experience,key_skills,max-experience,max-salary,min-experience,min-salary,name,requirements,responsibilities,days_from_publish,min-salary-group,max-salary-group,city: Екатеринбург,city: Казань,city: Москва,city: Новосибирск,city: Санкт-Петербург,experience: Более 6 лет,experience: Нет опыта,experience: От 1 года до 3 лет,experience: От 3 до 6 лет,employment-form: Полная занятость,employment-form: Проектная работа,employment-form: Стажировка,employment-form: Частичная занятость,employment-schedule: Вахтовый метод,employment-schedule: Гибкий график,employment-schedule: Полный день,employment-schedule: Сменный график,employment-schedule: Удаленная работа,java,spring framework,git,sql,javascript,postgresql,hibernate orm,java se,java ee,junit,other
Новосибирск,Экстрим про,2019-12-09T09:12:47+0300,"  Группа компаний Экстрим -  один из лидирующих разработчиков ПО для государственных заказчиков, крупный уральский интегратор, 25 лет стабильно на рынке.   приглашает  Разработчика   J  ava   на удалённое сотрудничество  в интересные и социально-важные проекты уровня города, региона, страны.        Задача  - проектирование и реализация многопользовательских систем на Java, в том числе с использованием веб-технологий.    Мы используем в проектах:      технологии для Java разработки: Java 7/8, EJB 3.1/Spring, JPA 2.1 (Hibernate), PostgreSQL/Oracle, Apache Velocity, jQuery, AngularJS, Gradle/Maven;   инструментарий: Intellij IDEA, JIRA, GIT/Subversion, TeamCity, Confluence/DokuWiki;   технологии для .NET-разработки: .NET 4.5, C#, WCF REST, WPF, WWF, Entity Framework, ASP.NET MVC 5, jQuery UI, MS SQL Server 2012, СКЗИ «КриптоПро CSP»;   инструментарий: Visual Studio 2012/2013 (для .NET-разработки), JIRA (+greenhopper)/ YouTrack, Fisheye+Crucible, Confluence, GIT/SVN, Teamcity+Octopus Deploy.      Для этого тебе понадобятся:      Java EE (опыт разработки не менее 2 лет);   знание базовых технологий Java: JPA, Hibernate, Spring, Lucene, JDBC и др;   знание SQL, опыт работы с СУБД (желательно Oracle);   умение работать самостоятельно и в команде;   хороший технический английский.          Будет плюсом:      знание технологий веб-программирования: HTML, CSS, JavaScript, AJAX, JSON;   знание технологий Java для веб: JSF, GWT, JBoss Seam;   навык работы с серверами приложений JBoss AS, Glassfish;   практический опыт использования Agile, TDD, BDD;   навык работы с распространенными библиотеками и фреймворками, например: логгирование, модульное тестирование, работа с XML;   опыт работы с системами учета версий, автоматической сборки и непрерывной интеграции (SVN, JIRA, Apache Maven, Hudson и др.);   знание ОС Linux;   знание платформы .NET, опыт интеграции решений на Java и .NET;   интерес к изучению новых языков программирования, фреймворков, технологий разработки.      Мы готовы предложить:      Комфорт:       расширенный соц. пакет: добровольное медицинское страхование со стоматологией, ежегодная вакцинация, а также компенсация занятий спортом;   гибкий рабочий график, пятидневная рабочая неделя, 8-часовой рабочий день;   персональное предложение по зарплате в зависимости от уровня твоих навыков;   комфортный офис (Екатеринбург/Севастополь) или удаленная работа.       Возможности:     - мы предлагаем работу в командах высококлассных профессионалов с многолетним опытом, среди них тренеры Microsoft (MCT) и ведущие разработчики (MCPD);   - возможность профессионального развития, обмен опытом между сотрудниками внутри компании; наличие собственной корпоративной библиотеки;     Атмосфера:         отзывчивая сплоченная команда; мы ценим обратную связь; для нас важно мнение каждого сотрудника;       у нас насыщенная корпоративная жизнь, организованы активности по интересам;         Перспектива:     - мы ценим готовность каждого сотрудников брать на себя ответственность и поддерживаем в стремлении расти.     ",Полная занятость,Удаленная работа,От 1 года до 3 лет,,3.0,105160.0,1.0,106772.0,разработчик java,"Для этого тебе понадобятся: Java EE (опыт разработки не менее 2 лет). Знание базовых технологий Java: JPA, Hibernate, Spring, Lucene...","Задача - проектирование и реализация многопользовательских систем на Java, в том числе с использованием веб-технологий. Интерес к изучению новых языков...",0.13333333333333333,2,1,0,0,0,1,0,0,0,1,0,1,0,0,0,0,0,0,0,1,0,0,0,0,0,0,0,0,0,0,0
Новосибирск,Rhinoda,2019-11-25T07:50:19+0300,"  Наша компания называется &quot;Rhinoda&quot; - от латинского &quot;носорог&quot;.  Для нас важны целеустремленность, упорство и увлеченность.   Одиннадцать лет мы сотрудничаем с зарубежными клиентами: разрабатываем сайты, игры и мобильные приложения, а затем занимаемся их поддержкой и модернизацией. Головной офис компании расположен в Омске.   У нас слаженная сильная команда, работающая над яркими и интересными проектами. Сейчас задач стало столько, что компании стал необходим  Java Middle Developer  на существующие проекты с зарубежными клиентами.   Вам предстоит разработка и поддержка разработанного функционала, анализ и оценка новых проектов.    Обязательные требования:      опыт программирования на Java;   знание Spring Framework;   понимание основных принципов ООП;   базовые знания работы с БД, знания SQL;   умение работать с системами контроля версий;   самостоятельность, инициативность, ответственность, умение работать в команде;   возможность приступить к работе  немедленно .      Будет плюсом:      знания в области MySQL, PostgreSQL;   знание Сore Java (1.8);   знание многопоточности;   опыт создания скриптов автоматизации;   работа в команде разработки коммерческих проектов;   опыт работы в режиме многозадачности;   умение аргументированно излагать свою точку зрения;   владение английским языком на уровне чтения технической литературы.      Что нужно делать:      проектировать и развивать элементы системы действующего проекта;   взаимодействовать с участниками команды;   самостоятельно анализировать поставленные экспертами задачи (реализуемость, непротиворечивость);   писать красивый и оптимизированный код, отвечать за стабильную работу модуля.      Условия работы:      сложные и интересные задачи, опыт работы над крупными разноплановыми проектами;   высокий оклад и стабильный рост заработной платы;   гибкий график (работа в удобные часы);   удаленная работа;   непрерывное обучение и наставничество.      Работа в компании Rhinoda - это возможность получения яркого и разнопланового опыта, слаженный процесс командной работы, курирование процесса выполнения задач опытными менеджерами проектов и гибкий подход к каждому сотруднику.    You are welcome! ",Полная занятость,Удаленная работа,От 1 года до 3 лет,|Java|MySQL|ООП|PostgreSQL|SQL|Spring Framework|Базы данных|Сore Java,3.0,105160.0,1.0,106772.0,java middle разработчик,"Опыт программирования на Java. Знание Spring Framework. Понимание основных принципов ООП. Базовые знания работы с БД, знания SQL. ","Проектировать и развивать элементы системы действующего проекта. Взаимодействовать с участниками команды. Самостоятельно анализировать поставленные экспертами задачи (реализуемость, непротиворечивость). ",0.6,2,1,0,0,0,1,0,0,0,1,0,1,0,0,0,0,0,0,0,1,1,1,0,1,0,1,0,0,0,0,1
Новосибирск,Сбербанк,2019-11-27T06:14:40+0300," В молодую амбициозную команду требуются java-разработчики уровня middle. Мы разрабатываем MDM-систему с нуля по централизованному ведению и распространению данных. Архитектура системы состоит из 11 модулей, половина из них в Production, другая половина требует проектирования и разработки. От команды Вы получите опыт и развитие компетенций, амбициозные задачи, карьерный рост и открытость к инновациям.    Используемые     технологии   backend : Spring CORE/Security/Batch/REST/HateOAS, BPM, Versioning, Hibernate Envers/ORM/OGM, Apache Kafka, Jasper reports, Liquibase, Oracle/PostgreeSql, Wildfly    Процесс     разработки : Scrum, Jira, Gitflow, DevOps до Production    Переходим     на  :  Docker, Kubernates, Istio service mesh, REST, gRpc, Serverless, GridGain, Spring Boot    Задачи      разработка выделенного модуля/группы модулей   проработка solution-архитектуры   постановка, декомпозиция, оценка задач      Требования к кандидату      Высшее техническое образование   Знание мат. части по java, Hibernate, Spring   Мотивация и ответственность   Soft-скилы коммуникаций и проактивность   3-5 лет опыта коммерческой разработки на java   Желание и умение:   заниматься наставничеством,   конструктивно воспринимать критику,   разбираться в чужом коде,   писать чистый и понятный код для других разработчиков      Мы предлагаем:    - масштабные и высоконагруженные проекты с использованием новых технологий;   - команду профессионалов, готовых поддержать ваши инициативы;   - использование Agile-методологии;   - возможность обучения и сертификации за счёт компании;   -возможность изучения английского языка, не выходя из офиса;   - гибкий график;   - трудоустройство согласно трудовому кодексу   - оклад плюс премии по результатам работы   - корпоративное обучение   - медицинскую страховку   - материальная поддержка в особых случаях   - скидки на продукты Сбербанка.        Про Сбербанк    Сбербанк — это современная техническая платформа, создающая новые способы потребления финансовых (и не только) услуг. Мы собираем лучшие технологии и управленческие методы из мировой практики, чтобы превратить «главный» банк России в передовую сервисную экосистему. Если тебе нравится эта идея, присоединяйся к нашей команде.    За что сотрудники любят Сбербанк:     прогрессивность:  да, мы — банк со столетней историей, но одновременно и финтех-стартап с идеями о том, как изменить мир    масштаб:  внутри одной компании можно развиваться в любом направлении и строить карьеру с любым уровнем амбиций    эффект:  ты стараешься — и это видят десятки миллионов людей.                         ",Полная занятость,Полный день,От 1 года до 3 лет,|Hibernate ORM|Agile Project Management|Spring Framework|Atlassian Jira|Java,3.0,105160.0,1.0,106772.0,java разработчик,"Используемые технологии backend: Spring CORE/Security/Batch/REST/HateOAS, BPM, Versioning, Hibernate Envers/ORM/OGM, Apache Kafka, Jasper reports, Liquibase...","Процесс разработки: Scrum, Jira, Gitflow, DevOps до Production. Разработка выделенного модуля/группы модулей. Проработка solution-архитектуры. Постановка, декомпозиция, оценка задач.",0.5333333333333333,2,1,0,0,0,1,0,0,0,1,0,1,0,0,0,0,0,1,0,0,1,1,0,0,0,0,1,0,0,0,1
Новосибирск,ProfiStaff,2019-12-05T12:34:33+0300," Компания – разработчик ПО, которая предоставляет услуги по организации приема платежей онлайн, в том числе через кроссплатформенные мобильные приложения - в поисках Java -разработчиков.   Компания специализируется на обслуживании финансового сектора и является лидирующим поставщиком услуг для банков. Помимо банков, страховых компаний и МФО среди клиентов — известные интернациональные бренды и множество других участников рынка e-commerce.   Готовы предложить гибкий график, Готовы предложить гибкий график, а также, при желании - обучение с сертификатами и посещение конференций.        Условия:          Достойный уровень заработной платы (окончательная сумма определяется в зависимости от опыта кандидата и обсуждается индивидуально).   Оформление по ТК РФ, &quot;Белая&quot; заработная плата,   Работа в офисе, в центре г. Санкт-Петербург (в том числе рассматриваются кандидаты из других городов с переездом).   Обучение за счёт компании и посещение IT- конференций.   Офис в бизнес-центре класса &quot;А&quot;.   Гибкое начало рабочего дня с 9:00 или 11:00.   Дружный коллектив, уютная атмосфера, чай/ кофе и «печеньки» в офисе.   Помощь с релокацией в Санкт-Петербург успешным кандидатам из других городов.          Требования:          Высшее техническое образование;   Опыт программирования на Java от 2-х лет;   Опыт коммерческой разработки на Java EE, EJB3 или Java SE + Spring Framework от 1 года;     Опыт работы или знание технологий: Servlets/JSP, JMS, JDBC (будет плюсом).            Обязанности:          Разработка новых продуктов платежного шлюза в соответствии с требованиями безопасности.   Поддержка и оптимизация существующего функционала.       ",Полная занятость,Полный день,От 3 до 6 лет,,6.0,180000.0,3.0,100000.0,java разработчик,"Высшее техническое образование. Опыт программирования на Java от 2-х лет. Опыт коммерческой разработки на Java EE, EJB3 или...",Разработка новых продуктов платежного шлюза в соответствии с требованиями безопасности. Поддержка и оптимизация существующего функционала.,0.26666666666666666,1,2,0,0,0,1,0,0,0,0,1,1,0,0,0,0,0,1,0,0,0,0,0,0,0,0,0,0,0,0,0
Новосибирск,JetBrains,2019-12-02T13:11:03+0300," RubyMine — среда разработки для языка Ruby и фреймворка Ruby on Rails. Это первая специализированная IDE на платформе IntelliJ IDEA, создаваемая нами с любовью для других программистов c 2008 года. RubyMine используют такие компании, как Twitter, NASA и New Relic.   Одна из главных функций RubyMine — это отладчик Ruby (debugger). Наш отладчик поддерживает много сложных сценариев, например, подключение к запущенному процессу на удаленной машине или перекомпиляция закешированного байткода при отладке. Однако с развитием виртуальной машины Ruby растут и требования к отладчику, его скорости и функциональности.   Команда RubyMine ищет разработчика с хорошим знанием C и Java в подсистему Debugger.        Среди задач:      поддержка и развитие отладчика Ruby как со стороны виртуальной машины Ruby, так и со стороны RubyMine;   взаимодействие с командой Ruby Core и развитие Ruby-интерпретатора для лучшей интеграции с IDE;   работа над другими инструментами, связанными с запуском: profiler, coverage и другие.      Мы хотим видеть тебя в своей команде, если ты:      имеешь опыт разработки на Java, C или С++ в коммерческих проектах не менее 3-х лет;   умеешь и любишь решать сложные и по-настоящему интересные задачи;   ценишь хороший дизайн и удобство пользования интерфейсом;   умеешь проектировать и писать код, который легко читать и поддерживать;   умеешь работать как в команде, так и самостоятельно;   испытываешь профессиональную гордость от результатов своей работы.      Плюсами будут:      опыт участия в open-source проектах или ведения собственных;   знакомство с Ruby, и особенно с устройством его виртуальной машины;   опыт работы с Unix-системами;   хороший письменный английский.           ",Полная занятость,Полный день,От 3 до 6 лет,|Java|C/C++,6.0,105160.0,3.0,180000.0,java с разработчик,"Мы хотим видеть тебя в своей команде, если ты: Имеешь опыт разработки на Java, C или С++ в коммерческих проектах...","Среди задач: Поддержка и развитие отладчика Ruby как со стороны виртуальной машины Ruby, так и со стороны RubyMine. ",0.36666666666666664,3,1,0,0,0,1,0,0,0,0,1,1,0,0,0,0,0,1,0,0,1,0,0,0,0,0,0,0,0,0,1
