city,company-name,date,description,employment-form,employment-schedule,experience,key_skills,max-experience,max-salary,min-experience,min-salary,name,requirements,responsibilities,days_from_publish,min-salary-group,max-salary-group,city: Екатеринбург,city: Казань,city: Москва,city: Новосибирск,city: Санкт-Петербург,experience: Более 6 лет,experience: Нет опыта,experience: От 1 года до 3 лет,experience: От 3 до 6 лет,employment-form: Полная занятость,employment-form: Проектная работа,employment-form: Стажировка,employment-form: Частичная занятость,employment-schedule: Вахтовый метод,employment-schedule: Гибкий график,employment-schedule: Полный день,employment-schedule: Сменный график,employment-schedule: Удаленная работа,английский язык,обучение и развитие,управление проектами,sap erp,ms powerpoint,разработка технических заданий,windows 7,sql,ms sql,sap,other
Екатеринбург,СИГМА,2019-12-06T18:26:13+0300,"  Обязанности:      Участие в разработке технических заданий, основанных на требованиях на изменение системы SAP HR   Участие в настройке и поддержке интерфейсов существующей функциональности SAP HR   Тестирование новой версии программного комплекса SAP HR   Осуществляет поддержку пользователей системы SAP HR на 2-ой линии      Требования:     Обязательно      Оконченное высшее образование (либо учащийся с возможностью работать полный день в офисе);   Умение структурированно излагать свои мысли, аналитический подход при решении поставленных задач;   Желание интенсивно обучаться и развиваться, нацеленность на результат;   Хорошие коммуникативные навыки, умение работать в команде; Знание MS Office (Word, Excel, Power Point), интерес к ИТ;   Желание развиваться в качестве консультанта SAP      Желательно      Знание английского языка на уровне чтения технической документации;      Условия:      Работа в масштабных интересных проектах   Перспективы профессионального и карьерного роста   Оформление в соответствии с ТК РФ   Конкурентная заработная плата   Квартальное премирование по результатам работы   Внутреннее и внешнее обучение сотрудников   ДМС после испытательного срока   Доступ к корпоративной электронной библиотеке   ",Стажировка,Полный день,Нет опыта,|MS PowerPoint|Английский язык|Обучение и развитие|Разработка технических заданий|Windows 7,,,,90000.0,стажер sap hr,"Оконченное высшее образование (либо учащийся с возможностью работать полный день в офисе). Умение структурированно излагать свои мысли, аналитический подход при...","Участие в разработке технических заданий, основанных на требованиях на изменение системы SAP HR. Участие в настройке и поддержке интерфейсов существующей...",0.23333333333333334,1,0,1,0,0,0,0,0,1,0,0,0,0,1,0,0,0,1,0,0,1,1,0,0,1,1,1,0,0,0,1
Екатеринбург,TeamIdea (ООО ТИМИДЕЯ ГРУПП),2019-11-29T12:00:11+0300," Компания  TeamIdea , единственная российская компания-платиновый партнёр SAP, открывает вакансию  Стажера-Разработчика   SAP  .     Испытательный срок:  до 3 месяцев.    Ожидания от кандидата:      высшее техническое или экономическое образование;   знание минимум одного из языков программирования (Java, C++, C#, Python, JavaScript, Delphi/Object Pascal, Ruby, PL/SQL);   знание SQL и принципов построения реляционных БД;   понимание клиент-серверной архитектуры;   знание и понимание принципов ООП;   знание английского языка на уровне чтения технической документации.      Будет плюсом:      опыт самостоятельных разработок;   опыт работы с БД;   опыт работы с REST сервисами, протоколом oData;   базовые знания HTML5, CSS;   опыт работы с JavaScript-фреймворками;   понимание паттернов проектирования;   знакомство с продуктами SAP (SAP Cloud Platform, Fiori, SAPUI5);   уверенный письменный и разговорный английский.      Профессионально-значимые личностные качества:      стремление и способность к интенсивному и постоянному обучению, в том числе самостоятельному развитию;   аналитический склад ума;   ответственность;   высокая работоспособность.      Задачи:      обучение и профессиональное развитие в области разработок на языке программирования ABAP и сопутствующих технологиях (SAP HANA, Process Integration);   обучение и профессиональное развитие в области разработок приложений SAPUI5 (FIORI) и сопутствующих технологиях (SAP SCP, Java, REST/SOAP/oData);   участие в проектах в качестве back-end (ABAP) или front-end (Fiori, SAPUI5) разработчика.   ",Стажировка,Полный день,Нет опыта,,,,,90000.0,стажер разработчик sap,"Высшее техническое или экономическое образование. Знание минимум одного из языков программирования (Java, C++, C#, Python, JavaScript, Delphi/Object Pascal, Ruby...","Обучение и профессиональное развитие в области разработок на языке программирования ABAP и сопутствующих технологиях (SAP HANA, Process Integration). ",0.4666666666666667,1,0,1,0,0,0,0,0,1,0,0,0,0,1,0,0,0,1,0,0,0,0,0,0,0,0,0,0,0,0,0
Екатеринбург,Атос АйТи Солюшенс энд Сервисез,2019-12-06T11:58:27+0300,"  Вводная о проекте:    Проект поддержки/развития системы SAP.    Требования:      Опыт настройки/поддержки в роли консультанта или старшего консультанта не менее 2-х лет в области SAP QM;   Уровень владения английским языком и/или немецким языком не ниже Intermediate;   Знание стандартных процессов в SAP QM, а также знание основных взаимосвязей с модулями: PP, MM.     Желательно:     Знание ABAP для поиска ошибок в коде и для разработки функциональных спецификаций и тестирования.      Обязанности:      Обработка заявок на 2-3 уровне поддержки. Разрешение инцидентов и проблем в системе SAP клиента;   Участие в разработках нового функционала / модификации существующего функционала в системе SAP клиента;   Выполнение типовых настроек в системе;   Проведение анализ сбоев и дальнейшее описание и передача на исправление программисту;   Коммуникация, участие в совещаниях и переговорах с ключевыми лицами заказчика;   Разработка пользовательской документации.      Условия:      Компания предлагает стабильную и интересную работу, возможность профессионального развития;   Изучение английского и немецкого языка;   Предоставление дополнительных отпусков;   Предоставление материальной помощи по особым случаям;   Добровольное медицинское страхование (поликлиника, стоматология) - 100% компенсация для сотрудников компании;   Компенсация питания сотрудника;   Программа компенсаций занятий спортом;   Программа награждения сотрудников за выдающиеся успехи;   Комфортный офис в  г. Воронеже и г. Краснодаре ;    ВОЗМОЖНА УДАЛЕННАЯ РАБОТА     ",Полная занятость,Полный день,От 1 года до 3 лет,|SAP|SAP QM,3.0,,1.0,90000.0,sap qm сonsultant,Опыт настройки/поддержки в роли консультанта или старшего консультанта не менее 2-х лет в области SAP QM. ,Знание ABAP для поиска ошибок в коде и для разработки функциональных спецификаций и тестирования. Обработка заявок на 2-3 уровне...,0.23333333333333334,1,0,1,0,0,0,0,0,0,1,0,1,0,0,0,0,0,1,0,0,0,0,0,0,0,0,0,0,0,1,1
Екатеринбург,Римэкс,2019-12-04T08:44:19+0300,"   &quot;Римэкс&quot; приглашает на работу специалиста SAP      Обязанности     -  знание модулей: ММ, SD, PР   - Участие во внедрении и поддержке SAP;   · Сбор и формализация требований компании по автоматизации процессов в SAP;   · Моделирование бизнес-процессов;   · Настройка функциональности SAP;   · Ведение проектной документации;   · Написание технических заданий на разработку интерфейсов;   · Обучение пользователей.   - Автоматизация процессов приёмки,размещения,подбора, оптимизации, отгрузки товара в SAP (логистический блок)    Требования:     -  профильное высшее образование   - опыт работы от 2ух лет    Условия:     - О фициальное трудоустройство   - Удобный и современный офис по адресу: Екатеринбург, ул. Черняховского - Доставка служебным транспортом - Полный соц. пакет - Компенсация мобильной связи - Премии по результатам работы - Обучение на специализированных семинарах.     ",Полная занятость,Полный день,От 1 года до 3 лет,,3.0,,1.0,90000.0,разработчик sap,"знание модулей: ММ, SD, PР. - профильное высшее образование. - опыт работы от 2ух лет.",Участие во внедрении и поддержке SAP. Сбор и формализация требований компании по автоматизации процессов в SAP. Моделирование бизнес-процессов. ,0.3,1,0,1,0,0,0,0,0,0,1,0,1,0,0,0,0,0,1,0,0,0,0,0,0,0,0,0,0,0,0,0
Екатеринбург,Атос АйТи Солюшенс энд Сервисез,2019-12-06T11:58:52+0300,"  ОБЯЗАННОСТИ:      Обработка заявок на 2-3 уровне поддержки. Разрешение инцидентов и проблем в системе SAP клиента;   Участие в разработках нового функционала / модификации существующего функционала в системе SAP клиента;   Выполнение типовых настроек в системе;   Проведение анализ сбоев и дальнейшее описание и передача на исправление программисту.      ТРЕБОВАНИЯ:      Опыт настройки/поддержки модулей в системе SAP в роли консультанта или старшего консультанта PP, QM &gt; 3 лет;   Уровень владения английским языком не ниже Intermediate;   Знание стандартных процессов в SAP PP, QM;   Написание технических заданий и проектных решений;   Умение читать ABAP программы простой-средней сложности (debugging) будет плюсом.      УСЛОВИЯ:      Компания предлагает стабильную и интересную работу, возможность профессионального развития;   Изучение английского и немецкого языка;   Предоставление дополнительных отпусков;   Предоставление материальной помощи по особым случаям;   Добровольное медицинское страхование (поликлиника, стоматология) - 100% компенсация для сотрудников компании;   Компенсация питания сотрудника;   Программа компенсаций занятий спортом;   Программа награждения сотрудников за выдающиеся успехи;   Комфортный офис в  г. Воронеже и г. Краснодаре ;    ВОЗМОЖНА УДАЛЕННАЯ РАБОТА     ",Полная занятость,Полный день,От 3 до 6 лет,,6.0,,3.0,90000.0,sap pp qm сonsultant,"Опыт настройки/поддержки модулей в системе SAP в роли консультанта или старшего консультанта PP, QM &gt; 3 лет. Уровень владения английским...",Обработка заявок на 2-3 уровне поддержки. Разрешение инцидентов и проблем в системе SAP клиента. Участие в разработках нового функционала...,0.23333333333333334,1,0,1,0,0,0,0,0,0,0,1,1,0,0,0,0,0,1,0,0,0,0,0,0,0,0,0,0,0,0,0
Екатеринбург,Атос АйТи Солюшенс энд Сервисез,2019-12-09T12:33:56+0300,"  Обязанности:      Обработка заявок на 2-3 уровне поддержки (согласно ITIL). Разрешение инцидентов и проблем в системе SAP клиента;   Участие в разработках нового функционала / модификации существующего функционала в системе SAP клиента;   Выполнение типовых настроек в системе;   Проведение анализ сбоев и дальнейшее описание и передача на исправление программисту.      Требования:      Опыт настройки/поддержки в роли консультанта или старшего консультанта SAP EHS;   Уровень владения  английским языком  не ниже  Intermediate ;   Знание стандартных процессов в области Environment, Health and Safety (EHS);   Умение читать ABAP программы простой-средней сложности (debugging) будет плюсом.      Условия:      Компания предлагает стабильную и интересную работу, возможность профессионального развития;   Изучение английского и немецкого языка;   Предоставление дополнительных отпусков;   Предоставление материальной помощи по особым случаям;   Добровольное медицинское страхование (поликлиника, стоматология) - 100% компенсация для сотрудников компании;   Компенсация питания сотрудника;   Программа компенсаций занятий спортом;   Программа награждения сотрудников за выдающиеся успехи;   Комфортный офис в  г. Воронеж и г. Краснодар;     ВОЗМОЖНА УДАЛЕННАЯ РАБОТА.    ",Полная занятость,Полный день,От 1 года до 3 лет,|SAP EHS,3.0,,1.0,90000.0,sap ehs сonsultant,Опыт настройки/поддержки в роли консультанта или старшего консультанта SAP EHS. Уровень владения английским языком не ниже Intermediate. ,Обработка заявок на 2-3 уровне поддержки (согласно ITIL). Разрешение инцидентов и проблем в системе SAP клиента. Участие в разработках...,0.13333333333333333,1,0,1,0,0,0,0,0,0,1,0,1,0,0,0,0,0,1,0,0,0,0,0,0,0,0,0,0,0,1,1
Екатеринбург,Атос АйТи Солюшенс энд Сервисез,2019-12-06T11:58:32+0300,"  Обязанности:        Работа в проекте 3 уровня поддержки (работа над решением инцидентов, реализация запросов на изменения);           Возможно участие в проектах внедрения.        Требования:        Опыт работы c ABAP (+Solman) от 1 года;       Владение английским – и\или немецким - языком Pre Intermediate и выше;       Проактивность, ответственность.        Условия:       Возможность дистанционной/удаленной работы (home office);    Компания предлагает стабильную и интересную работу, возможность профессионального развития;   Предоставление дополнительных отпусков;   Предоставление материальной помощи по особым случаям;   Добровольное медицинское страхование (поликлиника, стоматология) - 100% компенсация для сотрудников компании;   Компенсация питания сотрудника;   Программа компенсаций занятий спортом;   Программа награждения сотрудников за выдающиеся успехи.   ",Полная занятость,Полный день,От 1 года до 3 лет,,3.0,,1.0,90000.0,sap abap solman разработчик,"Опыт работы c ABAP (+Solman) от 1 года. Владение английским – и\или немецким - языком Pre Intermediate и выше. Проактивность, ответственность.","Работа в проекте 3 уровня поддержки (работа над решением инцидентов, реализация запросов на изменения). Возможно участие в проектах внедрения.",0.23333333333333334,1,0,1,0,0,0,0,0,0,1,0,1,0,0,0,0,0,1,0,0,0,0,0,0,0,0,0,0,0,0,0
Екатеринбург,Альфа-Банк,2019-11-19T07:34:08+0300," Работа в Альфа-Банке – для тех, кто привык действовать!   Альфа-Банк дает вам отличные возможности для повышения эффективности и результативности. Мы ценим таланты, поэтому активно способствуем личному и профессиональному развитию.    Обязанности:      Участие в проектах внедрения и развития систем;   Разработка архитектурных и технических решений;   Анализ ошибок, оптимизация программ;   Документирование разработок.     Требования:     Отличное знание технологий объектно-ориентированного программирования в ABAP;   Опыт работы с технологиями расширений стандартной функциональности: Customer-Exits, BAdi, Enhancements;   Желание развиваться в новых технологиях.   Опыт разработки Web приложений на SAP Web Dynpro (желательно);   Опыт разработки Web приложений на SAP UI5 (желательно);   Опыт разработки под модуль HR (желательно);     Условия:     Официальное оформление;   Достойная заработная плата;   Годовая премия в соответствии с правилами премирования сотрудников Банка по итогам оценки результативности за год;   ДМС;   Льготные условия на услуги Банка и компаний–партнеров;   Работа в позитивном сплоченном коллективе;   Лояльный dress-code.   ",Полная занятость,Полный день,Нет опыта,|SAP|ABAP,,,,90000.0,разработчик sap abap,"Отличное знание технологий объектно-ориентированного программирования в ABAP. Опыт работы с технологиями расширений стандартной функциональности: Customer-Exits, BAdi, Enhancements. ","Участие в проектах внедрения и развития систем. Разработка архитектурных и технических решений. Анализ ошибок, оптимизация программ. Документирование разработок.",0.8,1,0,1,0,0,0,0,0,1,0,0,1,0,0,0,0,0,1,0,0,0,0,0,0,0,0,0,0,0,1,1
