city,company-name,date,description,employment-form,employment-schedule,experience,key_skills,max-experience,max-salary,min-experience,min-salary,name,requirements,responsibilities,days_from_publish,min-salary-group,max-salary-group,city: Екатеринбург,city: Казань,city: Москва,city: Новосибирск,city: Санкт-Петербург,experience: Более 6 лет,experience: Нет опыта,experience: От 1 года до 3 лет,experience: От 3 до 6 лет,employment-form: Полная занятость,employment-form: Проектная работа,employment-form: Стажировка,employment-form: Частичная занятость,employment-schedule: Вахтовый метод,employment-schedule: Гибкий график,employment-schedule: Полный день,employment-schedule: Сменный график,employment-schedule: Удаленная работа,администрирование серверов windows,администрирование сетевого оборудования,linux,настройка сетевых подключений,windows 7,active directory,настройка пк,tcp/ip,настройка по,dhcp,other
Екатеринбург,Уральский центр систем безопасности,2019-12-09T23:25:46+0300,"  Администратор проектного офиса    Основные задачи Администратора проектного офиса – осуществлять общий контроль текущего состояния проектов и обеспечивать информационную, методологическую и организационную поддержку руководителей проектов, в частности:     Контролировать текущее состояние активных проектов, полноты и актуальности имеющихся по ним данных.   Формировать и предоставлять периодическую и по запросу отчетность по проектной деятельности.   Оказывать руководителям проектов помощь в правильной организации процесса управления проектами и иных связанных производственных процессов компании, в том числе обеспечивать консультационную поддержку по работе с информационными системами.   Обеспечивать накапливание и хранение всей необходимой информации и документации по проекту в ходе его реализации и после завершения, контролировать состояние архива.   Участвовать в рабочих встречах по проекту, обеспечивать составление протоколов и контроль выполнения решений, закрепленных в нем.   Участвовать в разработке и улучшении методологии управления проектами, разрабатывать соответствующую нормативно-справочную документацию (инструкции, памятки).   Формировать требования к доработке корпоративных информационных систем по автоматизации тех или иных аспектов деятельности в ходе реализации проекта.     Обращаем внимание, что реализация проекта  не  входит в задачи Администратора проектного офиса.    Наши требования:      Высшее образование.   Склонность и интерес к систематизации, обработке больших объемов информации.   Хорошее знание офисного пакета MS Office (Word, Excel, Microsoft Project).   Аналитический склад ума (это важно!).   Грамотность.   Позитивное отношение к людям, желание развиваться и развивать.      Плюсами будут:      Знание принципов управления проектами, основанных на классическом подходе (PMBoK).   Опыт работы с системами автоматизации бизнес-процессов (1С, OMNITRACKER).   Опыт работы в роли помощника руководителя проектов или аналогичной должности.   Умение и желание передавать информацию и обучать пользователей.      Мы предлагаем:      Развитие вашего профессионализма:    интересные разноплановые задачи, возможность развития компетенций для профессионального развития;   профильное обучение за счет компании;   возможность реализации Ваших предложений и инициатив.       Мы поддерживаем здоровый образ жизни и веселый отдых    корпоративные занятия спортом (бассейн, фитнес, скалодром, а также компенсация самостоятельных занятий спортом);   веселый, активный коллектив, многочисленные корпоративные мероприятия, в том числе выезды на горнолыжные курорты области, походы, сплавы и другое.       Мы обеспечиваем уверенность в завтрашнем дне и комфорт:    удобный современный офис, комфортное рабочее место, оборудованное «умной» техникой и ПО;   компенсация ДМС;   официальное трудоустройство в соответствии с требованиями ТК РФ, всегда своевременная выплата заработной платы. Уровень оплаты труда обсуждается на собеседовании, в зависимости от имеющихся навыков кандидата.       ",Полная занятость,Полный день,От 1 года до 3 лет,,3.0,45000.0,1.0,35000.0,администратор проектного офиса,"Высшее образование. Склонность и интерес к систематизации, обработке больших объемов информации. Хорошее знание офисного пакета MS Office (Word, Excel, Microsoft...","Основные задачи Администратора проектного офиса – осуществлять общий контроль текущего состояния проектов и обеспечивать информационную, методологическую и организационную поддержку руководителей проектов...",0.13333333333333333,0,0,1,0,0,0,0,0,0,1,0,1,0,0,0,0,0,1,0,0,0,0,0,0,0,0,0,0,0,0,0
Екатеринбург,СИТИЛИНК,2019-12-04T12:42:03+0300,"  Наши пожелания:    - Среднее специальное/высшее техническое образование; - Опыт работы в данной должности от 1 года; - Знание основ терминального доступа (MS, Citrix); - Знание администрирования.    Ваши обязанности:    - Поддержка ОС Windows; - Создание удалённого доступа; - Поддержание работоспособности локальной сети, оргтехники, торгового оборудования; - Консультирование сотрудников.    Мы предлагаем:    - График 2/2 c 09:00-21:00 ТЦ Свердловск, с 10:00-22:00 ТЦ ФанФан. - Оформление по ТК РФ. - Стабильная выплата заработной платы. - Корпоративное обучение. - Место работы ТЦ Свердловск, ТЦ ФанФан. ",Полная занятость,Сменный график,От 1 года до 3 лет,|Windows Xp|Windows 7|Cистемы управления базами данных,3.0,32000.0,1.0,30000.0,системный администратор,"Среднее специальное/высшее техническое образование. - Опыт работы в данной должности от 1 года. - Знание основ терминального доступа (MS, Citrix). - ","Поддержка ОС Windows. - Создание удалённого доступа. - Поддержание работоспособности локальной сети, оргтехники, торгового оборудования. - Консультирование сотрудников.",0.3,0,0,1,0,0,0,0,0,0,1,0,1,0,0,0,0,0,0,1,0,0,0,0,0,1,0,0,0,0,0,1
Екатеринбург,ПромСредМаш,2019-11-19T06:56:53+0300," Обязанности:   - Администрирование локальной сети организации   - Администрирование серверов   - Установка программного обеспечения, конфигурации системы на сервере, поддержка рабочего состояния сервера, рабочих станций и сетевого оборудования ( маршрутизаторы, модемы, коммуникаторы и др.)   - Установка, настройка и сопровождение бухгалтерских программ  Требования:   - Опыт работы от 1 года в должности   - Знание ОС Windows, Linux   - Опыт работы с серверным оборудованием   - Опыт администрирования 1С   - Исполнительность, ответственность, стрессоустойчивость  Условия:   - Трудоустройство согласно ТК РФ   - Белая заработная плата   - График работы 5/2 с 8.30 до 17.30 ",Полная занятость,Полный день,От 1 года до 3 лет,|Администрирование серверов Windows|Администрирование серверов Linux|Linux|Администрирование сетевого оборудования|Настройка сетевых подключений,3.0,35000.0,1.0,30000.0,ведущий системный администратор,"Опыт работы от 1 года в должности. - Знание ОС Windows, Linux. - Опыт работы с серверным оборудованием. - Опыт администрирования 1С. - ","Администрирование локальной сети организации. - Администрирование серверов. - Установка программного обеспечения, конфигурации системы на сервере, поддержка рабочего состояния сервера, рабочих станций и...",0.8,0,0,1,0,0,0,0,0,0,1,0,1,0,0,0,0,0,1,0,0,1,1,1,1,0,0,0,0,0,0,1
Екатеринбург,Завод УРБО,2019-12-09T06:20:22+0300," Обязанности:       Администрирование серверов на базе OC Windows Server 2000- 2019   Ведение корпоративного каталога (AD)-1000 пользователей, формирование доменных политик.       Администрирование Exchange 2010, SCCM, SCOM, SQL, TMG,       Администрирование серверов 1C       Антивирусная защита, Kaspersky Security Center, Администрирование VMware vSphere       Резервное копирование       Администрирование телекоммуникационного оборудования Cisco, IP телефонии       Обслуживание парка серверов, Поддержка пользователей,       Небольшие монтажные работы по СКС.       Требования:       Опыт работы на крупном предприятии с кол-вом пользователей от 500 человек. Территориально распределенные предприятия.     AD, Exchange 2010, Skype for Business, Kaspersky Security Center, Cisco, серверная часть 1С.     Условия:     График работы с 8.00 до 17.00, пятидневка   ДМС   Возможность карьерного роста.   ",Полная занятость,Полный день,От 1 года до 3 лет,,3.0,46800.0,1.0,45000.0,ведущий системный администратор,"Опыт работы на крупном предприятии с кол-вом пользователей от 500 человек. Территориально распределенные предприятия. AD, Exchange 2010, Skype for...","Администрирование серверов на базе OC Windows Server 2000- 2019. Ведение корпоративного каталога (AD)-1000 пользователей, формирование доменных политик. ",0.13333333333333333,0,0,1,0,0,0,0,0,0,1,0,1,0,0,0,0,0,1,0,0,0,0,0,0,0,0,0,0,0,0,0
Екатеринбург,ГБУЗ Свердловский областной онкологический диспансер,2019-12-10T12:32:20+0300," Обязанности:     самостоятельно работает на основе уверенного знания основных параметров, требований, правил установки, способов выявления и устранения неполадок сетевых операционных систем и пользовательских сред   конфигурирует и оптимизирует сеть и сервер с учетом возможностей компании   обеспечивает бесперебойную работу сервера, сети и персональных компьютеров   устанавливает на серверы, рабочие станции и персональные компьютеры пользовательские программы и сетевые программы      Требования:      Администрирование серверов на базе Windows /2008/2012 (AD, DNS, GPO).   Настройка активного сетевого оборудования D-Link, HP, Cisco (Маршрутизация, VLAN, STP, SNMP).   Обслуживание систем виртуализации Hyper-V, VMWare.   Опыт настройки компьютерной техники для работы по сети и/ или в терминальном режиме.   Опыт работы с Active Directory, Terminal Services           ",Полная занятость,Полный день,От 3 до 6 лет,,6.0,43348.3870967742,3.0,45000.0,системный администратор,"Самостоятельно работает на основе уверенного знания основных параметров, требований, правил установки, способов выявления и устранения неполадок сетевых операционных систем и...","Конфигурирует и оптимизирует сеть и сервер с учетом возможностей компании. Обеспечивает бесперебойную работу сервера, сети и персональных компьютеров. ",0.1,0,0,1,0,0,0,0,0,0,0,1,1,0,0,0,0,0,1,0,0,0,0,0,0,0,0,0,0,0,0,0
Екатеринбург,Филиал «Мегамарт» АО Дикси Юг,2019-11-26T07:56:59+0300," Мегамарт - это уральское отделение федеральной торговой сети Дикси, входит в топ 5 крупнейших сетей России. По итогам народной премии УрФО-2017 и 2018, Мегамарт стал победителем в номинации «Супермаркет года». На сегодняшний день в нашей компании работает более 5000 сотрудников.    Обязанности:      взаимодействие и поддержка пользователей ТЦ;   настройка ПО;   настройка и поддержание работоспособности торгового оборудования (кассы, весы, ТСД);   настройка и поддержание работоспособности компьютерного оборудования и оргтехники (ПК, тонкие клиенты, МФУ, принтеры, факсы, телефоны);   знание Active Directory, поддержание работоспособности серверного оборудования;   ежемесячная подготовка отчетов, взаимодействие с ЦО по кассовому и весовому оборудованию.         Требования:     образование от средне-специального, специализация : IT технологии;   опыт не менее полугода;   знание компьютерных программ: стандартное ПО, Windows Server 2008, основы Linux.     Условия:   Мы гарантируем:     график работы: пн- пт, с 9.00 до 18.00;   оформление в соответствии с Трудовым законодательством РФ с первого рабочего дня;   полный социальный пакет (официальная заработная плата, оплачиваемые отпуска, больничные);   своевременная выплата заработной платы (2 раза в месяц);   скидка 10% на покупки в сети Мегамарт.     Мы предоставляем возможности:     бесплатное корпоративное обучение (тренинги, конференции и т.д.);   профессиональный и карьерный рост;   насыщенная корпоративная культура;   работа в дружном коллективе.   Дари радость приятной покупки вместе с нами!   ",Полная занятость,Полный день,От 1 года до 3 лет,,3.0,35000.0,1.0,35976.52272727273,администратор сетей и коммуникаций,"Образование от средне-специального, специализация : IT технологии. Опыт не менее полугода. Знание компьютерных программ: стандартное ПО, Windows Server 2008, основы...","Взаимодействие и поддержка пользователей ТЦ. Настройка ПО. Настройка и поддержание работоспособности торгового оборудования (кассы, весы, ТСД). Настройка и поддержание работоспособности...",0.5666666666666667,0,0,1,0,0,0,0,0,0,1,0,1,0,0,0,0,0,1,0,0,0,0,0,0,0,0,0,0,0,0,0
Екатеринбург,GDC (ICL Services),2019-11-18T12:28:50+0300," Наша компания обеспечивает работоспособность сетевой инфраструктуры (сети Дата Центров и Корпоративные сети) больших международных компаний.    Что будем делать:      Устранять неисправности в сетевой инфраструктуре наших клиентов (решение инцидентов).   Администрировать сетевое оборудование (Routers, Switches, Load Balancers, Wireless AP and Controllers, Firewalls, VPN devices, Cloud network appliances (firewall, router), etc.   Участвовать в проектах по модернизации сетевой инфраструктуры.      Что мы ожидаем от вас:      Знать и иметь практический опыт работы с сетевыми технологиями и протоколами (Уровень Cisco CCNP И/ИЛИ опыт работы с сетевыми технологиями 3-5 лет):    Network Fundamentals (network topology architectures, TCP, UDP, IPv4, etc.)   Routing &amp; Switching (RSTP+, LACP, OSPF, BGP/MP-BGP, FHRP, etc.)   Network security (Firewalls, VPN (IpSec), etc.)   Wireless networks (WLAN Fundamentals)       Практический опыт работы с Linux (в CLI)   Практический опыт работы с системами виртуализации (VmWare иди др.)   Практический опыт в области автоматизации управления сетевой инфраструктурой – скрипты (Bash, Python), Ansible и пр.   Уровень владения английским: от  intermediate  (письменный, устный). Не бояться вести разговор с native speaker коллегами и представителями заказчика.      Что мы за это предлагаем:     Выплаты и бонусы:      13 зарплата.   Бонус к отпуску и значимым событиям (свадьба, рождение детей).   Компенсация процентов по ипотеке и беспроцентная ссуда.   ДМС со стоматологией.   Компенсация спорта. Скидки в фитнес-клубах.     При переезде выплатим подъемные.    Условия труда:        Современный офис с тренажерами, office kitchens и банкоматами.       Столовые в офисах и скидки на питание.        Обучение и карьера:      Вендорное обучение и сертификация за счет компании.   Обучение английскому и общение с иностранными заказчиками.   Возможность участия в техническом и управленческом кадровом резерве.      Экология и благотворительность:      Помогаем детским домам, школам, приютам для животных.   Озеленяем город, бережем ресурсы.   Поддерживаем социальные инициативы сотрудников.      Возможен удаленный формат работы  ",Полная занятость,Полный день,От 3 до 6 лет,,6.0,43348.3870967742,3.0,35976.52272727273,старший системный администратор,Знать и иметь практический опыт работы с сетевыми технологиями и протоколами (Уровень Cisco CCNP И/ИЛИ опыт работы с сетевыми...,"Устранять неисправности в сетевой инфраструктуре наших клиентов (решение инцидентов). Администрировать сетевое оборудование (Routers, Switches, Load Balancers, Wireless AP and Controllers...",0.8333333333333334,0,0,1,0,0,0,0,0,0,0,1,1,0,0,0,0,0,1,0,0,0,0,0,0,0,0,0,0,0,0,0
