city,company-name,date,description,employment-form,employment-schedule,experience,key_skills,max-experience,max-salary,min-experience,min-salary,name,requirements,responsibilities,days_from_publish,min-salary-group,max-salary-group,city: Екатеринбург,city: Казань,city: Москва,city: Новосибирск,city: Санкт-Петербург,experience: Более 6 лет,experience: Нет опыта,experience: От 1 года до 3 лет,experience: От 3 до 6 лет,employment-form: Полная занятость,employment-form: Проектная работа,employment-form: Стажировка,employment-form: Частичная занятость,employment-schedule: Вахтовый метод,employment-schedule: Гибкий график,employment-schedule: Полный день,employment-schedule: Сменный график,employment-schedule: Удаленная работа,администрирование серверов windows,администрирование сетевого оборудования,linux,настройка сетевых подключений,windows 7,active directory,настройка пк,tcp/ip,настройка по,dhcp,other
Казань,GDC (ICL Services),2019-11-30T10:56:34+0300,"  Чем предстоит заниматься:      выполнение изменений по запросам заказчиков (миграции, обновления, внесение изменений в серверную инфраструктуру и инфраструктуру хранения данных), 2-я и 3-я линия поддержки;   работа с системами инцидентов (документирование действий, решение проблем в обозначенные сроки);   составление технической документации;   участие в передаче новых сервисов.   установка и конфигурирование корпоративных систем обмена сообщениями и электронной почты;   работа с системами централизованного управления и мониторинга ИТ-инфраструктуры;   настройка и сопровождение сетей хранения данных, систем хранения данных;   настройка и мониторинг резервного копирования;   сопровождение систем виртуализации пользовательского окружения;   работа с системами виртуализации – настройка, создание виртуальных машин и сетей, решение проблем;   автоматизация выполняемых задач с помощью Powershell и другими инструментами      Что мы ждём от Вас:      уверенные знания и опыт сопровождения систем Microsoft управления и мониторинга ИТ-инфраструктуры (SCCM, SCOM), сертификаты приветствуются;   опыт работы с виртуализацией VMWare (Datacenter Virtualization, NSX);   большой опыт работы с MS Exchange, Skype for Business (Lync), Sharepoint, сертификаты приветствуются;   опыт работы с СХД Huawei, SAN Brocade, системами резервного копирования (CommVault, Tivoli);   имеющийся опыт работы с Citrix будет плюсом;   опыт автоматизации (скриптинга) при решении задач (Powershell);   английский язык:  Intermediate ;   системное мышление, коммуникабельность, целенаправленность, оперативность;   желание обучаться по разным техническим направлениям, умение работать в команде.      Что мы за это предлагаем     Выплаты и бонусы:      квартальные бонусы и 13 зарплата;   бонус к отпуску и значимым событиям (свадьба, рождение детей);   компенсация процентов по ипотеке и беспроцентная ссуда;   ДМС со стоматологией;   компенсация спорта. Скидки в фитнес-клубах;   при переезде предоставим квартиру на первое время или выплатим подъемные;      Условия труда:      современный офис с тренажерами, office kitchens и банкоматами;   столовые в офисах и скидки на питание.      Обучение и карьера:      вендорное обучение и сертификация за счет компании;   обучение английскому и общение с иностранными заказчиками;   возможность участия в техническом и управленческом кадровом резерве.      Экология и благотворительность:      помогаем детским домам, школам, приютам для животных;   озеленяем город, бережем ресурсы;   поддерживаем социальные инициативы сотрудников.       Трудоустройство в г. Казань, необходима релокация.   ",Полная занятость,Полный день,От 3 до 6 лет,,6.0,51285.714285714275,3.0,39136.36363636364,ведущий системный администратор,"Уверенные знания и опыт сопровождения систем Microsoft управления и мониторинга ИТ-инфраструктуры (SCCM, SCOM), сертификаты приветствуются. Опыт работы с виртуализацией...","Выполнение изменений по запросам заказчиков (миграции, обновления, внесение изменений в серверную инфраструктуру и инфраструктуру хранения данных), 2-я и 3...",0.43333333333333335,0,0,0,1,0,0,0,0,0,0,1,1,0,0,0,0,0,1,0,0,0,0,0,0,0,0,0,0,0,0,0
Казань,GDC (ICL Services),2019-11-21T10:02:08+0300," Привет!   С нами ты поработаешь с зарубежными компаниями, проникнешь во все секреты Linux/Unix (от Ubuntu до серьезных промышленных систем) и окончательно убедишь всех что Windows must die. А заодно доведешь свой английский до совершенства. Тебя ждет: весёлая, креативная компания коллег-единомышленников, множество корпоративных праздников, плюшек от компании и обучающих курсов на любой вкус.   Если ты хочешь работать и развиваться в направлении UNIX (и не только) и знаешь английский, откликайся!   О нас можно узнать по тегу #ICLServices и #ICLSприятное    Что будем делать:      Удалённое администрирование серверов заказчика, работающих под управлением Linux/Unix.   Удалённое администрирование инфраструктурных приложений (DNS, DHCP, Proxy, FTP, NFS/CIFS), web-сервисов.   Решение инцидентов, устранение неисправностей.   Разворачивание и настройка операционных систем в удалённой инфраструктуре.   Разработка автоматизированных систем на базе Ansible, Salt, Python и пр.      Что мы от вас ждем:      Английский на уровне «понять проблемы зарубежного заказчика и помочь ему»   Уметь администрировать Linux/Unix и инфраструктурные приложения из списка выше   Понимать принципы работы компьютерных сетей и сетевых протоколов.   Иметь опыт написания shell-скриптов.   Желательно: знакомство с ITIL и сертификаты по Linux/Unix.           Что мы за это предлагаем        Выплаты и бонусы:      13 зарплата;   бонус к отпуску и значимым событиям (свадьба, рождение детей);   компенсация процентов по ипотеке и беспроцентная ссуда;   ДМС со стоматологией;   компенсация спорта. cкидки в фитнес-клубах;   при переезде предоставим квартиру на первое время или выплатим подъемные.         Условия труда:      современный офис с тренажерами, office kitchens и банкоматами;   столовые в офисах и скидки на питание.         Обучение и карьера:      вендорное обучение и сертификация за счет компании;   обучение английскому и общение с иностранными заказчиками;   возможность участия в техническом и управленческом кадровом резерве.         Экология и благотворительность      помогаем детским домам, школам, приютам для животных;   озеленяем город, бережем ресурсы;   поддерживаем социальные инициативы сотрудников.         Про наш офис - по тегу #GDCusady ",Полная занятость,Полный день,От 3 до 6 лет,|Администрирование серверов Linux|Linux|Unix|Настройка DNS|DHCP|Http Proxy|Python|Английский язык,6.0,51285.714285714275,3.0,39136.36363636364,системный администратор,Английский на уровне «понять проблемы зарубежного заказчика и помочь ему». Уметь администрировать Linux/Unix и инфраструктурные приложения из списка выше. ,"Удалённое администрирование серверов заказчика, работающих под управлением Linux/Unix. Удалённое администрирование инфраструктурных приложений (DNS, DHCP, Proxy, FTP, NFS/CIFS), web...",0.7333333333333333,0,0,0,1,0,0,0,0,0,0,1,1,0,0,0,0,0,1,0,0,0,0,1,0,0,0,0,0,0,1,1
Казань,GDC (ICL Services),2019-12-08T10:57:59+0300,"  Чем предстоит заниматься:      Проектными работами (внедрение, миграции, обновления, реорганизация инфраструктуры и т.д.);   Консультированием и наставничеством (для младших инженеров);   Оптимизацией и автоматизацией текущей инфраструктуры;   Мониторингом инфраструктуры заказчика для выявления возможных проблем;   Составлением различной технической документации;   Внутренними стратегическими задачами;   Потенциально расти до архитектора или до ведущего инженера.      Что мы ждём от Вас :     Знания на профессиональном уровне систем виртуализации: Microsoft Hyper-V, VMware vSphere, XenServer, знания платформы OpenStack – будет плюсом;   Опыт внедрения/конфигурирования/обслуживания/миграции систем управления vCenter, SCVVM;   Опыт внедрения/конфигурирования/обслуживания VMware NSX будет плюсом;   Опыт работы с системами резервного копирования корпоративного уровня будет плюсом (Veeam, Veritas/Symantec, Networker, Tivoli и т.д.);   Опыт работы с системами мониторинга VMware vRealize Log Insight, Zabbix и др.;   Опыт внедрения/конфигурирования/обслуживания VMware vCloud Suite будет плюсом;   Знание сетевые технологий и протоколов: TCP/IP, OSI;   Опыт работы с технологиями систем хранения vSAN, SAN, iSCSI, NAS, DAS;   Английский язык: работа с технической документацией;   Системное мышление, коммуникабельность, целенаправленность, оперативность;   Желание обучаться по разным техническим направлениям, умение работать в команде.      Что мы за это предлагаем     Выплаты и бонусы:      13 зарплата;   бонус к отпуску и значимым событиям (свадьба, рождение детей);   компенсация процентов по ипотеке и беспроцентная ссуда;   ДМС со стоматологией;   компенсация спорта. Скидки в фитнес-клубах;   при переезде выплатим подъемные;      Условия труда:      современный офис с тренажерами, office kitchens и банкоматами;   столовые в офисах и скидки на питание.      Обучение и карьера:      вендорное обучение и сертификация за счет компании;   обучение английскому и общение с иностранными заказчиками;   возможность участия в техническом и управленческом кадровом резерве.      Экология и благотворительность:      помогаем детским домам, школам, приютам для животных;   озеленяем город, бережем ресурсы;   поддерживаем социальные инициативы сотрудников.      Трудоустройство в    г. Казань, возможна удаленная работа.    ",Полная занятость,Полный день,От 3 до 6 лет,,6.0,51285.714285714275,3.0,39136.36363636364,старший системный администратор,"Знания на профессиональном уровне систем виртуализации: Microsoft Hyper-V, VMware vSphere, XenServer, знания платформы OpenStack – будет плюсом. Опыт внедрения/конфигурирования...","Проектными работами (внедрение, миграции, обновления, реорганизация инфраструктуры и т.д.). Консультированием и наставничеством (для младших инженеров). Оптимизацией и автоматизацией текущей...",0.16666666666666666,0,0,0,1,0,0,0,0,0,0,1,1,0,0,0,0,0,1,0,0,0,0,0,0,0,0,0,0,0,0,0
Казань,Компания ПЭК,2019-12-10T16:54:45+0300,"  Обязанности:      Установка‚ настройка ПО на рабочих станциях пользователей;   Настройка периферийного оборудования‚ в том числе используемого складами;   Консультации‚ решение вопросов и проблем пользователей при работе с ПО‚ диагностика‚ устранение ошибок или эскалация в службу администрирования и/или службу поддержки приложений;   Небольшой ремонт рабочих станций‚ принтеров и прочей оргтехники.Контроль внешнего вида рабочих мест. Регулярное проведение чистки от пыли рабочих мест (в особенности на складах).   Проверка термопринтеров на складах Проверка работоспособности термопринтера Datamax см. инструкцию.   Контроль внешнего состояния серверного помещения и серверного и коммуникационного оборудования. При сильном засорении и загрязнении проводить чистку поверхностей и корпусов (к примеру, пылесосить передние решетки серверов).   Проверка состояния ИБП и батарей. Оповещение о плохом состоянии ИБП куратора филиала в Москве.   Проверка схем подключений всего серверного и коммуникационного оборудования (строго через ИБП – подключается крестом к серверам, каждый сервер имеет 2 блока питания – один блок питания подключается к одному ИБП, второй блок питания подключается ко второму ИБП, аналогично каждый сервер).   Установка, проверка установки и расположения серверного и коммуникационного оборудования в серверном шкафу филиала согласно схеме расположения серверного оборудования.      Требования:      Опыт работы в поддержке от года;   Знание OS Windows на уровне уверенного пользователя (XP‚ Win7‚ W2k3 Srv‚ Win2k8)‚ а также знание продуктов линейки MS Office;   Знание складского оборудования как преимущество (ТСД‚ печать этикеток‚ принципы работы устройств и особенности подключений);   Умение работать в команде‚ умение расставлять приоритеты в задачах.      Предлагаем:      З/п 35 000 руб.   График работы 5/2 с 9.00 до 18.00.   Оплачиваемый отпуск 28 календарных дней     Всего: 55 рабочих станций + 3 сервера   В г. Казань 4 офиса, основной где будет базироваться ИТ сотрудник, находится по адресу Тихорецкая 19,   А также необходимо будет вести филиал г. Зеленодольск(4 рабочие станции).         ",Полная занятость,Полный день,От 1 года до 3 лет,|Ремонт ПК|Настройка ПК|Техническая поддержка|Расстановка приоритетов,3.0,35000.0,1.0,39136.36363636364,системный администратор,Опыт работы в поддержке от года. Знание OS Windows на уровне уверенного пользователя (XP‚ Win7‚ W2k3...,Установка‚ настройка ПО на рабочих станциях пользователей. Настройка периферийного оборудования‚ в том числе используемого складами. Консультации‚ решение вопросов и проблем...,0.1,0,0,0,1,0,0,0,0,0,1,0,1,0,0,0,0,0,1,0,0,0,0,0,0,0,0,1,0,0,0,1
Казань,Grid Dynamics,2019-12-02T13:07:18+0300," Our teams is a great place for people with exacting standards who want their work to matter.   We’re looking for a Release/DevOps Engineer who will be responsible for managing the release pipeline that fuels development at our company. This person will be directly supporting the development and content teams that are creating and publishing content to one of world most trafficked websites. The ideal candidate is someone who has worked in a build/release role previously, has strong communication skills, and who knows how to handle the unexpected.    Scope of Duties and Responsibilities    Education and Experience     Experience managing Jenkins in a highly automated environment.   Experience managing and administering an SCM (e.g. SVN/Git)   Python, Bash, Groovy scripting experience.   Experience supporting Node.js/Javascript development is desirable but not required.   Experience managing and configuring web servers (e.g. Apache/nginx)   B.S. in Computer Science or equivalent.     Proven Skills and Abilities     Minimum of 5 years of professional software development experience working on complex development projects   Dedicated problem-solver who can work in a fast paced environment where multiple releases are a fact of life   Ability to size technical efforts accurately   Experience collaborating with other team members in multiple teams diagnosing and debugging complex systems, and participating in investigating build, deployment and operational issues   Knowledge of Linux stack   Experience with web application security   In depth knowledge of source version control software (Subversion, Git)   Experience collaborating with other technical teams on DevOps responsibilities for application deployment, performance, monitoring, reliability and scalability   Preferred experience with Docker, configuration management systems such as Ansible, Mesos or similar grid computing technologies, CI build tools such as Jenkins, and logging and monitoring tools like Splunk   Willingness to take the initiative to solve problems   Proven capabilities to work under pressure and tight deadlines to solve critical issues   Able to work equally well with people in creative and technical positions   Strong oral and written communicator, with good interpersonal skills; able to forge trusting     relationships within a diverse team and across organizations        What we offer:    Work in the Bay Area with terrific customers on large, innovative projects.   High-energy atmosphere of exponentially &amp; successfully growing company.   A very attractive compensation package with generous benefits (medical, dental, vision and life).        About Us:    Grid Dynamics is the engineering services company known for transformative, mission-critical cloud solutions for retail, finance and technology sectors.   We architected some of the busiest e-commerce services on the Internet and have never had an outage during the peak season.   Founded in 2006 and headquartered in San Ramon, California with offices throughout the US and Eastern Europe, we focus on big data analytics, omnichannel services, DevOps, and cloud enablement ",Полная занятость,Полный день,Более 6 лет,,,51285.714285714275,6.0,39136.36363636364,администратор engineer,Education and Experience. Experience managing Jenkins in a highly automated environment. Experience managing and administering an SCM (e.g. ,"Experience collaborating with other team members in multiple teams diagnosing and debugging complex systems, and participating in investigating build, deployment...",0.36666666666666664,0,0,0,1,0,0,0,1,0,0,0,1,0,0,0,0,0,1,0,0,0,0,0,0,0,0,0,0,0,0,0
