city,company-name,date,description,employment-form,employment-schedule,experience,key_skills,max-experience,max-salary,min-experience,min-salary,name,requirements,responsibilities,days_from_publish,min-salary-group,max-salary-group,city: Екатеринбург,city: Казань,city: Москва,city: Новосибирск,city: Санкт-Петербург,experience: Более 6 лет,experience: Нет опыта,experience: От 1 года до 3 лет,experience: От 3 до 6 лет,employment-form: Полная занятость,employment-form: Проектная работа,employment-form: Стажировка,employment-form: Частичная занятость,employment-schedule: Вахтовый метод,employment-schedule: Гибкий график,employment-schedule: Полный день,employment-schedule: Сменный график,employment-schedule: Удаленная работа,администрирование серверов windows,администрирование сетевого оборудования,linux,настройка сетевых подключений,windows 7,active directory,настройка пк,tcp/ip,настройка по,dhcp,other
Санкт-Петербург,Газпром нефть,2019-11-27T09:20:42+0300," В дочерней компании АО Газпромнефть открыта позиция Администратора программ:    Обязанности:       Жизнеобеспечение офиса, закупка необходимых материалов;   Координирование процессов согласования и выхода на работ новых сотрудников;   Ведение табелей учета рабочего времени проектной команды;   Подготовка отчетов, презентаций по проектам, в том числе для топ-менеджмента компании   Координация и организация коммуникаций проектной команды;   Документационное сопровождение внутренних процессов;   Ведение проекта в информационной системе управления проектами;   Исполнение подготовки календарных планов проектов;   Мониторинг хода реализации проектов;   Сбор и внесение информации о фактическом выполнении работ;   Организация процесса согласования и подписания документов по проекту;   Организация совещаний с функциональными руководителями, руководителями проектов и представителями заказчика, ведение протокола.      Требования:      Высшее образование;   Релевантный опыт;   Опыт создания презентаций и готовность показать примеры;   Грамотная и четкая устная речь, грамотное письмо;   Понимание сферы ИТ и желание развиваться внутри;   Владение пакетом MS Office (Visio, Word, Excel, Power Point);   Исполнительность;   Умение работать над несколькими задачами, организовывать свою работу с учетом приоритетов.      Условия:      Работа в стабильной, развивающейся компании;   Перспектива профессионального роста, возможность обучения;   Интересные проекты в сфере ИТ;   Премирование по итогам года;   ДМС, страхование жизни;   Уровень заработной платы обсуждается по итогам собеседования.   ",Полная занятость,Полный день,От 1 года до 3 лет,,3.0,53276.190476190466,1.0,49185.18518518518,администратор программ проектного офиса [id 15028],"Высшее образование. Релевантный опыт. Опыт создания презентаций и готовность показать примеры. Грамотная и четкая устная речь, грамотное письмо. ","Жизнеобеспечение офиса, закупка необходимых материалов. Координирование процессов согласования и выхода на работ новых сотрудников. Ведение табелей учета рабочего времени проектной...",0.5333333333333333,0,0,0,0,0,0,1,0,0,1,0,1,0,0,0,0,0,1,0,0,0,0,0,0,0,0,0,0,0,0,0
Санкт-Петербург,"МАГНИТ, Розничная сеть",2019-11-25T17:51:50+0300,"   Мультиформатная розничная сеть «Магнит»- крупнейший работодатель России.        Мы приглашаем к сотрудничеству профессионалов, готовых развиваться с Компанией. Вместе мы ставим амбициозные цели и достигаем успеха!       В нашу команду в городе Санкт-Петербург требуется Системотехник.              Функционал:      монтаж, ремонт, обслуживание локальных сетей, ПК, оргтехники и торгового оборудования в офисе и магазинах компании;   техническая поддержка пользователей;   разъездной характер работы (в пределах г. Санкт-Петербург и Колпино)      Нами приветствуется:      опыт администрирования сетей под управлением MS Windows (установка, настройка, администрирование);   опыт настройки почтовых и офисных программ, умение консультировать в телефонном режиме;   опыт монтажа локально-вычислительных сетей;   знание Linux будет Вашим преимуществом.      Мы предлагаем:        официальное трудоустройство с первого рабочего дня, все гарантии ТК РФ;       официальная заработная плата;       обучение и повышение квалификации за счет компании;       достойные задачи; возможность проявления инициативы;       возможность карьерного роста;       возможность перевода внутри страны;       компенсация ГСМ;       компенсация мобильной связи;       удобное расположение офиса (в шаговой доступности от метро);       возможность участия в корпоративных пенсионных программах.         Большая компания – большие возможности!       Расти вместе с нами!   ",Полная занятость,Полный день,От 1 года до 3 лет,|Ремонт ПК|Настройка ПК|Выездное обслуживание|Техническое обслуживание,3.0,58800.0,1.0,49000.0,системный администратор,"Опыт администрирования сетей под управлением MS Windows (установка, настройка, администрирование). Опыт настройки почтовых и офисных программ, умение консультировать в телефонном...","Монтаж, ремонт, обслуживание локальных сетей, ПК, оргтехники и торгового оборудования в офисе и магазинах компании. Техническая поддержка пользователей. ",0.6,0,0,0,0,0,0,1,0,0,1,0,1,0,0,0,0,0,1,0,0,0,0,0,0,0,0,1,0,0,0,1
Санкт-Петербург,Selectel,2019-12-11T12:01:46+0300,"  Приглашаем младшего системного администратора в команду проекта CDN.    Selectel — надежный провайдер ИТ-инфраструктуры в России. За свою 11-летнюю историю Selectel заслужил доверие более 15 тысяч клиентов — от индивидуальных предпринимателей до крупных международных корпораций.   Selectel предоставляет широкую линейку инфраструктурных продуктов и услуг, как собственной разработки, так и в партнерстве с мировыми технологическими лидерами. Наша сеть насчитывает 6 современных дата-центров в Москве, Санкт-Петербурге и Ленинградской области.    На этой позиции вы будете:        Развивать и поддерживать инфраструктуру услуги CDN (Сеть доставки контента)       Улучшать системы мониторинга компонентов инфраструктуры       Использовать инструменты Puppet и Ansible для написания и инфраструктурного кода       Строить CI pipelines для разработчиков и проповедовать DevOps       Работать третьей линией техподдержки пользователей       Взаимодействовать с партнёрами CDN по тестированию новых фич, решению проблем        От вас мы ожидаем:        Продвинутые навыки работы с Linux системами: мониторинг, администрирование, обновление, резервное копирование и т.д.       Понимание идеологии CI/CD и современного жизненного цикла разработки программного обеспечения       Базовые навыки работы с Infrastructure as Code (Puppet, Ansible, Chef)       Умение работать с технической документацией на английском языке        Вашими плюсами будет:        Общие понимание принципов работы современных сетей доставки контента (CDN)       Хорошее знакомство с современными сетевыми технологиями: оверлейные сети, виртуализация сетевых функций, программная балансировка нагрузки разных уровней       Навыки программирования на Python/Go для написания патчей и поиска проблем       Участие в Open Source проектах        На собеседовании мы обсудим:        Особенности сопровождения систем, работающих в режиме 24/7       Системы управления конфигурациями       Понимание и опыт применения современных методологий разработки инфраструктурного кода, технологий CI/CD        Основные условия:        Официальное оформление, белая зарплата       Заработная плата обсуждается индивидуально с успешными кандидатами       Гибкое начало рабочего дня       Ежемесячная надбавка за некурение       Бесплатные обеды и кофе-брейки       ДМС + стоматология + офисный врач       От 50% до 100% оплаты обучения английскому (в офисе)       Бесплатные разговорные клубы с носителями       50% оплата абонемента в фитнес-клуб     Офис в 10 минутах пешком от ст. м. Московские ворота, своя авто- и велопарковка      А еще:        Полный доступ в онлайн-библиотеку       Возможность участия в конференциях по всему миру       Аренда зала для игры в баскетбол, пляжный волейбол, футбол на газоне и йога в офисе       Активные корпоративы (сноуборд, веревочный парк, квесты)       Регулярные спортивные мероприятия (турниры по пейнтболу, картингу, гонка героев и т.д.)       Походы в кино на фильмы про динозавров       Кикер и настольный теннис       Регулярные просмотры фильмов на английском языке в собственном конференц зале       Настольные игры в офисе     ",Полная занятость,Гибкий график,От 1 года до 3 лет,|Linux|Puppet|Ansible|CI/CD,3.0,53276.190476190466,1.0,49185.18518518518,junior администратор младший системный администратор в отдел сdn,"Продвинутые навыки работы с Linux системами: мониторинг, администрирование, обновление, резервное копирование и т.д. Понимание идеологии CI/CD и современного...",Развивать и поддерживать инфраструктуру услуги CDN (Сеть доставки контента). Улучшать системы мониторинга компонентов инфраструктуры. Использовать инструменты Puppet и Ansible для...,0.06666666666666667,0,0,0,0,0,0,1,0,0,1,0,1,0,0,0,0,1,0,0,0,0,0,1,0,0,0,0,0,0,0,1
Санкт-Петербург,MINE,2019-12-11T19:35:51+0300," В связи с постоянным ростом криптокорпорация MINE открывает вакансию:    Системный администратор      Рассматриваем как специалиста, так и руководителя отдела с перспективой роста в DevOps (у нас есть куда расти и развиваться в команде)     Мы предлагаем:      работу в команде молодых и амбициозных профессионалов;   возможность применения и развития своих профессиональных навыков, перспективы роста ;   офис-мансарду в уникальном здании в историческом центре Санкт-Петербурга в бизнес-центре класса &quot;А&quot;;   зоны отдыха с диванами и кофе-корнером;   пешую доступность от метро Адмиралтейская;   оплату половины стоимости паркинга &quot;У красного моста&quot;;   возможность обучения английскому и немецкому языкам в офисе на льготных условиях;   интересную и активную корпоративную жизнь (спортивные и интеллектуальные мероприятия, праздники, многие из которых уже стали традиционными);   перспективу переезда в Европу;   поддержку команды на всех этапах работы.      Мы ожидаем, что Вы:      Опыт администрирования базовых сетевых служб – Active Directory, DNS, DHCP, GPO, WSUS;   Знание и понимание основ сетей (TCP/IP, NAT, VLAN, DHCP, VPN, proxy, FireWall и прочее);   Опыт работы с виртуализацией (желательно Proxmox);   Плюсом будет являться опыт работы с почтовой системой Kerio, опыт работы с openVPN, опыт работы с почтовой системой Lotus, опыт работы с Asterisk, опыт работы с сервером 1C и Б24 также приветствуется.     В настоящее время в компании развёрнуто 6 гипервизоров ProxMox в облаке с различными виртуальными машинами, 35 рабочих мест, телефония на базе Astersk,    Что нужно будет делать :      Администрирование Windows-серверов;   Настройка VPN;   Настройка оборудования Microtic.     Возможность участвовать в интересных проектах команды, профессионально развиваться. ",Полная занятость,Полный день,От 1 года до 3 лет,|Asterisk|CRM|VPN|1С-Битрикс|Lotus|Active Directory|Настройка DNS|DHCP|GPO|WSUS|PROXMOX|FIrewall|Администрирование Kerio Winroute Firewall|Администрирование серверов Windows|Devops,3.0,53276.190476190466,1.0,80000.0,системный администратор,"Опыт администрирования базовых сетевых служб – Active Directory, DNS, DHCP, GPO, WSUS. Знание и понимание основ сетей (TCP/IP, NAT, VLAN...",Администрирование Windows-серверов. Настройка VPN. Настройка оборудования Microtic.,0.06666666666666667,1,0,0,0,0,0,1,0,0,1,0,1,0,0,0,0,0,1,0,0,1,0,0,0,0,1,0,0,0,1,1
Санкт-Петербург,Минимакс,2019-12-03T09:34:44+0300,"  Минимакс  - крупная компания федерального уровня по продаже электротехнических товаров. Уже более 25 лет мы входим в ТОП рейтинга по поставкам электротехнической продукции в России и СНГ! Приглашаем в нашу команду  Системного Администратора !   Чем нужно заниматься:      Обслуживание и развитие ЛВС   Настройка сетевого оборудования   Поддержание каналов передачи данных   Поддержка пользователей и парка ПК (ок. 200 мест)   Работа в системе Help Desk (SD).   Настройка торгового оборудования и оргтехники.      Что нужно уметь, для работы у нас:      Наличие профильного образования и опыта работы на аналогичной должности  не менее 2 лет.    Грамотно работать с КПД и IP-телефонией   Уровень владения ПК - ЭКСПЕРТ   Обязательно: знание серверов семейства Windows (XP/7/8/10),WServ/ 2008R2/2012R2   Понимание и владение адресацией, маршрутизацией, службами AD, DNS, DHCP,IIS Hyper-V и тд.   Умение профессионально работать с серверами б/д MS SQL   Обладать такими Soft Skills, как: доброжелательность в общении с пользователями; стремление понять проблему и помочь в ее решении; находчивость, нетривиальность в решении задач; высокая самоорганизованность и самообучаемость.      Что мы предлагаем Вам:      Полностью официальное оформление по ТК РФ в стабильной и уверенной компании (работаем с 1993 года!)   График работы - 5/2 (ПН.-ЧТ. с 09.00 до 17.30, ПТ. укороченный день - с 09.00 до 17.00)   Выплаты зарплаты на банковскую карту, 2 раза в месяц, точно в срок.   Месторасположение - в 10 минутах ходьбы от м. Московские ворота   Работа в сплоченном коллективе единомышленников и профессионалов.   Премии сотрудникам (по итогам работы за год)   Социальный пакет (оплата больничных, отпусков)   Предоставляется корпоративное питание.   Развитая корпоративная культура   ",Полная занятость,Полный день,От 1 года до 3 лет,|Настройка DNS|DHCP|Hyper-V|MS SQL|Helpdesk|Windows Server 2003|Windows Server 2008 R2|Windows Server 2012|Администрирование сетевого оборудования|Настройка сетевых подключений|Windows 7|Настройка ПО,3.0,53276.190476190466,1.0,49185.18518518518,системный администратор,Наличие профильного образования и опыта работы на аналогичной должности не менее 2 лет. Грамотно работать с КПД и IP-телефонией. ,Обслуживание и развитие ЛВС. Настройка сетевого оборудования. Поддержание каналов передачи данных. Поддержка пользователей и парка ПК (ок. 200 мест). ,0.3333333333333333,0,0,0,0,0,0,1,0,0,1,0,1,0,0,0,0,0,1,0,0,0,1,0,1,1,0,0,0,1,1,1
Санкт-Петербург,ПрофСостав,2019-11-28T13:14:28+0300,"   Работа с терминалами сбора данных.   Настройка и установка сетевого оборудования ( ноутбуки, ТСД, точки доступа, маршрутизаторов)      Требования :     Опыт работы с терминалами сбора данных (M3 green, M3T, MC3090)   Возможно без опыта. ( студенты)      Условия:      Трудоустройство по ТК.   Ночные смены   Редкие командировки.(оплачиваемые, жилье и дорога, за счет компании)   На территории работодателя.   Получение новых профессиональных навыков.   Без совмещения   в месяц около 10 ночных смен.   ",Полная занятость,Сменный график,Нет опыта,|Настройка ПК|Настройка ПО|Сборка ПК|Windows 7,,53276.190476190466,,40000.0,помощник системного администратора,"Опыт работы с терминалами сбора данных (M3 green, M3T, MC3090). Возможно без опыта. ( студенты).","Работа с терминалами сбора данных. Настройка и установка сетевого оборудования ( ноутбуки, ТСД, точки доступа, маршрутизаторов).",0.5,0,0,0,0,0,0,1,0,1,0,0,1,0,0,0,0,0,0,1,0,0,0,0,0,1,0,1,0,1,0,1
