Новосибирск,АТМ-А СЕРВИС,2019-10-24T12:47:48+0300," Компания ООО «АТМ-А сервис» (17 лет на рынке) приглашает на работу специалиста по обслуживанию банкоматов и POS-терминалов. Мы занимаемся обслуживанием банкоматов, платежных терминалов и т.п. банковских устройств самообслуживания в Новосибирской, Кемеровской, Тюменской, Томской областях и на Алтае.   Условия:   - График работы: 5 дней в неделю (Пн-Пт), с 9 до 18 часов. 2-3 раза в месяц - дежурства по выходным (9.00 - 21.00), оплачивается дополнительно. - График может меняться в зависимости от объема работы по согласованию с сотрудником. - Все переработки оплачиваются отдельно. - Полная занятость, официальное трудоустройство, зарплата перечисляется на карточку.   Испытательный срок 3 месяца (включая период обучения). На это время зарплата 30 000 руб.   По окончании испытательного срока зарплата 35 000руб.(без учета дежурств и переработок). При наличии опыта работы с банкоматами испытательный срок может быть сокращен. В структуре зарплаты 5000 - КТУ (коэффициент трудового участия, начисляются на каждого сотрудника, в конце месяца суммируются и перераспределяются в зависимости от количества и сложности выполненных заявок; соответственно, можно заработать меньше или больше).   В дальнейшем повышение зарплаты в зависимости от качества работы и освоения новых моделей оборудования.   Соц.пакет (отпуск, больничные листы, помощь в связи со значимыми событиями в жизни - рождение детей и т.п.). Предоставляется необходимое оборудование (нетбук, обжимка и т.п.).    Отпуск 28 календарных дней, предоставляется двумя частями по 2 недели в период с апреля по октябрь (в связи с высокой нагрузкой отпуск не предоставляется с ноября по март). На время отпуска питание не оплачивается.   Навыки и опыт:   - Разъездной характер работы. - Желателен опыт ремонта/обслуживания компьютеров и т.п. - Желательно высшее техническое образование (РТФ и т.п.).   Для студентов старших курсов технических факультетов возможно совместительство.   - ВНИМАНИЕ! Собеседование проводится только после получения резюме, отправленного на указанный в вакансии адрес. ",Полная занятость,Полный день,Нет опыта,|Ремонт ПК,,35000.0,,30000.0,сервисный инженер по обслуживанию pos терминалов и банкоматов,Навыки и опыт: - Разъездной характер работы. - Желателен опыт ремонта/обслуживания компьютеров и т.п. - Желательно высшее техническое образование (РТФ и...,,0.06666666666666667,0.0,1.0,0.0,0.0,0.0,0.0,0.0,0.0,0.0,1.0,0.0,0.0,0.0,0.0,0.0,0.0,0.0,0,0,1,0,0,0,1,0,0,1,0,0,0,0,0,1,0,0,1,0,0,0,0,0,0,0,0,0,1
Новосибирск,СофтМолл,2019-10-09T08:01:15+0300," Обязанности:     Установка и настройка средств защиты информации СКЗИ, САЗ, СДВ, СОВ и т.д. (Infotecs, Код Безопасности, Конфидент, Касперский, РусБИТех и т.д.);   Разработка технической документации;   Консультации и решение технических проблем заказчиков.   Участие в подготовке технико-коммерческих предложений;      Требования:      Высшее образование в области ИБ / смежные области ИТ с опытом в ИБ;   Базовые знания: Microsoft AD, Windows Sever, Linux, Hyper-V, VMware. TCP-IP сетей, VPN;   Знание и опыт конфигурирования средств защиты информации;   Готовность к командировкам;       Понимание принципов и механизмов защиты информации.   Знание нормативно-правовых актов ФСТЭК, ФСБ в области защиты информации;          Условия:      Возможности карьерного и профессионального роста;   Профессиональное развитие и корпоративное обучение;   Комфортабельный офис в центре города по линии метро.   Молодой дружный коллектив профессионалов;   Официальная конкурентная ЗП, своевременные выплаты, соблюдение ТК РФ, бонусы.       ",Полная занятость,Полный день,От 1 года до 3 лет,,3.0,53400.0,1.0,36555.55555555556,инженер по информационной безопасности,"Высшее образование в области ИБ / смежные области ИТ с опытом в ИБ. Базовые знания: Microsoft AD, Windows Sever, Linux, Hyper...","Установка и настройка средств защиты информации СКЗИ, САЗ, СДВ, СОВ и т.д. (Infotecs, Код Безопасности, Конфидент, Касперский, РусБИТех и...",0.5666666666666667,0.0,1.0,0.0,0.0,0.0,0.0,0.0,0.0,0.0,0.0,1.0,0.0,0.0,0.0,0.0,0.0,0.0,0,0,1,0,0,0,0,1,0,1,0,0,0,0,0,1,0,0,0,0,0,0,0,0,0,0,0,0,0
Новосибирск,Positive Technologies,2019-10-21T10:04:38+0300,"  О компании    Positive Technologies – разработчик ПО в сфере информационной безопасности международного уровня.    О продукте    PT MultiScanner — многоуровневая система защиты от вредоносного ПО. Она позволяет выявлять вирусные угрозы, блокировать их распространение в инфраструктуре и обнаруживать скрытое присутствие вредоносных программ, используя оптимальный набор антивирусов, передовую «песочницу» и репутационные списки Positive Technologies.    Стек основных технологий:    Ubuntu/Debian, Python, Ansible, k8s, Docker, PostgreSQL (stolon), RabbitMQ, ElasticSearch.    Чем предстоит заниматься:      автоматизацией деплоя для разных окружений, мы используем Terraform и Ansible;   разработкой CI/CD pipeline для выпуска продукта;   развитием мониторинга инфраструктурных и бизнес метрик на Prometheus;   разработкой инсталлятора для коробочной версии продукта;   администрированием инфраструктуры: решением возникающих проблем, масштабированием и обеспечением отказоустойчивости, балансировкой нагрузки и резервным копированием;   обмен опытом и решениями с инфраструктурными командами соседних проектов с аналогичным стеком технологий;   в обозримой перспективе использование облачных площадок для развертывания.      Чем НЕ придется заниматься:      поддержкой общих ресурсов внутри компании (Gitlab, Jira, Confluence, ...) - для этого есть отдельная команда.      Что необходимо кандидату:      понимать жизненный цикл разработки ПО и принципы CI/CD;   опыт системного администрирования Linux обязателен;   разделять подход “infrastructure as a code”;   опыт работы с системами configuration management;   умение писать на python и, желательно, bash;   опыт работы с системами виртуализации;   навык работы с docker, умение упаковывать любой софт в контейнер;   опыт организации мониторинга инфраструктуры;   опыт работы с AWS/Azure/GCE будет плюсом;    английский язык не ниже intermediate.       Что взамен:      Уютный офис недалеко от м. Площадь Гарина-Михайловского или в Академгородке, возможность удалённой работы обсуждаема;   Официальное трудоустройство и белая зарплата;   ДМС со стоматологией;   Шесть недель оплачиваемого отпуска;   Можно самому выбрать, во сколько начинается твой рабочий день.   ",Полная занятость,Полный день,От 1 года до 3 лет,,3.0,53400.0,1.0,36555.55555555556,администратор инженер,Понимать жизненный цикл разработки ПО и принципы CI/CD. Опыт системного администрирования Linux обязателен. Разделять подход “infrastructure as a code”. ,"Автоматизацией деплоя для разных окружений, мы используем Terraform и Ansible. Разработкой CI/CD pipeline для выпуска продукта. Развитием мониторинга инфраструктурных...",0.16666666666666666,0.0,1.0,0.0,0.0,0.0,0.0,0.0,0.0,0.0,0.0,1.0,0.0,0.0,0.0,0.0,0.0,0.0,0,0,1,0,0,0,0,1,0,1,0,0,0,0,0,1,0,0,0,0,0,0,0,0,0,0,0,0,0
Новосибирск,АЙФЭЛЛ,2019-10-21T07:13:49+0300," iFellow собирает профессиональную команду тестирования.   Компания АЙФЭЛЛ пополняет команду QA Engineer для работы над сложным и интересным кредитным продуктом на проекте Банка ТОП-10.   Наш будущий коллега будет тестировать веб-приложение, которое является частью интернет-банка.   Проект интересен тем, кто готов и хочет развиваться до full-stack тестировщика!    Обязанности:      Опыт тестирования веб- или мобильных приложений   Практический опыт применения практик тест-дизайна   Рабочие знания клиент-серверной архитектуры   Умение проектировать тест-кейсы и подготавливать тестовые данные для тестирования   Аналитический склад ума и внимание к деталям   Готовность обучаться и применять в работе новые технологии и тестовое ПО   Умение быстро адаптироваться к различным рабочим ситуациям и принимать решения на основе логики   Стремление расти в профессиональном и личном плане   SOAP/REST      Дополнительные (желательные) требования:      Знание любого языка программирования на начальном уровне   Опыт работы с автотестами на selenium или selenide      Условия:      Оформление по ТК РФ   Конкурентная заработная плата   ДМС   Возможность участвовать в разработке крутых проектов   Шанс присоединиться к уникальной команде молодых и талантливых единомышленников   Возможность развиваться в личностном и профессиональном планах   Корпоративное обучение на платформе Coursera   Работа в современном/технологичном офисе   Корпоративные мероприятия, meetup, конференции   ",Полная занятость,Полный день,От 1 года до 3 лет,|Functional testing|Integration testing|Regression testing|UAT|SAOP|REST|JIRA|Test design|Test Plan,3.0,53400.0,1.0,36555.55555555556,инженер по тестированию qa engineer,Опыт тестирования веб- или мобильных приложений. Практический опыт применения практик тест-дизайна. Рабочие знания клиент-серверной архитектуры. Умение проектировать тест...,IFellow собирает профессиональную команду тестирования.,0.16666666666666666,0.0,1.0,0.0,0.0,0.0,0.0,0.0,0.0,0.0,0.0,1.0,0.0,0.0,0.0,0.0,0.0,0.0,0,0,1,0,0,0,0,1,0,1,0,0,0,0,0,1,0,0,0,0,0,0,0,0,0,0,0,0,1
Новосибирск,«Предприятие «ЭЛТЕКС»,2019-10-25T09:49:58+0300,"  Обязанности:      Проверка, настройка и ремонт сложных электронных изделий (телекоммуникационного оборудования) на уровне элемента.      Требования:      Опыт ремонта радиоэлектронной аппаратуры;   Высшее техническое образование;   Умение работать с измерительными приборами;   Уверенное знание основ цифровой и аналоговой электроники.      Условия:      Достойная заработная плата, на испытательном сроке 45 т.р.;   Работа в стабильной, динамично развивающейся компании, интересные задачи, дружный молодой коллектив;   Трудоустройство согласно ТК РФ, полный соц.пакет (ежегодный оплачиваемый отпуск 28 дней, больничные);   Официальная заработная плата (оклад + ежемесячная премия).      Приятные бонусы:      Корпоративная скидка на фитнес, в Дельфинию и Термы Мира;   Поддержка спортивного духа в компании (участие в &quot;Гонке героев&quot;, спартакиаде среди организаций г. Новосибирска и др.);   Скоро открываем свой тренажерный зал в офисе;   Два больших здания на собственной территории (с парковочными местами и для авто, и для велосипеда);   Парк, уличная спортивная зона;   Бесплатный служебный транспорт от пл.Калинина и 4,5,6 мкр.   ",Полная занятость,Полный день,От 1 года до 3 лет,|Схемотехника электронного оборудования|Цифровая и аналоговая электроника|Чтение электросхем|Ремонт оборудования|Техническое обслуживание,3.0,53400.0,1.0,45000.0,инженер электроник,Опыт ремонта радиоэлектронной аппаратуры. Высшее техническое образование. Умение работать с измерительными приборами. Уверенное знание основ цифровой и аналоговой электроники.,"Проверка, настройка и ремонт сложных электронных изделий (телекоммуникационного оборудования) на уровне элемента.",0.03333333333333333,0.0,0.0,1.0,0.0,0.0,0.0,0.0,0.0,0.0,0.0,1.0,0.0,0.0,0.0,0.0,0.0,0.0,0,0,1,0,0,0,0,1,0,1,0,0,0,0,0,1,0,0,0,0,0,0,0,0,0,0,0,0,1
Новосибирск,Ростелеком,2019-10-01T07:36:23+0300,"  Обязанности:        Разработка программных интерфейсов для действующих OSS систем;       Создание нового и доработка существующего функционала;       Передача проектов в эксплуатацию.            Требования:      Высшее (техническое) образование;   Опыт от 3-х лет в разработке интеграционных решений;   Опыт разработки на PL/SQL;   Опыт разработки скриптов / программ на Python / Java является плюсом;   Знание области эксплуатации инфраструктуры информационных технологий, знание отрасли телекоммуникаций будет плюсом.          Условия:      Оформление в соответствии с ТК РФ, полностью белая зарплата + соц.пакет;   Квартальная система премирования;   Возможности для профессионального и карьерного развития.   ",Полная занятость,Полный день,От 3 до 6 лет,,6.0,53400.0,3.0,36555.55555555556,ведущий инженер разработчик,Высшее (техническое) образование. Опыт от 3-х лет в разработке интеграционных решений. Опыт разработки на PL/SQL. Опыт разработки скриптов...,Разработка программных интерфейсов для действующих OSS систем. Создание нового и доработка существующего функционала. Передача проектов в эксплуатацию.,0.8333333333333334,0.0,1.0,0.0,0.0,0.0,0.0,0.0,0.0,0.0,0.0,1.0,0.0,0.0,0.0,0.0,0.0,0.0,0,0,1,0,0,0,0,0,1,1,0,0,0,0,0,1,0,0,0,0,0,0,0,0,0,0,0,0,0
Новосибирск,Компания ТрансТелеКом,2019-10-04T05:06:37+0300,"  ТТК (ТрансТелеКом) - инициативная группа единомышленников, объединенная ответственностью, решимостью, стремлением к росту, способная профессионально и эффективно достигать общей цели, строящая работу на принципах взаимопонимания и доверия.     Мы ищем в нашу команду инженера технической поддержки!     Обязанности :     Осуществление оперативной технической поддержки клиентов по телефону (доступ в Интернет и настройка ТВ).   Диагностика, локализация и устранение неисправностей и сбоев по заявкам клиентов, технические консультации.   Удаленная настройка клиентского оборудования (роутер / ТВ-приставка / ПК).      Мы предлагаем:      решение интересных технических задач;   работа в стабильной престижной компании;   дружный коллектив;   возможность повысить свою профессиональную компетенцию;   поддержка и наставничество со стороны руководства;   интересные корпоративные мероприятия;   график работы: 5-тидневная рабочая неделя со скользящими выходными;   комфортный офис по адресу Нарымская, 37 (ост. Плановая).      Пожелания к вам:      Образование: техническое, желательно профильное.   Опыт работы на аналогичной должности приветствуется.   ",Полная занятость,Полный день,Нет опыта,,,30000.0,,30000.0,инженер технической поддержки,"Образование: техническое, желательно профильное. Опыт работы на аналогичной должности приветствуется.","Осуществление оперативной технической поддержки клиентов по телефону (доступ в Интернет и настройка ТВ). Диагностика, локализация и устранение неисправностей и сбоев...",0.7333333333333333,0.0,1.0,0.0,0.0,0.0,0.0,0.0,0.0,0.0,1.0,0.0,0.0,0.0,0.0,0.0,0.0,0.0,0,0,1,0,0,0,1,0,0,1,0,0,0,0,0,1,0,0,0,0,0,0,0,0,0,0,0,0,0
