Красноярск,Красноярское ЦАВС,2019-10-25T06:39:50+0300," Для экономии Вашего времени просим пройти небольшой тест.    Обязанности:      Установка и обслуживания вычислительной техники и ПО (200 компьютеров), тех. поддержка пользователей (30 филиалов). Решение оперативных задач. Консультирование пользователей. Работа в команде профессионалов.   Работа с конфигурацией 1С ITIL на уровне администратора, ведение складского учета компьютерной техники.     Требования:     Знание операционных систем Windows 7, 8, 10 на уровне администратора, знание компьютерного «железа» и периферийных устройств, умение самостоятельной настройки и диагностики ПК.   Знания технологий построения ЛВС приветствуются, знания операционных систем семейства Unix приветствуются, умение работать в команде, умение и желание работать на результат.     Условия:   Мы предлагаем пятидневную рабочую неделю с 8:00 до 17:00, комфортный офис в центре Взлетки, скидку на питание и возможность карьерного роста. ",Полная занятость,Полный день,Нет опыта,,,53400.0,,35000.0,инженер технической поддержки,"Знание операционных систем Windows 7, 8, 10 на уровне администратора, знание компьютерного «железа» и периферийных устройств, умение самостоятельной настройки и...","Установка и обслуживания вычислительной техники и ПО (200 компьютеров), тех. поддержка пользователей (30 филиалов). Решение оперативных задач. Консультирование пользователей. ",0.03333333333333333,0.0,1.0,0.0,0.0,0.0,0.0,0.0,0.0,0.0,0.0,1.0,0.0,0.0,0.0,0.0,0.0,0.0,1,0,0,0,0,0,1,0,0,1,0,0,0,0,0,1,0,0,0,0,0,0,0,0,0,0,0,0,0
Красноярск,НПП Бевард,2019-10-02T06:01:05+0300,"  Обязанности:      Тестирование камер видеонаблюдения и других устройств на совместимость с различным программным обеспечением.   Тестирование поддерживаемого функционала IP-камер новых моделей, на обновлённых прошивках, новых версиях драйверов в ПО для видеонаблюдения.   Создание отчётов о совместимости устройств и ПО.   Решение вопросов программно-аппаратной совместимости.   Работа с технической документацией.   Взаимодействие с коллегами из других отделов (разработки, продаж, техподдержки).   Работа с низковольтным оборудованием (IP-камеры, блоки питания, видеорегистраторы).         Требования:     Образование высшее техническое.   Работа в офисных программах, уверенное владение ПК.   Знание сетевых протоколов, знакомство с видеокодеками, характеристиками видеопотока.   Знакомство с различными видами операционных систем, их особенностями, навыки администрирования.   Усидчивость, мотивация к обучению, саморазвитию.   Приветствуются знания английского языка и какого-нибудь языка программирования (но не обязательно).         Условия:     Рабочий день с 09.00 до 18.00; 5 дневная рабочая неделя, официальное трудоустройство   Заработная плата по результатам собеседования в зависимости от квалификации кандидата, своевременно дважды в месяц;   ",Полная занятость,Полный день,Нет опыта,|Настройка ПК|Настройка ПО|Техническое обслуживание|Настройка сетевых подключений|Системы видеонаблюдения|TCP/IP,,53400.0,,25000.0,инженер интеграции,"Образование высшее техническое. Работа в офисных программах, уверенное владение ПК. Знание сетевых протоколов, знакомство с видеокодеками, характеристиками видеопотока. ","Тестирование камер видеонаблюдения и других устройств на совместимость с различным программным обеспечением. Тестирование поддерживаемого функционала IP-камер новых моделей, на...",0.8,0.0,1.0,0.0,0.0,0.0,0.0,0.0,0.0,0.0,0.0,1.0,0.0,0.0,0.0,0.0,0.0,0.0,1,0,0,0,0,0,1,0,0,1,0,0,0,0,0,1,0,0,0,1,1,0,0,1,1,0,0,0,1
Красноярск,Орион телеком,2019-10-24T05:39:32+0300," Обязанности:     Выполнение заявок в разных районах города.   Выезд на объекты (осмотры , диагностика, восстановление кабельной продукции);   Восстановление работы камеры\коммутатора.     Требования:     Ответственный, трудолюбивый, обучаемый, умеющий работать в дружном коллективе, лояльность к возникающей производственной необходимости и сверхурочных работах;     Условия:     Достойная заработная плата.   Пятидневная рабочая неделя с 09:00 до 18.00.   Дежурство в выходные дни 2 раза в месяц с 10:00 до 17:00.   Компенсация ГСМ 120л\мес;   Корпоративная сотовая связь.   Оплачиваемые переработки.   ",Полная занятость,Полный день,Нет опыта,|Стрессоустойчивость,,32000.0,,26000.0,инженер по обслуживанию систем видеонаблюдения,"Ответственный, трудолюбивый, обучаемый, умеющий работать в дружном коллективе, лояльность к возникающей производственной необходимости и сверхурочных работах.","Выполнение заявок в разных районах города. Выезд на объекты (осмотры , диагностика, восстановление кабельной продукции). Восстановление работы камеры\коммутатора.",0.06666666666666667,0.0,1.0,0.0,0.0,0.0,0.0,0.0,0.0,0.0,1.0,0.0,0.0,0.0,0.0,0.0,0.0,0.0,1,0,0,0,0,0,1,0,0,1,0,0,0,0,0,1,0,0,0,0,0,0,0,0,0,0,0,0,1
Красноярск,Связной,2019-10-22T13:02:35+0300,"  «СВЯЗНОЙ»  - крупная федеральная компания, в которой присутствует дружественная атмосфера, открытость и доверие, вовлеченность и инновационность. В составе нашей команды молодой и квалифицированный персонал! Работа в нашей компании даёт ежедневный заряд и мотивирует к достижению новых вершин.    В НАСТОЯЩИЙ МОМЕНТ МЫ ФОРМИРУЕМ СВОЮ КОМАНДУ – НОВУЮ СЛУЖБУ ТЕХНИЧЕСКОЙ ПОДДЕРЖКИ!      ОБЯЗАННОСТИ:      Составление графиков работы инженерского состава;   Обучение и консультация инженеров;   Выполнение плановых показателей по сервису и плановым работам;   Контроль наличия запасных инструментов / приборов.       УСЛОВИЯ:      Возможности карьерного роста и постоянного развития;   Официальное оформление и соблюдение ТК РФ - выплата белой зарплаты 2 раза в месяц без задержек, оплачиваемый отпуск и больничный;   График работы: 5/2 c 09:00 до 18:00;   Место работы: ул. Полтавская;   Оплата ГСМ;   Оплата мобильной связи;   Скидки на товары компании.      ТРЕБОВАНИЯ:      Профессиональное образование в области радиоэлектроники или связи (желательно);   Опыт ремонта контрольно-кассовой и банковской техники (будет преимуществом);   Уверенный пользователь ПК;   Готовность к командировкам;   Ответственность, дисциплинированность.   ",Полная занятость,Полный день,От 1 года до 3 лет,|Обучение и развитие|Ремонт ПК|Пользователь ПК|Грамотная речь|Управление временем,3.0,45000.0,1.0,39000.0,старший инженер службы технической поддержки г. красноярск,Профессиональное образование в области радиоэлектроники или связи (желательно). Опыт ремонта контрольно-кассовой и банковской техники (будет преимуществом). Уверенный пользователь ПК. ,Составление графиков работы инженерского состава. Обучение и консультация инженеров. Выполнение плановых показателей по сервису и плановым работам. Контроль наличия запасных...,0.13333333333333333,0.0,1.0,0.0,0.0,0.0,0.0,0.0,0.0,0.0,1.0,0.0,0.0,0.0,0.0,0.0,0.0,0.0,1,0,0,0,0,0,0,1,0,1,0,0,0,0,0,1,0,0,1,0,0,0,0,0,0,0,0,0,1
Красноярск,СИБЗОЛОТО,2019-10-18T06:31:45+0300," Обязанности:     Обеспечивает правильную техническую эксплуатацию, бесперебойную работу электронного оборудования;   Участвует в разработке перспективных и текущих планов и графиков работы, технического обслуживания и ремонта оборудования, мероприятий по улучшению его эксплуатации и повышению эффективности использования электронной техники   Организует техническое обслуживание электронной техники, обеспечивает ее работоспособное состояние, рациональное использование, проведение профилактического и текущего ремонта   Принимает меры по своевременному и качественному выполнению ремонтных работ согласно утвержденной документации   Осуществляет руководство системными администраторами на закрепленных участках   Осуществление контроля и надзора над подрядными организациями   Составляет заявки на электронное оборудование и запасные части к нему, техническую документацию на ремонт, отчеты о работе   составление дефектных ведомостей   Осуществляет контроль за своевременным обеспечением электронной техники запасными частями и материалами, организует хранение радиоэлектронной аппаратуры     Требования:     опыт работы в ИТ сфере от 3х лет;   знание принципов работы ЛВС;   понимание модели OSI, семейства протоколов TCP\IP;   готовность замечать проблемы и искать пути их решения;   опытный пользователь ПК;   готовность к командировкам;   Преимуществом будет наличие опыта строительства беспроводных каналов связи (2.4, 5 ГГц), систем спутникового интернета, монтаж систем видеонаблюдения и СКУД.     Условия:     Место работы пр.Мира   ",Полная занятость,Полный день,От 3 до 6 лет,,6.0,50000.0,3.0,50000.0,инженер электроник,"Опыт работы в ИТ сфере от 3х лет. Знание принципов работы ЛВС. Понимание модели OSI, семейства протоколов TCP\IP. ","Обеспечивает правильную техническую эксплуатацию, бесперебойную работу электронного оборудования. Участвует в разработке перспективных и текущих планов и графиков работы, технического обслуживания...",0.26666666666666666,0.0,0.0,1.0,0.0,0.0,0.0,0.0,0.0,0.0,0.0,1.0,0.0,0.0,0.0,0.0,0.0,0.0,1,0,0,0,0,0,0,0,1,1,0,0,0,0,0,1,0,0,0,0,0,0,0,0,0,0,0,0,0
Красноярск,Орион телеком,2019-10-18T09:45:11+0300," Обязанности:     Разработка отчетов и обработок;   Доработка функционала конфигураций 1С:Предприятие Управление торговлей 10.3;   Обновление конфигураций Бухгалтерия предприятия 3.0, ЗУП;   Настройка правил обмена между конфигурациями;     Требования:     Знание конфигураций 1С:Предприятие Управление торговлей 10.3;   Бухгалтерия предприятия 3.0;   Язык запросов 1С, механизма обмена данными между конфигурациями;     Условия:     Работа в офисе центр города.   Пятидневная рабочая неделя с 9.00 - 18.00.   Перспективы карьерного и профессионального роста.   Дружный коллектив и корпоративный отдых.   ",Полная занятость,Полный день,Нет опыта,,,60000.0,,40000.0,ведущий инженер разработчик 1с,"Знание конфигураций 1С:Предприятие Управление торговлей 10.3. Бухгалтерия предприятия 3.0. Язык запросов 1С, механизма обмена данными...",Разработка отчетов и обработок. Доработка функционала конфигураций 1С:Предприятие Управление торговлей 10.3. Обновление конфигураций Бухгалтерия предприятия 3.0...,0.26666666666666666,0.0,1.0,0.0,0.0,0.0,0.0,0.0,0.0,0.0,0.0,1.0,0.0,0.0,0.0,0.0,0.0,0.0,1,0,0,0,0,0,1,0,0,1,0,0,0,0,0,1,0,0,0,0,0,0,0,0,0,0,0,0,0
Тюмень,АТМ АЛЬЯНС,2019-10-15T12:23:34+0300," «АТМ АЛЬЯНС»  - крупная торгово – сервисная компания, специализируется на продаже и комплексном сервисном обслуживании банковского оборудования.  Мы постоянно растем и развиваемся, ищем новые пути и интересные перспективные направления.   Обязанности:     ремонт банковского оборудования (терминалов) в условиях стационарного сервисного центра;           разбор терминалов;           предпродажная подготовка терминалов.     Требования:     уверенное владение ПК (техническая подкованность);   умение пользоваться паяльной станцией, знание микроэлектроники, умение читать печатную плату;           умение пользоваться ручным и электроинструментом,           опыт ремонта сотовых телефонов, ноутбуков как дополнительный плюс к вашим навыкам;           ответственность, коммуникабельность и желание развиваться.    Также рассмотрим кандидатов без опыта - выпускников технических вузов.   Условия:   работа под руководством опытного наставника, обучение в процессе работы;  Сервисный центр, место работы будет располагаться по адресу: г.Тюмень, ул. Республики;  своевременная заработная плата;  бонусы к зарплате при выполнении плана;  график работы: 5/2;  официальное трудоустройство;  От нас: инструмент, рабочая одежда, знания и опыт.  От вас: ответственность и работа на результат!",Полная занятость,Полный день,От 1 года до 3 лет,|Схемотехника электронного оборудования|Электротехнические работы|радиоэлектроника,3.0,53400.0,1.0,27000.0,инженер электроник сервисного центра ремонта pos терминалов,"Уверенное владение ПК (техническая подкованность). Умение пользоваться паяльной станцией, знание микроэлектроники, умение читать печатную плату. Умение пользоваться ручным и электроинструментом. ",Ремонт банковского оборудования (терминалов) в условиях стационарного сервисного центра. Разбор терминалов. Предпродажная подготовка терминалов.,0.36666666666666664,0.0,1.0,0.0,0.0,0.0,0.0,0.0,0.0,0.0,0.0,1.0,0.0,0.0,0.0,0.0,0.0,0.0,0,0,0,0,1,0,0,1,0,1,0,0,0,0,0,1,0,0,0,0,0,0,0,0,0,0,0,0,1
Тюмень,Первый Бит,2019-10-22T13:51:29+0300,"  Первый БИТ  — это  динамичная IT-компания , в которой каждый сотрудник развивается, решает сложные задачи и участвует в крупных проектах.    Компания «Первый БИТ»  является разработчиком IT-решений для учета и управления.   Итогом более 22 лет работы стало создание  крупнейшей региональной сети среди фирм-франчайзи 1С .    Наши клиенты:  ДЭУ КАО, Госрыбцентр, КРИММ, холдинговая компания Фонд, Областная стоматологическая поликлиника, Росводоканал, агентство недвижимости СОВА, ТюменьНИПИнефть, группа компаний ЭНКО, застройщик Скандиа Девелопмент и многие другие известные компании.    Мы предлагаем:      Интересные задачи и крупные проекты.   Реальные возможности профессионального и карьерного роста.   Гибкая система обучения и повышение квалификации: корпоративные курсы, семинары, тренинги, возможность получить сертификаты 1С за счет компании.   Уровень заработной платы будет зависеть от готовности решать сложные, интересные и разноплановые задачи.   График работы понедельник-пятница с 9.00 до 18.00.   Удобное месторасположение – наш офис находится в центре города.   Оформление по ТК РФ.   В нашей команде вас встретит молодой коллектив профессионалов и единомышленников, развитая корпоративная культура.   Бесплатные чай, кофе – мелочь, но очень приятная :)      Каждый сможет найти здесь именно то, что ждёт от работы: общение, обмен идеями и опытом, стабильность, карьерный рост, вдохновение и воплощение своих профессиональных планов. Начни работать там, где ты сможешь развиваться и при этом оставаться собой!     Задачи:      Сопровождение и обновление программных продуктов на территории клиента/ удаленно в офисе компании.   Установка и настройка программных продуктов.   Консультационная и техническая поддержка пользователей.   Обучение клиентов работе в программах.      Наши ожидания:      Уверенный пользователь ПК.   Умение устанавливать контакт с незнакомыми людьми, вежливость.   Стремление к профессиональному развитию в IT сфере.   ",Полная занятость,Полный день,Нет опыта,,,53400.0,,20000.0,сервис инженер,"Уверенный пользователь ПК. Умение устанавливать контакт с незнакомыми людьми, вежливость. Стремление к профессиональному развитию в IT сфере.",Сопровождение и обновление программных продуктов на территории клиента/ удаленно в офисе компании. Установка и настройка программных продуктов. Консультационная и техническая...,0.13333333333333333,1.0,0.0,0.0,0.0,0.0,0.0,0.0,0.0,0.0,0.0,1.0,0.0,0.0,0.0,0.0,0.0,0.0,0,0,0,0,1,0,1,0,0,1,0,0,0,0,0,1,0,0,0,0,0,0,0,0,0,0,0,0,0
