Новосибирск,Новосибирскэнергосбыт,2019-10-25T07:32:47+0300," Обязанности:     Анализ реализованных задач на соответствие требованиям для Web, Mobile и Desktop приложений.   Проектирование и актуализация планов и сценариев тестирования (тест-планов, чек-листов, тест кейсов).   Проведение функционального, компонентного, интеграционного и нагрузочного тестирования.   Реализация тест-планов для нового и измененного функционала в виде ручных и авто-тестов.   Интеграция тестовой инфраструктуры с Continuous Integration   Развертывание и поддержание в работоспособном состоянии тестовых комплексов.   Составление отчетов о результатах тестирования.   Оформление ошибок в багтрекере.   Контроль обновлений и исправлений.     Требования:     Высшее/неоконченное высшее образование в области ИТ   Хорошее понимание теории и методологий тестирования.   Опыт тестирование Web-приложений, пользовательских интерфейсов.   Знание принципов разработки ПО.   Умение писать понятную тестовую документацию.   Базовые знания SQL   Базовые знания HTTP, HTML, CSS   Умение работать с большим объемом информации и разноплановыми задачами.   Будет дополнительным плюсом:   навыки программирования на любом языке.   знание agile-методик выполнение проектов   опыт работы с Jira, SVN, Git,MS SQL, Jenkins, Selenium, Jmeter, Postman     Условия:     Трудоустройство по ТК РФ   З/п по договоренности   Место работы: ул. Орджоникидзе   Режим работы: пн.- пт., вых.: (суб.,вс.)   Компенсация 50% от оплаты за э/э, т/э, г/в, но не более 12 т.р./г; единовременные выплаты при уходе в ежегодный отпуск; вознаграждение за выслугу лет; возмещение за питание ребенка в ДДУ, не более 800 р./м.; полный социальный пакет.   ",Полная занятость,Полный день,От 1 года до 3 лет,,3.0,53400.0,1.0,36555.55555555556,qa инженер,"Высшее/неоконченное высшее образование в области ИТ. Хорошее понимание теории и методологий тестирования. Опыт тестирование Web-приложений, пользовательских интерфейсов. ","Анализ реализованных задач на соответствие требованиям для Web, Mobile и Desktop приложений. Проектирование и актуализация планов и сценариев тестирования (тест...",0.03333333333333333,0.0,1.0,0.0,0.0,0.0,0.0,0.0,0.0,0.0,0.0,1.0,0.0,0.0,0.0,0.0,0.0,0.0,0,0,1,0,0,0,0,1,0,1,0,0,0,0,0,1,0,0,0,0,0,0,0,0,0,0,0,0,0
Красноярск,ЭР-Телеком,2019-10-24T09:56:57+0300,"  В рамках развития проекта &quot;Цифровизация страны&quot; нашей компании доверили право подключить к интернету ключевые социальные объекты нашего региона. В связи с чем нам необходимо расширить штат сотрудников для выполнения поставленных задач, и мы объявляем открытой вакансию &quot;Инженер активного оборудования&quot;.     Обязанности:      Разработка и проведение мероприятий, направленных на повышение отказоустойчивости и надежности сети;   Контроль качества предоставляемых сервисов;   Выявление и устранение неисправностей, анализ трафика, и т.д.;   Взаимодействие с клиентами и партнёрами по техническим вопросам;   Взаимодействие с провайдерами по вопросам внешних и внутренних каналов связи;   Ведение документации по сетевой инфраструктуре.      Условия:      Официальное трудоустройство;   Стабильная &quot;белая&quot; заработная плата;   Социальный пакет, в соответствии с трудовым законодательством;   Обеспечение необходимым для работы инструментом и спецодеждой,;   Обучение за счет компании.     Требования:     Опыт администрирования сетей на уровне опытного администратора;   Знание систем мониторинга и оповещения;   Опыт работы в телекоммуникациях на аналогичной должности будет Вашим преимуществом   ",Полная занятость,Полный день,От 1 года до 3 лет,|Администрирование|Управленческое консультирование|Управление разработкой|Анализ рынка,3.0,53400.0,1.0,34000.0,инженер активного оборудования,Опыт администрирования сетей на уровне опытного администратора. Знание систем мониторинга и оповещения. Опыт работы в телекоммуникациях на аналогичной должности будет...,"Разработка и проведение мероприятий, направленных на повышение отказоустойчивости и надежности сети. Контроль качества предоставляемых сервисов. Выявление и устранение неисправностей, анализ...",0.06666666666666667,0.0,1.0,0.0,0.0,0.0,0.0,0.0,0.0,0.0,0.0,1.0,0.0,0.0,0.0,0.0,0.0,0.0,1,0,0,0,0,0,0,1,0,1,0,0,0,0,0,1,0,0,0,0,0,0,0,0,0,0,0,0,1
Красноярск,Gravicap.com,2019-09-26T07:31:46+0300," В сервисный центр требуется специалист по ремонту мобильной техники с опытом   Ремонт смартфонов, планшетов, навигаторов, плееров и прочего.   Приемкой телефонов заниматься не нужно, только ремонт.   Собственный склад деталей и комплектующих.   Стабильный поток заказов, розница и ОПТ.    Обязанности:      Диагностика (выявление причин поломки, обнаружение недостатков оборудования)   Полная разборка и сборка мобильных телефонов, планшетов   Сложный ремонт, BGA пайка, реболл.   Ремонт (замена дисплейных модулей, замена тачскринов, дисплеев, пайка разъёмов, замена АКБ, замена шлейфов и т.п)   Ведение учета ремонтов в базе данных     Требования:     Ответственность, аккуратность, профессионализм   Коммуникабельность, организованность   Знание схемотехники, радиоэлектроники   Умение работать с паяльным оборудованием     Условия:     Дополнительные навыки в ремонте увеличивают з/п   Полная занятость, полный день, без разъездов   Комфортное рабочее место   Молодой активный коллектив   График работ - пятидневка, с 10:00 до 19:00   Центральный район. Хорошая проходимость, работа с оптовыми клиентами. Стабильный поток заказов.   Сдельная заработная плата (% от ремонтов+ премии по итогам выполнения плана);   Величина процента зависит от квалификации кандидата.   Заработная плата своевременно, 2 раза в месяц.     Работы много, нужен человек, который хочет зарабатывать. ",Полная занятость,Полный день,От 1 года до 3 лет,|Ремонт телефонов|Ремонт смартфонов|Ремонт ПК|Ремонт планшетов,3.0,80000.0,1.0,30000.0,мастер инженер по ремонту телефонов планшетов,"Ответственность, аккуратность, профессионализм. Коммуникабельность, организованность. Знание схемотехники, радиоэлектроники. Умение работать с паяльным оборудованием.","Диагностика (выявление причин поломки, обнаружение недостатков оборудования). Полная разборка и сборка мобильных телефонов, планшетов. Сложный ремонт, BGA пайка, реболл. ",1.0,0.0,1.0,0.0,0.0,0.0,0.0,0.0,0.0,0.0,0.0,0.0,1.0,0.0,0.0,0.0,0.0,0.0,1,0,0,0,0,0,0,1,0,1,0,0,0,0,0,1,0,0,1,0,0,0,0,0,0,0,0,0,1
Красноярск,Tele2,2019-10-11T08:41:35+0300,"  Инженер по эксплуатации и планированию транспортной сети     Ваши будущие задачи:      Проведение работ по эксплуатации оборудования транспортной сети в соответствии с требованиями по эксплуатации сетей Теle2   Взаимодействие с Инженерами по эксплуатации БС и ТС для организации аварийно-восстановительных работ и работ по расширению на объектах транспортной сети   Поддержание показателя Network Availability транспортной сети в соответствии с установленными стандартами Теle2   Планирование топологии транспортной сети, взаимодействие с сотрудниками N&amp;I по вопросам планирования сети   Выдача заданий Отделу развития при организации работ по строительству и расширению транспортной сети предприятия   Ежемесячное посещение не менее 15 объектов связи   Контроль затрат на транспортную сеть предприятия, организация работ по снижению затрат   Своевременное предоставление отчетности Руководителю отдела эксплуатации либо Руководителю регионального отделения      Чтобы стать кандидатом, нужно:      Высшее образование в сфере телекоммуникаций, радиосвязи, радиотехники или информационных технологий   Желание расти и развиваться как инженер и как менеджер   Высокая степень обучаемости   Желание и способность работать в режиме многозадачности с высоким темпом   Способность самостоятельно принимать решения   Ответственность, инициативность   Знание ПК на уровне уверенного пользователя   Желателен опыт эксплуатации транспортных сетей, знание топологии GSM   Наличие сертификатов повышения квалификации – будет вашим преимуществом      Плюсы для вас:      Интересная работа в быстроразвивающейся компании   Уникальная система обучения для каждого сотрудника на основе индивидуальных планов развития   Зеленый свет для новых идей и предложений: мы часто делаем то, на что другие не отваживаются   Возможности профессионального и карьерного роста   Индексируемая заработная плата, годовые бонусы   Полное соответствие ТК РФ   Расширенная медицинская страховка в России и за пределами страны - даже для любителей черных горнолыжных трасс   Компенсация затрат на мобильную связь   Дополнительные материальные выплаты (пособия при рождении ребенка, вступлении в брак и т.п.)   Компенсация занятий спортом через год работы   ",Полная занятость,Полный день,От 1 года до 3 лет,,3.0,53400.0,1.0,36555.55555555556,инженер по эксплуатации и планированию транспортной сети,"Высшее образование в сфере телекоммуникаций, радиосвязи, радиотехники или информационных технологий. Желание расти и развиваться как инженер и как менеджер. ",Проведение работ по эксплуатации оборудования транспортной сети в соответствии с требованиями по эксплуатации сетей Теle2. Взаимодействие с Инженерами по...,0.5,0.0,1.0,0.0,0.0,0.0,0.0,0.0,0.0,0.0,0.0,1.0,0.0,0.0,0.0,0.0,0.0,0.0,1,0,0,0,0,0,0,1,0,1,0,0,0,0,0,1,0,0,0,0,0,0,0,0,0,0,0,0,0
Красноярск,КПНУ ВСТМ,2019-10-25T11:43:15+0300,"  Обязанности:      Ознакомление с проектом, выявление недостатков и их корректировка;   Согласование с заказчиком предложений и альтернатив;   Курирование и ведение объекта по направлению электрика и сдача его заказчику.   Контроль технической составляющей и качество выполнения работ (в подчинении мастер, электромонтажники, возможны наёмные бригады).      Требования:      Высшее техническое образование.   Знание инженерных систем по направлению электрика обязательно.   Опыт работы от 2-х лет в управлении проектом в роли руководителя / прораба/ инженера.   Владение ПК.   Ответственное отношение к работе, качественное выполнение своих обязанностей.      Условия:      Официальное трудоустройство по ТК РФ.   График работы с 8:00 до 17:00.   Организованное рабочее место.   Территориальное размещение компании: ул. Маерчака.   Предоставляем возможность обучения за счет компании, при необходимости.   Уровень оплаты проговариваем индивидуально.   ",Полная занятость,Полный день,От 3 до 6 лет,|Инженерные системы|Контроль качества|Управление производственным персоналом|Внутренний контроль|Расстановка приоритетов,6.0,53400.0,3.0,50000.0,инженер электрик,Высшее техническое образование. Знание инженерных систем по направлению электрика обязательно. Опыт работы от 2-х лет в управлении проектом в...,"Ознакомление с проектом, выявление недостатков и их корректировка. Согласование с заказчиком предложений и альтернатив. Курирование и ведение объекта по направлению...",0.03333333333333333,0.0,0.0,1.0,0.0,0.0,0.0,0.0,0.0,0.0,0.0,1.0,0.0,0.0,0.0,0.0,0.0,0.0,1,0,0,0,0,0,0,0,1,1,0,0,0,0,0,1,0,0,0,0,0,0,0,0,0,0,0,0,1
Красноярск,МАСТЕРТЕЛЕКОМ,2019-10-24T07:17:42+0300," Требуется специалисты:     по проектированию сетей связи ВОЛС по существующим ВЛ.   по проектированию сетей связи (ВЧ-связь по ВЛ)      Обязанности:      Проектирование ВОЛС по существующим ВЛ;   Проектирование ВЧ каналов связи по существующим ВЛ;   Выпуск и оформление документации в установленной форме.      Требования :     Опыт работы в проектировании не менее 1 года;   Опыт проектирования телекоммуникационных систем: ВОЛС или ВЧ;   Уверенный пользователь ПК с навыками работы в программах Word, Excel и AutoCAD;   Знание законов и иных нормативных правовых актов Российской Федерации в области проектирования систем связи;   Знание стандартов, технических условий и других нормативных документов по разработке и оформлению проектно-сметной документации;   Знание требований ГОСТов, СНиПов, РД по системам связи и телекоммуникационным системам.      Оплата сдельная при собеседовании, в зависимости от объёма работ. ",Проектная работа,Удаленная работа,От 1 года до 3 лет,|Грамотная речь|Работа с большим объемом информации|Microsoft Access|Ведение документации,3.0,53400.0,1.0,36555.55555555556,инженер проектировщик волс вл вч связи,Опыт работы в проектировании не менее 1 года. Опыт проектирования телекоммуникационных систем: ВОЛС или ВЧ. Уверенный пользователь ПК с навыками...,По проектированию сетей связи ВОЛС по существующим ВЛ. По проектированию сетей связи (ВЧ-связь по ВЛ). Обязанности: Проектирование ВОЛС по...,0.06666666666666667,0.0,1.0,0.0,0.0,0.0,0.0,0.0,0.0,0.0,0.0,1.0,0.0,0.0,0.0,0.0,0.0,0.0,1,0,0,0,0,0,0,1,0,0,1,0,0,0,0,0,0,1,0,0,0,0,1,0,0,0,0,0,1
Красноярск,GDC (ICL Services),2019-09-30T21:22:12+0300,"  В связи с расширением проекта и увеличением представительств заказчика в России, ищем в команду выездных инженеров.     Что будем делать:      выезжать по заявкам на точки заказчика (город и область);   обслуживать IT-инфраструктуру заказчика, заниматься технической поддержкой пользователей;   первичную диагностику, мелкий ремонт;   профилактику и настройку оборудования.      Что мы ожидаем от вас:      навыки работы с IT инфраструктурой;   опыт работы с торговым оборудованием;   знание операционной системы Windows на уровне уверенного пользователя;   желательны навыки сбора и разбора механических устройств;   желателен опыт работы от 1 года;   дисциплинированность, целеустремленность, ответственность;   терпеливость и стрессоустойчивость, умение добиваться нужного результата;      Что мы за это предлагаем:      официальное трудоустройство в соответствии с ТК РФ;   белая заработная плата (обсуждается на собеседовании);   стабильная выплата заработной платы (два раза в месяц), оплата сверхурочных работ.      Выплаты и бонусы:      квартальные бонусы;   оплата мобильной связи;   ГСМ и амортизация;   бонус к отпуску и к значимым событиям (свадьба, рождение детей);   компенсация спортивных абонементов.      Условия труда:      работа на территории заказчика;   график: 5/2, с 09.00 до 18-00;   оплачиваемые переработки и дежурства;   постоянная проектная занятность.      Обучение и карьера:      вендорное обучение и сертификация за счет компании;   возможность участия в техническом и управленческом кадровом резерве.      Экология и благотворительность:      помогаем детским домам, школам, приютам для животных;   озеленяем город, бережем ресурсы;   поддерживаем социальные инициативы сотрудников.   ",Полная занятость,Полный день,От 1 года до 3 лет,,3.0,53400.0,1.0,36555.55555555556,инженер локально выездной технической поддержки,Навыки работы с IT инфраструктурой. Опыт работы с торговым оборудованием. Знание операционной системы Windows на уровне уверенного пользователя. ,"Выезжать по заявкам на точки заказчика (город и область). Обслуживать IT-инфраструктуру заказчика, заниматься технической поддержкой пользователей. Первичную диагностику, мелкий...",0.8333333333333334,0.0,1.0,0.0,0.0,0.0,0.0,0.0,0.0,0.0,0.0,1.0,0.0,0.0,0.0,0.0,0.0,0.0,1,0,0,0,0,0,0,1,0,1,0,0,0,0,0,1,0,0,0,0,0,0,0,0,0,0,0,0,0
