city,company-name,date,description,employment-form,employment-schedule,experience,key_skills,max-experience,max-salary,min-experience,min-salary,name,requirements,responsibilities,days_from_publish,min-salary-group,max-salary-group,city: Екатеринбург,city: Казань,city: Москва,city: Новосибирск,city: Санкт-Петербург,experience: Более 6 лет,experience: Нет опыта,experience: От 1 года до 3 лет,experience: От 3 до 6 лет,employment-form: Полная занятость,employment-form: Проектная работа,employment-form: Стажировка,employment-form: Частичная занятость,employment-schedule: Вахтовый метод,employment-schedule: Гибкий график,employment-schedule: Полный день,employment-schedule: Сменный график,employment-schedule: Удаленная работа,пользователь пк,работа в команде,грамотная речь,деловое общение,стрессоустойчивость,mathcad,грамотность,чтение чертежей,ответственность,креативность,other
Новосибирск,Консалтинговый Центр «Вакансия Плюс»,2019-12-06T06:15:56+0300," В крупную производственную компанию в Искитиме, которая занимается поставками металлорежущего, слесарно-монтажного, мерительного и пневматического инструмента как отечественного, так и импортного производства на российские промышленные предприятия в связи с расширением производства требуется  оператор станков с ЧПУ.     Обязанности:      работа на фрезерном станке с ЧПУ, стойка Fanuc;   работа на токарном станке с ЧПУ, стойка Siemens;   обслуживание оборудования;   ввод управляющей программы;   изготовление деталей;   подбор режимов резания;   проведение измерительных работ;   сдача продукции;   уборка рабочего места.     Требования:     Средне-специальное образование;   Опыт работы на аналогичной должности не менее 1 года.     Условия:     Сменный график 12 часов с 8:00 до 20:00   Оплата - 2000 р/смена + 10 000 ежемесячная премия   При наличии опыта программирования (Solidworks, PowerMill) – возможна дополнительная оплата   ",Полная занятость,Сменный график,От 1 года до 3 лет,,3.0,53000.0,1.0,30000.0,оператор станков с чпу,Средне-специальное образование. Опыт работы на аналогичной должности не менее 1 года.,"Работа на фрезерном станке с ЧПУ, стойка Fanuc. Работа на токарном станке с ЧПУ, стойка Siemens. Обслуживание оборудования. ",0.23333333333333334,0,0,0,0,0,1,0,0,0,1,0,1,0,0,0,0,0,0,1,0,0,0,0,0,0,0,0,0,0,0,0
Новосибирск,СУПЕРКАДРЫ - Социоаналитический Центр,2019-11-25T13:20:56+0300," В стабильную компанию, с местом работы в городе Искитим, требуется оператор станков с ЧПУ.    Обязанности:      Работа на фрезерном станке с ЧПУ, стойка &quot;Fanuc&quot;.   Работа на токарном станке с ЧПУ, стойка &quot;Siemens&quot;.   Обслуживание оборудования;   Ввод управляющей программы;   Изготовление деталей;   Подбор режимов резания;   Проведение измерительных работ;   Сдача продукции;   Уборка рабочего места.     Требования:     Опыт работы на универсальных станках с ЧПУ;   Умение работать с чертежами;   Опыт работы с металлообрабатывающем оборудованием;   Знание основ технологии металлообработки;   Ответственность, самостоятельность.     Условия:     Средне-специальное образование   Сменный график: 12 часов с 8:00 до 20:00 - одна смена.   В месяц примерно 15 смен или более по желанию   При наличии опыта программирования (Solidworks, PowerMill) – возможна дополнительная оплата.   ",Полная занятость,Сменный график,От 1 года до 3 лет,|Mathcad|Чтение чертежей|Автоматизированное рабочее место (АРМ)|Станки ЧПУ|Solid Works|PowerMill|подбор режимов,3.0,53000.0,1.0,40000.0,оператор станков с чпу,Опыт работы на универсальных станках с ЧПУ. Умение работать с чертежами. Опыт работы с металлообрабатывающем оборудованием. Знание основ технологии металлообработки. ,"Работа на фрезерном станке с ЧПУ, стойка &quot;Fanuc&quot;. Работа на токарном станке с ЧПУ, стойка &quot;Siemens&quot;. Обслуживание оборудования. ",0.6,0,0,0,0,0,1,0,0,0,1,0,1,0,0,0,0,0,0,1,0,0,0,0,0,0,1,0,1,0,0,1
Новосибирск,Билайн,2019-12-13T10:57:11+0300," Ищешь работу в открытой рабочей среде, готов к интересным задачам?    Приглашаем тебя стать частью глобальной команды профессионалов Билайн!     Вместе с нами ты:      Станешь экспертом по новинкам телеком-рынка и продуктам Компании.   Научишься продавать клиентам услуги мобильной связи и мобильного интернета.   Приобретешь навык эффективных телефонных переговоров, предлагая наши услуги действующим клиентам нашей компании.      Если ты можешь сказать о себе:      Я общительный и любознательный.   Люблю и умею аргументированно отстоять свое мнение.   Умею найти выход в самой нестандартной ситуации.   С компьютером и смартфонами «на ты».      Мы предлагаем тебе:       Финансовую стабильность  - нам важно, чтобы каждый член нашей команды чувствовал себя уверенно. У нас ты можешь заработать помимо  ежемесячного оклада  неограниченную  премию,  размер которой  будет зависеть только от тебя.  Полностью официальное оформление и выплаты.    Постоянное развитие и реальная возможность карьерного роста.        Дополнительные льготы и бонусы от компании: скидки на покупку девайсов, корпоративная мобильная связь и многое другое - ты сам убедишься в качестве наших услуг!   Возможность  работать из дома при успешном выполнении показателей работы уже через 3 месяца.    Удобный рабочий график с закрепленными выходными суббота и воскресенье или сменный график   Крутая команда и помощь руководителя, активная жизнь: корпоративные праздники, открытое общение с коллегами в корпоративной сети и в реальном мире.         В Билайн мы развиваем и поддерживаем здоровую и безопасную рабочую среду.   Каждый сотрудник соблюдает Кодекс поведения, внутренние правила компании и придерживается принципов деловой этики.   Мы поступаем честно и этично как по отношению к друг другу, так и к нашим внешним партнерам.        Мы верим в возможности человека и помогаем раскрыть их даже тем, у кого нет опыта!     Яркая команда уже ждет именно тебя – присоединяйся!     #яработаювбилайн   #  хочувбилайн #followbeeline  ",Полная занятость,Полный день,Нет опыта,,,71000.0,,30000.0,оператор на телефон в офис,Если ты можешь сказать о себе: Я общительный и любознательный. Люблю и умею аргументированно отстоять свое мнение. Умею найти выход...,Научишься продавать клиентам услуги мобильной связи и мобильного интернета.,0.0,0,1,0,0,0,1,0,0,1,0,0,1,0,0,0,0,0,1,0,0,0,0,0,0,0,0,0,0,0,0,0
Казань,Фиолент,2019-12-03T09:45:52+0300," ООО &quot;Фиолент&quot; является одним из лидирующих производителей труб с теплоизоляцией из пенополиуретана в защитной оболочке с системой оперативного дистанционного контроля (ОДК) и многогранных опор освещения, опор ЛЭП.   Мы работаем как на территории Татарстана, так и и Российской Федерации, а также сотрудничаем с компаниями ближнего и дальнего зарубежья.   Мы предлагаем:     Достойный уровень заработной платы (релевантный уровню профессиональной компетентности);   Своевременная выплата заработной платы;   Возможность карьерного роста;   Официальное трудоустройство;   Обучение для новых сотрудников          Обязанности:       Работа на гибочном станке с ЧПУ (AD - S 60400)          Требования:      Опыт работы желателен   Знание технологии металлообработки          Условия:      Работа в крупной стабильной, производственной компании.   Официальное трудоустройство по ТК РФ.   Есть комната для намаза.   Своевременная выплата зарплаты 2 раза в месяц.   Служебный автобус (Авиастроительный, Московский, Ново-Савиновский район).       ",Полная занятость,Сменный график,От 1 года до 3 лет,,3.0,43571.42857142857,1.0,35000.0,оператор гибочного станка с чпу,Опыт работы желателен. Знание технологии металлообработки.,Работа на гибочном станке с ЧПУ (AD - S 60400).,0.3333333333333333,0,0,0,1,0,0,0,0,0,1,0,1,0,0,0,0,0,0,1,0,0,0,0,0,0,0,0,0,0,0,0
Казань,ПК Мобилюс,2019-12-11T10:44:32+0300,  Обязанности:      Изготовление металлических деталей на станках с ЧПУ;   Контроль обработки поверхности деталей контрольно-измерительными приборами и инструментами;   Чтение чертежей;   Проверка соответствия размеров;   Проведение технического обслуживания оборудования.     Требования:     умение пользоваться мерительным инструментом.   правила чтения чертежей обрабатываемых деталей.     Условия:     белая заработная плата; (оклад+сделка)   рабочий график 5/2   теплый цех   оформление по ТК РФ   ,Полная занятость,Полный день,От 1 года до 3 лет,,3.0,43571.42857142857,1.0,28000.0,оператор станка с чпу,Умение пользоваться мерительным инструментом. Правила чтения чертежей обрабатываемых деталей.,Изготовление металлических деталей на станках с ЧПУ. Контроль обработки поверхности деталей контрольно-измерительными приборами и инструментами. Чтение чертежей. ,0.06666666666666667,0,0,0,1,0,0,0,0,0,1,0,1,0,0,0,0,0,1,0,0,0,0,0,0,0,0,0,0,0,0,0
Казань,К-Центр,2019-12-12T15:44:22+0300," В компанию требуется оператор службы поддержки со знанием английского языка.    Компания занимается обслуживанием сайта, ориентированного на зарубежных (преимущественно европейских) клиентов. В задачи оператора службы поддержки входит консультация клиентов сайта по текущим вопросам посредством email и через лайв чат. Не продажи.    Обязанности:      Консультация клиентов по возникающим вопросам через лайв чат и email.      Требования:      Знание английского языка на хорошем уровне, знание правил деловой переписки на английском языке.   Умение вежливо общаться и решать конфликтные ситуации, стрессоустойчивость.   Владение итальянским, польским или греческим языком (желательно).      Условия:      8-часовой рабочий день.   Работа в офисе.   Обеды оплачиваются.   ",Полная занятость,Сменный график,Нет опыта,|Стрессоустойчивость|Деловое общение|Ответственность|Грамотная речь|Английский язык|Итальянский язык|Польский язык|Греческий язык,,43571.42857142857,,32000.0,оператор службы поддержки со знанием английского языка,"Знание английского языка на хорошем уровне, знание правил деловой переписки на английском языке. Умение вежливо общаться и решать конфликтные ситуации...",Консультация клиентов по возникающим вопросам через лайв чат и email.,0.03333333333333333,0,0,0,1,0,0,0,0,1,0,0,1,0,0,0,0,0,0,1,0,0,0,1,1,1,0,0,0,1,0,1
Казань,Яндекс,2019-12-03T09:14:01+0300," Каждый день миллионы пользователей находят ответы на свои вопросы с помощью Яндекса. Сервису Яндекс.Путешествия нужны внимательные, тактичные и любознательные операторы с чувством юмора — обновлять данные в базах, следить за их верностью и актуальностью.       Что вы будете делать:     совершать звонки по сценарию задания;   обновлять сведения в базе данных.     Для работы потребуются:     грамотный устный и письменный русский язык;   умение работать с большими массивами информации;   навыки уверенной работы на компьютере;   тихое место на время работы;   ноутбук или стационарный компьютер с ОС не ниже Windows 7;   гарнитура;   подключённый кабельный высокоскоростной интернет.     Мы ждем, что вы:     хотите и умеете помогать другим людям;   вежливы, но не занудны;   внимательны к деталям и всегда доводите дело до конца;   не устаёте от однообразных задач;   можете работать дома, не отлынивая и не отвлекаясь на очередной эпизод сериала;   любите узнавать новое;   готовы к насыщенному рабочему дню.     Что мы предлагаем:     работу из дома или любой точки России, где есть стабильный интернет;   бесплатную ip-телефонию;   частичную занятость, гибкий график 4 часа в день 5 дней в неделю (будни) в дневное время с 8 до 20 по Москве;   официальное оформление на работу по совместительству с первого дня обучения;   сдельную оплату;   удалённое оплачиваемое обучение.   ",Частичная занятость,Удаленная работа,Нет опыта,,,43571.42857142857,,46526.315789473694,оператор саll центра,Грамотный устный и письменный русский язык. Умение работать с большими массивами информации. Навыки уверенной работы на компьютере. Тихое место на...,Совершать звонки по сценарию задания. Обновлять сведения в базе данных.,0.3333333333333333,0,0,0,1,0,0,0,0,1,0,0,0,0,0,1,0,0,0,0,1,0,0,0,0,0,0,0,0,0,0,0
Казань,Автодория,2019-12-09T11:38:13+0300," Компания «Автодория» (резидент Сколково и казанского ИТ-парк)   Мы занимаемся разработкой и внедрением систем контроля за соблюдением правил дорожного движения.   Наша цель — сделать безопасным дорожное движение, снизить количество аварий на дорогах и их последствий.    Обязанности:      Мониторинг работы Системы фотовидеофиксации с ежедневной отчетностью   Фиксация, анализ и решение инцидентов – самостоятельно и во взаимодействии с другими линиями технической поддержки;     Требования:     Высшее образование   Опыт работы в сфере тех поддержки   Ответственность и пунктуальность   Умение оперативно работать с объемными данными   Приветствуется опыт работы по внедрению и сопровождению ИС     Условия:     Работа в стабильной IT-компании   Оформление по ТК РФ, полностью белая зарплата   Офис в центре города (ИТ-парк)   График работы: 5/2, с 9 до 18   Офисные вкусняшки   Материальная помощь в значимых жизненных ситуациях   ",Полная занятость,Полный день,От 1 года до 3 лет,|Инженерные системы|Пользователь ПК|Анализ данных,3.0,27000.0,1.0,27000.0,оператор мониторинга,Высшее образование. Опыт работы в сфере тех поддержки. Ответственность и пунктуальность. Умение оперативно работать с объемными данными. Приветствуется опыт работы...,"Мониторинг работы Системы фотовидеофиксации с ежедневной отчетностью. Фиксация, анализ и решение инцидентов – самостоятельно и во взаимодействии с другими линиями технической...",0.13333333333333333,0,0,0,1,0,0,0,0,0,1,0,1,0,0,0,0,0,1,0,0,1,0,0,0,0,0,0,0,0,0,1
Казань,К-Центр,2019-12-13T14:27:00+0300," В компанию требуется оператор службы поддержки со знанием итальянского языка. Компания занимается обслуживанием сайта, ориентированного на зарубежных (преимущественно европейских) клиентов. В задачи оператора службы поддержки входит консультация клиентов сайта по текущим вопросам посредством email и через лайв чат. Не продажи.    Обязанности:      Консультация клиентов по возникающим вопросам через лайв чат и email.      Требования:      Знание итальянского языка на хорошем уровне, знание правил деловой переписки на итальянском языке.   Умение вежливо общаться и решать конфликтные ситуации, стрессоустойчивость.      Условия:      8-часовой рабочий день.   Работа в офисе.   Обеды оплачиваются.   ",Полная занятость,Сменный график,Нет опыта,|Итальянский язык|Грамотность|Деловая переписка|Ответственность|Стрессоустойчивость,,43571.42857142857,,32000.0,оператор службы поддержки со знанием итальянского языка,"Знание итальянского языка на хорошем уровне, знание правил деловой переписки на итальянском языке. Умение вежливо общаться и решать конфликтные ситуации...",Консультация клиентов по возникающим вопросам через лайв чат и email.,0.0,0,0,0,1,0,0,0,0,1,0,0,1,0,0,0,0,0,0,1,0,0,0,0,0,1,0,1,0,1,0,1
