city,company-name,date,description,employment-form,employment-schedule,experience,key_skills,max-experience,max-salary,min-experience,min-salary,name,requirements,responsibilities,days_from_publish,min-salary-group,max-salary-group,city: Екатеринбург,city: Казань,city: Москва,city: Новосибирск,city: Санкт-Петербург,experience: Более 6 лет,experience: Нет опыта,experience: От 1 года до 3 лет,experience: От 3 до 6 лет,employment-form: Полная занятость,employment-form: Проектная работа,employment-form: Стажировка,employment-form: Частичная занятость,employment-schedule: Вахтовый метод,employment-schedule: Гибкий график,employment-schedule: Полный день,employment-schedule: Сменный график,employment-schedule: Удаленная работа,пользователь пк,работа в команде,грамотная речь,деловое общение,стрессоустойчивость,mathcad,грамотность,чтение чертежей,ответственность,креативность,other
Санкт-Петербург,ЭКСПРЕСС,2019-12-04T11:17:04+0300," Вакансия компании ООО Сервис-СГ Строительная организация Северный Город с 2011 года производим и обслуживаем мебель для ванн, кухни, душевые перегородки и кабины, сантехнику, окна, интерьерные двери, натяжные потолки, фреску и обои. Сотрудничество с нашей компанией дает вам конкурентное преимущество в вопросах жилого, общественного и производственного строительства и ремонта.   Обязанности: – Прием входящих звонков, консультация клиентов. – Ведение отчетности. – Исходящие звонки по готовой клиентской базе. – Работа с физическими лицами. – Консультирование клиентов по услугам компании. – Передача заявок в отдел логистики.   Требования: -Пунктуальность. -Грамотная речь, четкая дикция. -Стрессоустойчивость. -Навыки ведения телефонных переговоров будут Вашим преимуществом. -Начальные знания ПК(желательно). -Рассматриваем кандидатов без опыта. -Обучение за счет компании.   Условия работы: -График работы сменный, по договоренности. -Рабочий день с 9:30 до 18:30 с перерывами и обедом. -В офисе в вашем распоряжении оборудованная кухня ( холодильник, микроволновая печь, чайник, кулер и т.п.). -Выходные по графику плавающие. -Заработная плата - оклад + % от товарооборота компании + бонусы. -Выплата 2 раза в месяц. -Дружный коллектив. -Офис рядом с метро. ",Полная занятость,Гибкий график,Нет опыта,,,35000.0,,21000.0,оператор,"Пунктуальность. -Грамотная речь, четкая дикция. -Стрессоустойчивость. -Навыки ведения телефонных переговоров будут Вашим преимуществом. -Начальные знания ПК(желательно). -Рассматриваем кандидатов без...","Прием входящих звонков, консультация клиентов. – Ведение отчетности. – Исходящие звонки по готовой клиентской базе. – Работа с физическими лицами. – Консультирование клиентов по...",0.3,0,0,0,0,0,0,1,0,1,0,0,1,0,0,0,0,1,0,0,0,0,0,0,0,0,0,0,0,0,0,0
Санкт-Петербург,Почта России,2019-12-09T07:01:53+0300,"  Обязанности:      Оказание услуг почтовой связи (прием и вручение почтовых отправлений);   Осуществление денежных переводов;   Выплата пенсий и пособий;   Прием платежей;   Открытие и обслуживание депозитов и кредитов;   Заключение страховых договоров;   Продажа печатной продукции и сопутствующих товаров (лотерейные билеты, открытки, журналы, газеты и многое другое)      Условия :     5/2, начало и окончание работы зависит от режима работы отделения почтовой связи;   Оклад - 20800 рублей, ежемесячная премия от 4000 р + бонусы от продажи товаров и услуг = зп от 31400 р;   Работа в стабильной развивающейся государственной компании;   Возможность работы в районе шаговой доступности от места проживания;   Возможность карьерного роста внутри компании;   Стабильная заработная плата и регулярные дополнительные выплаты (ежемесячные, выплаты за оказание сетевых услуг);   Предоставляем соц.пакет;   Оплата больничных, отпусков, компенсация отдыха в детских лагерях и санаториях, частичная оплата лечения, материальная помощь.       ",Полная занятость,Полный день,Нет опыта,,,44214.285714285725,,31400.0,оператор связи,Без требований,Оказание услуг почтовой связи (прием и вручение почтовых отправлений). Осуществление денежных переводов. Выплата пенсий и пособий. Прием платежей. ,0.13333333333333333,0,0,0,0,0,0,1,0,1,0,0,1,0,0,0,0,0,1,0,0,0,0,0,0,0,0,0,0,0,0,0
Санкт-Петербург,Эксперт-Групп,2019-12-12T16:02:16+0300," В нашу команду в связи с успешным развитием и расширением штата сотрудников открыта вакансия на позицию &quot;Оператор call-центра&quot;.   Наша компания уже имеет множество филиалов по России, успешно развивающихся на рынке, а также штат высококвалифицированных специалистов.   Теперь мы в городе Санкт-Петербург и Вы можете стать частью успешной команды!    Обязанности:      Консультирование потенциальных клиентов о проводимых акциях и услугах компании(теплая база);   Осуществление звонков;   Выполнение плановых показателей;   Ведение отчетности о выполненной работе;   Умение работать с большим объемом информации.      Требования:      Вежливость и клиентоориентированность;   Грамотно поставленная речь;   Презентабельный внешний вид;   Знание ПК на уровне пользователя;   Опыт ведения телефонных переговоров будет вашим преимуществом.      Условия:      Заработная плата от 35000 р.;   Комфортный офис в самом центре города, в одной минуте ходьбы от станции метро Лиговский проспект;   Обучение во время работы;   Стабильный график 5/2, с 10.00 до 19.00;   Успешный и дружный коллектив, ставший уже больше, чем команда в которой Вы станете результативным и добьетесь успехов;   Корпоративные мероприятия, тренинги.     Ждем Ваших резюме или звонка по указанному номеру! ",Полная занятость,Полный день,Нет опыта,,,44214.285714285725,,35000.0,оператор сall центра,Вежливость и клиентоориентированность. Грамотно поставленная речь. Презентабельный внешний вид. Знание ПК на уровне пользователя. Опыт ведения телефонных переговоров будет вашим...,Консультирование потенциальных клиентов о проводимых акциях и услугах компании(теплая база). Осуществление звонков. Выполнение плановых показателей. Ведение отчетности о выполненной...,0.03333333333333333,0,0,0,0,0,0,1,0,1,0,0,1,0,0,0,0,0,1,0,0,0,0,0,0,0,0,0,0,0,0,0
Санкт-Петербург,ГК Филанко,2019-11-27T13:46:40+0300," Обязанности специалиста по работе с операторами связи:       Поиск каналов связи в аренду по запросам отделов продаж;       Ведение переговоров с поставщиками услуг связи, согласование условий;       Согласование и заключение договоров аренды услуг связи;       Контроль процесса организации услуги, приемка услуги;       Корректное ведение контрагентов в CRM;       Ведение работы по оптимизации затрат на аренду транспортных каналов/волокон;       Контроль актуальности используемых услуг от контрагентов;       Своевременное формирование минимальной отчетности.        Наши ожидания:      Опыт работы в сфере телекоммуникаций - обязателен;   Опыт продаж услуг Дата-Центра - желателен.     Вы - наш идеальный кандидат, если Вы - профессионал в своей должности! Коммуникабельный, нацеленный на результат, желающий зарабатывать, знающий и понимающий рынок телекоммуникаций!    Мы предлагаем:      Уровень дохода: оклад + процент от абонентских платежей контрактов, реализованных на арендованных ресурсах + процент с продаж услуг дата-центра;   Возможность профессионального и карьерного развития;   График работы: 5/2, с 9:00 до 18:00; в пятницу с 9:00 до 16:45;   Белая компания: соблюдение норм ТК РФ;   Выплата заработной платы в срок;   Молодой, профессиональный коллектив;   Корпоративные праздники и подарки для сотрудников и детей;   Всегда фрукты/ чай/ кофе в офисе;   Офис в 2-х минутах от метро &quot;Пушкинская&quot;/ &quot;Звенигородская&quot;.          Благодарим Вас за интерес, проявленный к нашей Компании.      Стандартный срок рассмотрения резюме - до 2 дней. Отсутствие ответа в течение этого периода означает, что, к сожалению, мы не готовы предложить Вам данную вакансию.       Ваше резюме останется в нашей базе, и в случае появления подходящей вакансии, мы предложим ее Вам на рассмотрение.   ",Полная занятость,Полный день,От 1 года до 3 лет,|B2B Продажи|аренда каналов связи|Ведение переговоров|Планирование продаж|Прямые продажи|Управление продажами|Телефонные переговоры|Деловое общение|Продажа серверов|Дата-центр,3.0,44214.285714285725,1.0,60000.0,специалист по работе с операторами связи,Опыт работы в сфере телекоммуникаций - обязателен. Опыт продаж услуг Дата-Центра - желателен.,"Поиск каналов связи в аренду по запросам отделов продаж. Ведение переговоров с поставщиками услуг связи, согласование условий. Согласование и заключение...",0.5333333333333333,1,0,0,0,0,0,1,0,0,1,0,1,0,0,0,0,0,1,0,0,0,0,0,1,0,0,0,0,0,0,1
Санкт-Петербург,Айрис,2019-12-09T12:22:58+0300," Обязанности:     Разработка 3D моделей, написание файлов DXF для резки   Работа на лазерных станках 1000х1600 100W по дереву     Требования:     Свободное владение программами для создания 2D и 3D моделей   Умение проектировать сборные модели: шкатулка, чайный домик,..   Опыт работы с деревом, МДФ, фанерой, листовыми пластиками   Опыт работы на лазерных режущих и гравировальных станках     Условия:     Дружный творческий коллектив. Работа в крупной производственно-торговой компании.   Оформление согласно ТК РФ, ОМС   График работы 2/2   Производство располагается рядом со станцией метро «Проспект Просвещения»   Своевременная заработная плата, величина по итогам собеседования.   ",Полная занятость,Сменный график,От 1 года до 3 лет,,3.0,45000.0,1.0,30000.0,оператор лазерного станка с чпу,"Свободное владение программами для создания 2D и 3D моделей. Умение проектировать сборные модели: шкатулка, чайный домик,.. ","Разработка 3D моделей, написание файлов DXF для резки. Работа на лазерных станках 1000х1600 100W по дереву.",0.13333333333333333,0,0,0,0,0,0,1,0,0,1,0,1,0,0,0,0,0,0,1,0,0,0,0,0,0,0,0,0,0,0,0
Екатеринбург,"Монетка, Торговая сеть",2019-12-06T13:53:12+0300," Обязанности:     Работа с документами, обработка заявок и загрузка данных в систему;   Создание возвратных ВСД, коммуникации с контарагентами по системе Меркурий;   Ведение базы данных подразделений.     Требования:     Знание Ехсеl;   Умение работать с массивами данных.     Условия:       Место работы БК &quot;ДЕЛОВОЙ КВАРТАЛ&quot;;       Доставка служебным транспортом;       Стандартная пятидневная рабочая неделя, нормированный день с 9:00 до 18:00;       Работа в крупной развивающейся компании.     ",Полная занятость,Полный день,Нет опыта,|Работа с базами данных,,30000.0,,25000.0,аналитик оператор пк,Знание Ехсеl. Умение работать с массивами данных.,"Работа с документами, обработка заявок и загрузка данных в систему. Создание возвратных ВСД, коммуникации с контарагентами по системе Меркурий. ",0.23333333333333334,0,0,1,0,0,0,0,0,1,0,0,1,0,0,0,0,0,1,0,0,0,0,0,0,0,0,0,0,0,0,1
Екатеринбург,"МОТИВ, телекоммуникационная группа",2019-11-25T07:52:43+0300,"  Телекоммуникационная группа МОТИВ  — один из ведущих представителей телекоммуникационной сферы на территории УрФО, Курганской области, ХМАО и ЯНАО. Мы существуем на рынке услуг сотовой связи уже более 20 лет! Вы можете стать частью большой команды единомышленников. Приглашаем Вас на вакантную должность  Оператор call-центра !    Требования:      Образование: средне-специальное, неоконченное высшее, высшее;   Уверенный пользователь ПК;   Умение построить диалог/контакт с людьми;   Способность работать в режиме многозадачности;   Уверенный голос, четкое произношение;   Искреннее желание и готовность помочь клиенту в сложных ситуациях;   Опыт работы не обязателен, мы всему научим!      Обязанности:      Прием входящих обращений;   Консультирование клиентов в он-лайн чате и мессенджерах;   Помощь потенциальным и действующим клиентам в получении необходимой информации;   Подключение\отключение услуг Компании;   Сбор обратной связи и выявление уровня удовлетворенности клиентов качеством оказания услуг и обслуживанием.      Условия работы:      Официальное трудоустройство по ТК РФ;   Стабильная &quot;белая&quot; заработная плата (оклад + премиальная часть, дающая возможность влиять на свой заработок);   Социальный пакет;   Возможность совмещения работы с учебой;   Компенсация мобильной связи, корпоративные скидки.    А также:    Дружный коллектив;   Корпоративный университет;   Возможность карьерного, профессионального и материального роста;   Насыщенная корпоративная жизнь (праздники, поездки, конференции и пр.).   ",Полная занятость,Сменный график,Нет опыта,,,37333.333333333336,,55909.09090909091,оператор сall центра,"Образование: средне-специальное, неоконченное высшее, высшее. Уверенный пользователь ПК. Умение построить диалог/контакт с людьми. Способность работать в режиме многозадачности. ",Прием входящих обращений. Консультирование клиентов в он-лайн чате и мессенджерах. Помощь потенциальным и действующим клиентам в получении необходимой информации. ,0.6,1,0,1,0,0,0,0,0,1,0,0,1,0,0,0,0,0,0,1,0,0,0,0,0,0,0,0,0,0,0,0
Екатеринбург,Консалтинг Групп,2019-12-11T16:18:40+0300," Обязанности:     Работа на Станках SM 2072S3, SM 2026F3, SM 2025F3 токарная группа, стойки SIEMENS, токарная обработка торцов деталей трубы (отводы, муфты)     Требования:     Опыт в нарезки фасок , работа с черным металлом.   Обязательно должен уметь читать чертежи.   Умение разбираться в режущем инструменте и проводить подналадку станка. (Работа чистовая).     Условия:    Работа вахтовым методом в городе Челябинск на трубном заводе.      Официальное трудоустройство по ТК РФ   Предоставление проживания для иногородних в квартирах   Еженедельные авансы   Спецкомплект предоставляется   Компенсация проезда   График работы : 6/1 , воскресенье выходной   ",Полная занятость,Полный день,От 3 до 6 лет,|Точность и внимательность к деталям,6.0,37333.333333333336,3.0,80000.0,оператор станков с чпу,"Опыт в нарезки фасок , работа с черным металлом. Обязательно должен уметь читать чертежи. Умение разбираться в режущем инструменте и проводить...","Работа на Станках SM 2072S3, SM 2026F3, SM 2025F3 токарная группа, стойки SIEMENS, токарная...",0.06666666666666667,1,0,1,0,0,0,0,0,0,0,1,1,0,0,0,0,0,1,0,0,0,0,0,0,0,0,0,0,0,0,1
