Красноярск,"Армада, группа компаний",2019-10-20T14:37:36+0300,"  Требуется продавец-консультант в фирменный салон ТЕЛЕ2      Стань частью яркой и интересной команды!      П  – приходи  Р  – развивайся  О  –обучайся  С  – совершенствуйся  Т  – твори  О  – открывайся новому вместе с ТЕЛЕ2    Требования к тебе:      энтузиазм и открытость новым знаниям;   желание работать и развиваться;   среднее образование      Гарантии от нас:      стабильность и уверенность в завтрашнем дне;   высокий уровень дохода и возможность роста;   ежемесячные премии по итогам твоей работы;   спец-предложения для сотрудников и бесплатная корпоративная связь;   комфортный салон рядом с твоим домом;   официальное трудоустройство и полный соц. пакет      Что будешь делать ты:      общаться и консультировать наших клиентов и абонентов;   продавать услуги сотового оператора ТЕЛЕ2, мобильные телефоны, аксессуары и портативную цифровую технику по выгодным ценам;   участвовать в различных акциях нашей розничной сети   График работы 4/2, полный день.      Ты все еще думаешь? Смелей! Не упусти свой шанс построить карьеру и найти себя в ТЕЛЕ2!   У нас ты станешь частью дружной команды и сможешь реализовать себя и свой потенциал!     Ты знаешь, что можешь!       ",Полная занятость,Полный день,Нет опыта,|Материальная ответственность|Обучение и развитие|Развитие продаж|Активные продажи|Работа в команде|Ориентация на результат|Прямые продажи|Навыки продаж|1С: Торговля,,45000.0,,25000.0,продавец консультант в фирменный салон связи теле2,Энтузиазм и открытость новым знаниям. Желание работать и развиваться. Среднее образование.,"Общаться и консультировать наших клиентов и абонентов. Продавать услуги сотового оператора ТЕЛЕ2, мобильные телефоны, аксессуары и портативную цифровую технику...",0.2,0.0,1.0,0.0,0.0,0.0,0.0,0.0,0.0,0.0,1.0,0.0,0.0,0.0,0.0,0.0,0.0,0.0,1,0,0,0,0,0,1,0,0,1,0,0,0,0,0,1,0,0,1,1,0,0,0,1,1,1,1,1,1
Красноярск,Дилер 24,2019-10-25T05:18:39+0300,"  В крупную дилерскую компанию, работающую на рынке сотовой связи, требуется сотрудник на должность продавца-консультанта сотовой связи Мегафон.     Адрес магазина:  г. Красноярск, Металлургов проспект, ТД &quot;Мост&quot;    Вы получаете:      Удобный график работы;   Оплачиваемую стажировку;   Мы вас не бросим на момент стажировки, присутствует система обучения и наставничества;   Скидки на ассортимент товара;   Премия и бонусы по результатам работы;   Молодой дружный коллектив;   Участие в корпоративных мероприятиях;   Возможность стать управляющим торговой точкой в первые полгода работы.      Вы нам подходите если:      Образование среднее;   Вы имеете желание работать и зарабатывать;   Коммуникабельность и легкообучаемость;   Рассматриваем как опытных специалистов, так и новичков без опыта работы – обучим!      Вы будете заниматься:      Продажа мобильных телефонов, цифровой техники и аксессуаров;   Консультирование клиентов по продуктам и услугам компании (тарифы, мобильный интернет);   Проведение абонентских процедур (замена сим-карт, детализация счета, переоформление договоров и т. д.);   Прием платежей, работа с кассой.      Самое главное это:      Своевременная заработная плата (от 25 тыс. руб, оклад, премии, процент от продаж, потолка нет);   Оформление по ТК РФ (мед. страхование, ежегодный отпуск, больничные листы).      Сделать первый шаг очень просто, оставьте отклик по нашей вакансии, и мы свяжемся с вами в ближайшее время, чтобы пригласить на собеседование. Мы ждем именно Вас в нашу команду.  ",Полная занятость,Сменный график,Нет опыта,,,45000.0,,25000.0,продавец консультант в салон связи мегафон,"Образование среднее. Вы имеете желание работать и зарабатывать. Коммуникабельность и легкообучаемость. Рассматриваем как опытных специалистов, так и новичков без опыта...","Продажа мобильных телефонов, цифровой техники и аксессуаров. Консультирование клиентов по продуктам и услугам компании (тарифы, мобильный интернет). Проведение абонентских процедур...",0.03333333333333333,0.0,1.0,0.0,0.0,0.0,0.0,0.0,0.0,0.0,1.0,0.0,0.0,0.0,0.0,0.0,0.0,0.0,1,0,0,0,0,0,1,0,0,1,0,0,0,0,0,0,1,0,0,0,0,0,0,0,0,0,0,0,1
Красноярск,Дилер 24,2019-10-25T05:18:40+0300,"  В крупную дилерскую компанию, работающую на рынке сотовой связи, требуется сотрудник на должность продавца-консультанта сотовой связи МТС.     Адрес магазина:  г. Красноярск, Металлургов проспект, ТД &quot;Мост&quot;    Вы получаете:      Удобный график работы;   Оплачиваемую стажировку;   Мы вас не бросим на момент стажировки, присутствует система обучения и наставничества;   Скидки на ассортимент товара;   Премия и бонусы по результатам работы;   Молодой дружный коллектив;   Участие в корпоративных мероприятиях;   Возможность стать управляющим торговой точкой в первые полгода работы.      Вы нам подходите если:      Образование среднее;   Вы имеете желание работать и зарабатывать;   Коммуникабельность и легкообучаемость;   Рассматриваем как опытных специалистов, так и новичков без опыта работы – обучим!      Вы будете заниматься:      Продажа мобильных телефонов, цифровой техники и аксессуаров;   Консультирование клиентов по продуктам и услугам компании (тарифы, мобильный интернет);   Проведение абонентских процедур (замена сим-карт, детализация счета, переоформление договоров и т. д.);   Прием платежей, работа с кассой.      Самое главное это:      Своевременная заработная плата (от 25 тыс. руб, оклад, премии, процент от продаж, потолка нет);   Оформление по ТК РФ (мед. страхование, ежегодный отпуск, больничные листы).      Сделать первый шаг очень просто, оставьте отклик по нашей вакансии, и мы свяжемся с вами в ближайшее время, чтобы пригласить на собеседование. Мы ждем именно Вас в нашу команду.  ",Полная занятость,Сменный график,Нет опыта,,,45000.0,,25000.0,продавец консультант в салон связи мтс,"Образование среднее. Вы имеете желание работать и зарабатывать. Коммуникабельность и легкообучаемость. Рассматриваем как опытных специалистов, так и новичков без опыта...","Продажа мобильных телефонов, цифровой техники и аксессуаров. Консультирование клиентов по продуктам и услугам компании (тарифы, мобильный интернет). Проведение абонентских процедур...",0.03333333333333333,0.0,1.0,0.0,0.0,0.0,0.0,0.0,0.0,0.0,1.0,0.0,0.0,0.0,0.0,0.0,0.0,0.0,1,0,0,0,0,0,1,0,0,1,0,0,0,0,0,0,1,0,0,0,0,0,0,0,0,0,0,0,1
Тюмень,Розничная сеть МТС,2019-10-18T08:47:07+0300," МТС сегодня – ведущая компания в России по предоставлению цифровых услуг: от мобильной связи, домашнего интернета и ТВ до развлекательных приложений, финансовых сервисов и даже киберспорта.   Розничная сеть МТС – это более 5 000 салонов связи от Калининграда до Владивостока, более 20 000 сотрудников, 100 млн абонентов в России и СНГ.    Стань частью нашей команды!     СВОЕМУ НОВИЧКУ МЫ ГАРАНТИРУЕМ:     Деньги:  Платим зарплату официально, стабильно, вовремя и 2 раза в месяц. А наша понятная система бонусов позволяет зарабатывать больше. Границ нет, все зависит только от тебя!    Комфортный график:  О графике ты будешь знать заранее и сможешь планировать свое свободное время.    Удобное расположение:  Ты сам выбираешь в каком салоне связи будешь работать. Это крутая возможность работать рядом с домом и экономить время на дорогу.    Учиться в удовольствие:  У МТС есть свой университет – это не обычный вуз, это намного круче. Учишься дистанционно, у лучших экспертов. И, конечно же, обучение для сотрудников МТС бесплатное.    Строить карьеру вместе:  У каждого сотрудника нашей компании есть возможность реально построить свою карьеру. Ты можешь стать экспертом по цифровым сервисам, гуру продаж или управлять офисом. Мы поддержим любое твое начинание!    Сообщество, а не просто коллектив:  Наши сотрудники дружат не только на работе, у нас множество общих интересов и увлечений, а руководители — с вами на одной волне. А победа в программе «Эволюция: Путь героя» дает возможность путешествовать вместе с лучшими сотрудниками в самые интересные уголки мира.    Приятные бонусы:  Бесплатная сотовая связь – общайся со своими, сколько захочешь. Твое здоровье – наша забота, поэтому мы выдаем ДМС (со стоматологией). Давно мечтаешь о переезде в другой город? Легко! Город мечты, любимая работа, комфортное жилье – с МТС у тебя будет все! А еще у МТС много друзей, они дают нам много скидок и спецпредложений (спорт, развлечения, услуги и др.).    ВЗАМЕН – ТВОЯ ЗАБОТА О НАШИХ КЛИЕНТАХ     Обязанности просты:     Общаться с клиентами, рассказывать о продуктах и услугах,   Продавать гаджеты и аксессуары,   Работать с кассой и вести внутреннюю отчетность     Одним словом, делать клиента довольным и счастливым. А если счастлив клиент – счастлив и ты! Это наша общая цель!    Хочешь к нам? Отправляй резюме или звони! Наши контакты в «Контактной информации».    # начинающий специалист # продавец консультант # специалист по продажам # менеджер по работе с клиентами # салон связи # кассир # сотовая связь # продавец без опыта ",Полная занятость,Полный день,Нет опыта,|Грамотная речь|Пользователь ПК|Работа в команде,,51000.0,,38000.0,продавец в салон связи,,"Общаться с клиентами, рассказывать о продуктах и услугах. Продавать гаджеты и аксессуары. Работать с кассой и вести внутреннюю отчетность.",0.26666666666666666,0.0,1.0,0.0,0.0,0.0,0.0,0.0,0.0,0.0,0.0,1.0,0.0,0.0,0.0,0.0,0.0,0.0,0,0,0,0,1,0,1,0,0,1,0,0,0,0,0,1,0,0,1,0,1,1,0,0,0,0,0,0,1
Тюмень,Сеть салонов сотовой связи ИЗЮМ и Теле 2,2019-10-25T16:36:10+0300,"  Цели и задачи ?!    Продавать мобильное оборудование; Продавать дополнительные услуги (настройка, создание аккуаунтов и подобное) Подключение абонентов к раз-ым операторам сотовой связи.    Наш кандидат ?!    Ориентирован на достойный доход; Настойчив в достижении своих целей Активная жизненная позиция и позитивный взгляд на мир; Соблюдает стандарты и правила в работе.    Условия работы ?!    Работа в салоне связи; Гибкий график работы; Корпоративное обучение; Скидки на товары, авиа- и ж/д билеты; Лучшие мотивационные программы с возможностью поездок по всему миру; Оформление по ТК РФ. ",Полная занятость,Полный день,Нет опыта,,,80000.0,,27857.142857142862,продавец консультант tele2,Активная жизненная позиция и позитивный взгляд на мир.,"Продавать мобильное оборудование. Продавать дополнительные услуги (настройка, создание аккуаунтов и подобное). Подключение абонентов к раз-ым операторам сотовой связи. ",0.0,0.0,1.0,0.0,0.0,0.0,0.0,0.0,0.0,0.0,0.0,0.0,1.0,0.0,0.0,0.0,0.0,0.0,0,0,0,0,1,0,1,0,0,1,0,0,0,0,0,1,0,0,0,0,0,0,0,0,0,0,0,0,1
Тюмень,Розничная сеть МТС,2019-10-25T08:11:53+0300," МТС сегодня – ведущая компания в России по предоставлению цифровых услуг: от мобильной связи, домашнего интернета и ТВ до развлекательных приложений, финансовых сервисов и даже киберспорта.   Розничная сеть МТС – это более 5 000 салонов связи от Калининграда до Владивостока, более 20 000 сотрудников, 100 млн абонентов в России и СНГ.    Стань частью нашей команды!     СВОЕМУ НОВИЧКУ МЫ ГАРАНТИРУЕМ:     Деньги:  Платим зарплату официально, стабильно, вовремя и 2 раза в месяц. А наша понятная система бонусов позволяет зарабатывать больше. Границ нет, все зависит только от тебя!    Комфортный график:  О графике ты будешь знать заранее и сможешь планировать свое свободное время.    Удобное расположение:  Ты сам выбираешь в каком салоне связи будешь работать. Это крутая возможность работать рядом с домом и экономить время на дорогу.    Учиться в удовольствие:  У МТС есть свой университет – это не обычный вуз, это намного круче. Учишься дистанционно, у лучших экспертов. И, конечно же, обучение для сотрудников МТС бесплатное.    Строить карьеру вместе:  У каждого сотрудника нашей компании есть возможность реально построить свою карьеру. Ты можешь стать экспертом по цифровым сервисам, гуру продаж или управлять офисом. Мы поддержим любое твое начинание!    Сообщество, а не просто коллектив:  Наши сотрудники дружат не только на работе, у нас множество общих интересов и увлечений, а руководители — одного с вами возраста и с вами на одной волне. А победа в программе «Эволюция: Путь героя» дает возможность путешествовать вместе с лучшими сотрудниками в самые интересные уголки мира.    Приятные бонусы:  Бесплатная сотовая связь – общайся со своими, сколько захочешь. Твое здоровье – наша забота, поэтому мы выдаем ДМС (со стоматологией). Давно мечтаешь о переезде в другой город? Легко! Город мечты, любимая работа, комфортное жилье – с МТС у тебя будет все! А еще у МТС много друзей, они дают нам много скидок и спецпредложений (спорт, развлечения, услуги и др.).    ВЗАМЕН – ТВОЯ ЗАБОТА О НАШИХ КЛИЕНТАХ     Обязанности просты:     Общаться с клиентами, рассказывать о продуктах и услугах,   Продавать гаджеты и аксессуары,   Работать с кассой и вести внутреннюю отчетность     Одним словом, делать клиента довольным и счастливым. А если счастлив клиент – счастлив и ты! Это наша общая цель!    Хочешь к нам? Отправляй резюме или звони! Наши контакты в «Контактной информации».    # начинающий специалист # продавец консультант # специалист по продажам # менеджер по работе с клиентами # салон связи # кассир # сотовая связь # продавец без опыта ",Полная занятость,Полный день,Нет опыта,|Грамотная речь|Пользователь ПК|Работа в команде,,51000.0,,38000.0,продавец консультант,,"Общаться с клиентами, рассказывать о продуктах и услугах. Продавать гаджеты и аксессуары. Работать с кассой и вести внутреннюю отчетность.",0.03333333333333333,0.0,1.0,0.0,0.0,0.0,0.0,0.0,0.0,0.0,0.0,1.0,0.0,0.0,0.0,0.0,0.0,0.0,0,0,0,0,1,0,1,0,0,1,0,0,0,0,0,1,0,0,1,0,1,1,0,0,0,0,0,0,1
